id,run_id,row_id,title,description,source,category,link,image_url,status,scheduled_at,created_at,updated_at,likes,content,slug,excerpt,meta_title,meta_description,meta_keywords,canonical_url,og_title,og_description,og_image,focus_keyword,is_indexable,is_followable,images
88b4982cb347950db0e4796e8b840d6a,20260207173950,5,SpaceX is hiring to turn Elon Musk's plan for data centers in space a reality,"Elon Musk believes that space is the answer to the AI data center energy problem. SpaceX says it is hiring ""many engineers"" to make it happen.",Business Insider,business,https://www.businessinsider.com/spacex-hiring-elon-musk-data-centers-in-space-2026-2,https://i.insider.com/698642bbe1ba468a96ab96db?width=1200&format=jpeg,published,,2026-02-07T17:39:50.189355,2026-02-07T17:39:50.189355,0,"Every time Lakshmi publishes a story, you’ll get an alert straight to your inbox!
By clicking “Sign up”, you agree to receive emails from Business Insider. In addition, you accept Insider’s Terms of Service and Privacy Policy.
To the world's richest man, all things eventually end in outer space.
As countries pour billions into new Earth-bound data centers in a global race for AI dominance, SpaceX CEO Elon Musk thinks the best way to conserve energy, money, and space is to put data centers in, well, space.
""In the long term, space-based AI is obviously the only way to scale,"" Musk wrote in a memo announcing that SpaceX would acquire his AI company, xAI, earlier this month.
SpaceX says its goal is to launch a ""constellation of a million satellites that operate as orbital data centers,"" and it's now hiring to make it happen. Each will generate about 100 kW of compute power per ton and would add 100 gigawatts of AI compute capacity annually, the company says.
Like many of Musk's ambitious ideas, some have questioned the viability of this one. Musk, typically, is undeterred. He doubled down on the plan this week on the Dwarkesh Podcast.

                          Every time Lakshmi publishes a story, you’ll get an alert straight to your inbox!
                        

                          Stay connected to Lakshmi and get more of their work as it publishes.
                        

                            By clicking “Sign up”, you agree to receive emails from Business Insider. In addition, you accept Insider's
                            Terms of Service and
                            Privacy Policy.
                          
""You can mark my words. In 36 months, but probably closer to 30 months, the most economically compelling place to put AI will be space,"" Musk, who is famous for missing deadlines, said. ""It will then get ridiculously better to be in space.""
Dwarkesh Patel, the host of the eponymous long-form tech podcast (he interviewed Musk for nearly three hours), challenged the SpaceX CEO on his plan to build data centers in space.
Patel said energy use is only about 10% to 15% of the total cost of operating a data center, so while planting data centers in space would solve the cost-of-energy problem, the cost of maintenance and servicing them would presumably erase any savings.
Musk said the plan was not about saving money on energy consumption, but about ensuring energy availability.
""If you look at electrical output outside of China, everywhere outside of China, it's more or less flat,"" Musk replied. ""If you're putting data centers anywhere except China, where are you going to get your electricity?""
Data centers are resource-intensive.
The largest can consume as much power as a city and up to several million gallons of water a day. Collectively, Business Insider estimated in an investigation published last year, that US data centers could soon consume more electricity than Poland, with a population of 36.6 million, used in 2023.
Business Insider's investigation found that companies had filed permits to build 311 data centers nationwide as of 2010. By the end of 2024, that number had nearly quadrupled to 1,240.
As of 2023, about 4.4% of total US electricity consumption came from data centers, according to the Department of Energy. Globally, data centers accounted for about 1.5% of global electricity consumption in 2024, according to the International Energy Agency.
McKinsey and Company estimates that by 2030, data centers will require $6.7 trillion in investment worldwide to keep pace with demand for computing power.
The need for data centers is driving enormous spending among the big AI companies. Capital expenditures for Big Tech are expected to reach some $600 billion in 2026, with Amazon alone planning to spend $200 billion.
SpaceX has already started hiring for its space-based data center project.
Michael Nicolls, the vice president of Starlink Engineering, wrote in a post on X on Friday that the company is hiring for ""many critical engineering roles"" to develop space-bound data centers. One of them is for a ""Space Lasers Engineer"" based out of Redmond, Washington.
Locating data centers in space might appeal to the communities, like Northern Virginia, where electricity costs are growing and housing developments are vying with data centers for land.
For Musk, the idea is simple. ""I mean, space is called 'space' for a reason,"" he wrote in SpaceX's memo.
SpaceX did not immediately respond to a request for comment from Business Insider.
Subscribers get unlimited access to:",spacex-is-hiring-to-turn-elon-musks-plan-for-data-,"Every time Lakshmi publishes a story, you’ll get an alert straight to your inbox!
By clicking “Sign up”, you agree to receive emails from Business Insider. In addition, you accept Insider’s Terms of S...",SpaceX is hiring to turn Elon Musk's plan for data centers in space a reality,"Elon Musk believes that space is the answer to the AI data center energy problem. SpaceX says it is hiring ""many engineers"" to make it happen.",,https://www.businessinsider.com/spacex-hiring-elon-musk-data-centers-in-space-2026-2,SpaceX is hiring to turn Elon Musk's plan for data centers in space a reality,"Elon Musk believes that space is the answer to the AI data center energy problem. SpaceX says it is hiring ""many engineers"" to make it happen.",https://i.insider.com/698642bbe1ba468a96ab96db?width=1200&format=jpeg,,True,True,"data:image/svg+xml,%3Csvg xmlns='http://www.w3.org/2000/svg' viewBox='0 0 1 1'%3E%3C/svg%3E"
1b5a97571bb5139ea8e0ff66bc618cff,20260207173954,6,Why fiber content is everywhere now (except in my own actual diet),"Fiber is the hottest new trend in the grocery stores and online. Finally, we're embracing a little toilet humor — and reality.",Business Insider,business,https://www.businessinsider.com/fiber-fibermaxxing-raisin-bran-super-bowl-ad-william-shatner-2026-2,https://i.insider.com/6986135ea645d1188188d737?width=1200&format=jpeg,published,,2026-02-07T17:39:54.780550,2026-02-07T17:39:54.780550,0,"Every time Katie publishes a story, you’ll get an alert straight to your inbox!
By clicking “Sign up”, you agree to receive emails from Business Insider. In addition, you accept Insider’s Terms of Service and Privacy Policy.
Just how much has it permeated our society? Well, how about a Super Bowl ad: Raisin Bran will run a Super Bowl ad this weekend starring William Shatner as the pitchman ""Will Shat,"" extolling the virtues of the bran flakes.
The ad leans into the truth about Raisin Bran that, for decades, it tried to obscure with messaging about its plentiful raisin content: This cereal makes you poop.
I'll admit: I laughed. I can't deny a good poop joke, and its frankness about the reason some people enjoy bran cereal reminded me of my favorite SNL sketches for ""Colon Blow"" cereal.
Kellogg's ad taps into a broader cultural zeitgeist where fiber is the hottest new thing. Well, sure, fiber isn't new — but the way people are talking about fiber is. And perhaps you've noticed … people can't stop talking about fiber.
On social media, wellness and fitness influencers talk about ""fibermaxxing,"" a new trend of focusing on fiber content. If the last few years seemed to be all about reminding people to get more protein, suddenly the focus has shifted to fiber.

                          Every time Katie publishes a story, you’ll get an alert straight to your inbox!
                        

                          Stay connected to Katie and get more of their work as it publishes.
                        

                            By clicking “Sign up”, you agree to receive emails from Business Insider. In addition, you accept Insider's
                            Terms of Service and
                            Privacy Policy.
                          
Big food companies are taking notice, too. PepsiCo's CEO Ramon Laguarta said in a recent earnings call that ""fiber will be the next protein."" It's planning to launch new fiberful versions of Propel water and Starbucks packaged drinks, as well as add fiber to snacks like Sun Chips, PopCorners, and Smartfood. Coca-Cola is also exploring adding fiber to sodas (there's already a Diet Coke with fiber available in Japan).
McDonald's CEO made a video predicting food trends for 2026, including that fiber will be ""big."" This made me slightly concerned that if McDonald's comes out with some sort of fiber-intensive new dish, our nation's sewers and pipes will not be able to handle the onslaught.
But it's not just that we might be eating McFiber fries washed down with a fiber Diet Coke soon. There's something inescapable in the air about fiber lately, and it's not shying away from the obvious results of getting a fiber-rich diet. (Going to the bathroom.)
Fiber, of course, isn't new (the original Raisin Bran cereal was invented in 1925 in Omaha). But there has been a recent new focus on its health benefits as colon cancer is on the rise in younger people, and as a needed complement to high-protein diets recommended for people on GLP-1s.
This Fart Maxx Mocktail recipe is designed to maximize fart volume and stench: 1/2 can bean water  1/2 pouch Liquid Salad by @drinkliquidplus  1 tbsp kimchi water 2 tbsp okra water  2 tbsp garlic juice  Top off with @topochicousa  Sweet, salty, sour, spicy all at once. Enjoy responsibly. #fartmaxxing #CapCut 
To understand the shift, I talked to ""Fiber Daddy,"" aka Alan Lin, whose TikTok account has nearly 100,000 followers who watch him consume massive fiber quantities and talk about ""fart maxxing.""
Lin, 35, is the founder of Liquid Plus, a line of fiberful juice squeeze pouches called Liquid Salad, and his funny videos serve as promotion for his product, which sells on Amazon and TikTok Shop.
Lin told me he's noticed that people online are talking more and more about fiber, and that the way they're doing it has changed.
""The reason why fiber felt like it was for old people is because all of the brands and products were presented as for old people,"" Lin told me. Lin said that although he's noticed some Gen Z fans, his core audience is millennials. Which makes sense — people in their 30s and 40s are starting to care more about their health. As an unnamed coworker said to me recently, once you start caring about fiber, you know you're old.
Lin's interest in fiber and gut health is real, but he's embracing the fact that people are reveling in the scatalogical humor of his fartmaxxing posts.
""I am a nerd for all this stuff, but I also just am just silly,"" he said. ""My sense of humor has not matured since seventh grade.""
Mine hasn't either, even if I've also reached the age where I am trying to get more fiber in my diet.
Subscribers get unlimited access to:",why-fiber-content-is-everywhere-now-(except-in-my-,"Every time Katie publishes a story, you’ll get an alert straight to your inbox!
By clicking “Sign up”, you agree to receive emails from Business Insider. In addition, you accept Insider’s Terms of Ser...",Why fiber content is everywhere now (except in my own actual diet),"Fiber is the hottest new trend in the grocery stores and online. Finally, we're embracing a little toilet humor — and reality.",,https://www.businessinsider.com/fiber-fibermaxxing-raisin-bran-super-bowl-ad-william-shatner-2026-2,Why fiber content is everywhere now (except in my own actual diet),"Fiber is the hottest new trend in the grocery stores and online. Finally, we're embracing a little toilet humor — and reality.",https://i.insider.com/6986135ea645d1188188d737?width=1200&format=jpeg,,True,True,"data:image/svg+xml,%3Csvg xmlns='http://www.w3.org/2000/svg' viewBox='0 0 1 1'%3E%3C/svg%3E"
2bc4d40378b20809650470a457825f4e,20260207173958,7,A couple built a $1 million business turning shipping containers into vacation homes. Here's how they decided when to stop growing.,"A couple started The Box Hop, a shipping container vacation home business. They are making $1 million in revenue but have decided not to expand.",Business Insider,business,https://www.businessinsider.com/shipping-container-vacation-home-rentals-business-scaling-box-hop-2026-2,https://i.insider.com/6983961fa645d1188188aef2?width=1200&format=jpeg,published,,2026-02-07T17:39:58.333876,2026-02-07T17:39:58.333876,0,"Every time Lauren publishes a story, you’ll get an alert straight to your inbox!
By clicking “Sign up”, you agree to receive emails from Business Insider. In addition, you accept Insider’s Terms of Service and Privacy Policy.
There are several reasons to visit Hocking Hills, a foliage-rich region in the Appalachian foothills of Ohio: the majestic views, year-round outdoor adventures, and the chance to escape overwhelming city life.
The six shipping container homes dotting the region are another.
""Right now, I feel like the big push is experiential hospitality for people. It's no longer just staying at an Airbnb,"" Emily, 38, told Business Insider. ""What does it look like? What does it feel like? What's the experience like when you're there?""
While shipping containers might conjure visions of warehouses or loading docks, Seth and Emily Britt believed they could create a successful business transforming the storage units into modern vacation destinations. They earned over $1 million in revenue last year through their business, The Box Hop, which launched in 2018.
""When Emily and I were dating, I mentioned to her that someday I want to build a house out of shipping containers,"" Seth, 36, told Business Insider. ""Then she actually brought it back up in 2017, like, 'Hey, why don't we do that and chase that dream down?'""

                          Every time Lauren publishes a story, you’ll get an alert straight to your inbox!
                        

                          Stay connected to Lauren and get more of their work as it publishes.
                        

                            By clicking “Sign up”, you agree to receive emails from Business Insider. In addition, you accept Insider's
                            Terms of Service and
                            Privacy Policy.
                          
Now, they have six vacation rentals and a wedding venue called The Seventy Five Venue. The couple also expanded their services to include construction, interior design, and cleaning.
However, building their real estate portfolio involved making tough calls, including making the decision to downsize.
""I thought by now we would have a lot more properties, but I'm really glad we're where we're at because you can grow so much that you implode,"" Seth said.
Scaling a business is a tricky feat that has stumped major companies like WeWork, let alone small, family-owned operations trying to do the same thing.
They built their first rental home in 2018 by placing two shipping containers side by side and setting a third container on top, with the third facing the opposite direction. The three-bedroom, two-bathroom home has a rooftop patio, hot tub, full kitchen, and access to 18.5 acres of land.
""As soon as we built The OG, we were booked 100% every night for two years, and we booked out in advance a year,"" Seth said. ""We quickly realized we needed to increase the supply just to try to keep up with the demand.""
Building more vacation rentals in Hocking Hills was a natural step, but Emily and Seth also set their sights on new horizons: North Carolina and Michigan. The couple purchased the properties in 2021 and 2022, respectively.
""We're dreamers and were ready to jump into the next thing headfirst,"" Emily said.
Preparing to scale took several steps, including applying for a loan, purchasing the properties, and gaining approval to move forward with the projects. While most business owners might have cheered and gone full steam into the expansion, Seth and Emily hesitated.
""The only thing that stopped us was the fact that the interest rates were so high,"" Emily said. ""It would almost be a wash for the business. There wasn't a lot of profit there, so it would have to run extremely lean, and it would not be for a huge amount of return.""
Plus, Emily and Seth live in Ohio, meaning they would likely have to pay other companies to maintain their properties, squeezing the budget and profits even more.
When business owners get caught at a crossroad like this, Seth said it's important to start with the question ""why?""
""Is it just to make more money? What's the point? "" Seth asked.
As enticing as branching out seemed, they ultimately sold the North Carolina property in 2023 and the Michigan property in 2025.
""We were super proud that we got it that far and had the option to continue, but in order to pace properly and not bite off more than we could chew, we said, 'Okay, it's not the time for that approach. We're in a critical time to save and profit.'""
Although Emily and Seth stepped back from those two projects, they've continued to push The Box Hop forward.
""People always joke about rentals being passive income. It's not passive, but there's a lot of freedom, fun, and beauty in what we do. She's stuck with me all the time, so it's been good,"" Seth said, referring to Emily.
In addition to more vacation rentals, the couple now wants to offer their interior design and construction services to short-term rental owners across the country.
""We have a business partner that we've been working tirelessly for two years to figure out how do we take The Box Holp and expand it,"" Emily said. ""People from all over the nation and all over the world are saying, 'How do we get one of these?'""
She added: ""We'll play more of the middleman role by bringing all of the pieces of the puzzle together and figuring out how to do it.""
Managing their business is a full-time job, but Emily and Seth wouldn't want it any other way.
""My workweek now is a heck of a lot harder than it was working 40 hours a week in a manufacturing facility, but we have more freedom,"" Seth said. ""We're not missing our kids' sporting events, and we're able to be present. That's been huge.""
Subscribers get unlimited access to:",a-couple-built-a-$1-million-business-turning-shipp,"Every time Lauren publishes a story, you’ll get an alert straight to your inbox!
By clicking “Sign up”, you agree to receive emails from Business Insider. In addition, you accept Insider’s Terms of Se...",A couple built a $1 million business turning shipping containers into vacation homes. Here's how they decided when to stop growing.,"A couple started The Box Hop, a shipping container vacation home business. They are making $1 million in revenue but have decided not to expand.",,https://www.businessinsider.com/shipping-container-vacation-home-rentals-business-scaling-box-hop-2026-2,A couple built a $1 million business turning shipping containers into vacation homes. Here's how they decided when to stop growing.,"A couple started The Box Hop, a shipping container vacation home business. They are making $1 million in revenue but have decided not to expand.",https://i.insider.com/6983961fa645d1188188aef2?width=1200&format=jpeg,,True,True,"data:image/svg+xml,%3Csvg xmlns='http://www.w3.org/2000/svg' viewBox='0 0 1 1'%3E%3C/svg%3E"
f2a5fb4290dbbe2f461413d60475aa74,20260207174001,8,4 fresh ways investors can play the stock market during a software apocalypse,"After a fresh AI scare sent market volatility soaring this week, here are some tips for navigating the chaos from top Wall Street analysts.",Business Insider,business,https://www.businessinsider.com/investing-tips-advice-tech-stock-crash-ai-software-hedge-2026-2,https://i.insider.com/69860113d3c7faef0ecdc359?width=1200&format=jpeg,published,,2026-02-07T17:40:01.473911,2026-02-07T17:40:01.473911,0,"Every time Naomi publishes a story, you’ll get an alert straight to your inbox!
By clicking “Sign up”, you agree to receive emails from Business Insider. In addition, you accept Insider’s Terms of Service and Privacy Policy.
After the chaos of a software-led sell-off that bled into techs stocks at large and dragged the broader market, here are a few strategies from Wall Street pros that might help you navigate the next meltdown. 
The tech-heavy Nasdaq Composite , despite Friday's comeback. The iShares Expanded Tech-Software Sector ETF is down more the 12% in the same period.
But the market rotation is on, and analysts say this week's plunge isn't the end of the bear market. Instead, it is a moment to assess your approach and position for the next big swings. 
Here are four investing strategies from Wall Street experts for investors navigating the latest rotation in stocks.
Piper Sandler analysts highlighted that the tech sell-off marks a rotation into ""old economy"" plays, like cyclical and value sectors.

                          Every time Naomi publishes a story, you’ll get an alert straight to your inbox!
                        

                          Stay connected to Naomi and get more of their work as it publishes.
                        

                            By clicking “Sign up”, you agree to receive emails from Business Insider. In addition, you accept Insider's
                            Terms of Service and
                            Privacy Policy.
                          
""The bull market is intact; however, it's not being led by the popular Tech and Growth favorites of investors. Instead, new momentum and leadership are emerging in cyclical and value sectors—Energy, Industrials, Materials, Staples, and Banks,"" they said.
All four sectors have gained, with energy and consumer staples seeing the stronger returns, while the tech sector plummets.
Goldman Sachs analysts called the downturn a retreat into ""real economy"" industries. 
""The investor search for insulation from AI disruption risk has accelerated the ongoing cyclical rally,"" the wrote. 
Bank of America strategists outlined what they say is the ""perfect hedge"" against an AI bubble.
The analysts, who said that high valuations in the tech sector can't be ignored, flagged what they call ""transition"" investing as the ""perfect"" AI bubble hedge.
As part of this strategy, they listed four ways to ""invest in AI, without investing directly in AI"": Electrification, infrastructure & grid expansion, metals, and defense.
The sell-off is an opportunity to separate the winners and losers of the AI trade, Futurum Group CEO and chief analyst Daniel Newman told Business Insider.
Newman outlined the framework that he's using to identify the winners among AI stocks.
He's looking for companies that are seeing returns on AI spending, building their own chips, monetizing AI for enterprise customers, and exploring physical AI. He highlighted Amazon, Microsoft, Alphabet, ServiceNow, Palantir, and Tesla.
""Companies need to show that the $470+ billion the hyperscalers are spending this year is generating returns. Those that do will be rewarded,"" Newman wrote.
Wedbush's Dan Ives is among Wall Street's biggest tech bulls, so it's comes as no surprise that his tech sell-off playbook is to buy the dip.
Ives said the tech weakness is nothing more than a ""garage sale"" for tech stocks.
""Is AI a headwind in the near-term for software? YES!...however, the magnitude of this software sell-off is a major head scratcher and is factoring in an Armageddon scenario for the sector that is far from reality in our view,"" he wrote amid the week's rout. 
The analyst named five tech stocks investors should think about buying at a discount: Microsoft, Palantir, Snowflake, Salesforce, and CrowdStrike.
Subscribers get unlimited access to:",4-fresh-ways-investors-can-play-the-stock-market-d,"Every time Naomi publishes a story, you’ll get an alert straight to your inbox!
By clicking “Sign up”, you agree to receive emails from Business Insider. In addition, you accept Insider’s Terms of Ser...",4 fresh ways investors can play the stock market during a software apocalypse,"After a fresh AI scare sent market volatility soaring this week, here are some tips for navigating the chaos from top Wall Street analysts.",,https://www.businessinsider.com/investing-tips-advice-tech-stock-crash-ai-software-hedge-2026-2,4 fresh ways investors can play the stock market during a software apocalypse,"After a fresh AI scare sent market volatility soaring this week, here are some tips for navigating the chaos from top Wall Street analysts.",https://i.insider.com/69860113d3c7faef0ecdc359?width=1200&format=jpeg,,True,True,"data:image/svg+xml,%3Csvg xmlns='http://www.w3.org/2000/svg' viewBox='0 0 1 1'%3E%3C/svg%3E"
