id,run_id,row_id,title,description,source,category,link,image_url,status,scheduled_at,created_at,updated_at,likes,content,slug,excerpt,meta_title,meta_description,meta_keywords,canonical_url,og_title,og_description,og_image,focus_keyword,is_indexable,is_followable,images
db34219a81cb0508f4811830af98e958,20260207174005,9,Morningstar says the week's AI-fueled meltdown was a big overreaction—and 2 stocks in particular are now a bargain buy for investors,"The bottom fell out of the sector last week. But fears have become overdone, according to Morningstar, and it's time to start buying.",Business Insider,business,https://www.businessinsider.com/ai-software-stock-picks-to-buy-claude-anthropic-microsoft-morningstar-2026-2,https://i.insider.com/69860ac1d3c7faef0ecdc4a5?width=1200&format=jpeg,published,,2026-02-07T17:40:05.012784,2026-02-07T17:40:05.012784,0,"Every time William publishes a story, you’ll get an alert straight to your inbox!
By clicking “Sign up”, you agree to receive emails from Business Insider. In addition, you accept Insider’s Terms of Service and Privacy Policy.
The outlook quickly became dire for software stocks this week as investors envisioned a world where Anthropic's Claude AI assistant rendered entire companies and IT departments useless.
The bottom fell out of the sector as the iShares Expanded Tech-Software Sector ETF (IGV) fell 19% from January 26 to February 5.
But Morningstar says fears are largely overdone, and the chaotic burst of selling represents a prime dip-buying opportunity. 
""We see little evidence that the bear case is unfolding — retention rates and other software metrics appear solid. In short, we acknowledge the risks but believe the fears are overblown,"" Dan Romanoff, a senior equity analyst at Morningstar, said as the sell-off was still going strong midweek. 
""We do not believe enterprise software customers are going to vibe code internal solutions such that the application vendor's models are threatened en masse,"" he continued. ""There may be some pressure on seat counts, but there is no evidence to show that this is happening—and automation is not a new trend.""

                          Every time William publishes a story, you’ll get an alert straight to your inbox!
                        

                          Stay connected to William and get more of their work as it publishes.
                        

                            By clicking “Sign up”, you agree to receive emails from Business Insider. In addition, you accept Insider's
                            Terms of Service and
                            Privacy Policy.
                          
Software stocks rallied on Friday, with IGV rising 3% and the Nasdaq up more than 2%. 
With such a dramatic sell-off, Romanoff said there are opportunities throughout the software sector. He pointed to two beaten-up stocks in particular that he thinks have ""substantial upside"": Microsoft (MSFT) and ServiceNow (NOW).
Shares of Microsoft and ServiceNow are down 17% and 35% year to date, respectively.
Romanoff has a $600 ""fair value estimate"" for shares of Microsoft, implying upside of 50%, and $200 for ServiceNow, which would represent 100% upside.
Still, he warned of volatility, saying, ""The software landscape is not for the faint of heart at present.""
Despite fears that AI will eat the software industry, Romanoff said investors may be giving the new technology too much credit, and that firms have publicly said they still largely view AI with skepticism.
""For all of the hype, AI products are not generating substantial revenue for software vendors, as management teams fear hallucinations and rogue agents,"" Romanoff said. ""This is supported by disclosures from publicly traded software companies, which generally indicate that AI solutions account for approximately 2% of revenue (or ARR), and further by OpenAI's revenue, which skews heavily toward consumer subscriptions.""
He also drew historical parallels to prior instances of automation that did not cause major disruptions to labor markets.
""Seat counts may be pressured at some point in the future, but we certainly did not see that with sales reps, given the emphasis on automation in Salesforce's revolutionary CRM approach 25 years ago,"" Romanoff said. ""We can also look at headcount, which continues to increase across functional areas. Again, it is certainly possible that these fears may manifest more directly, but they are not occurring at this point.""
Subscribers get unlimited access to:",morningstar-says-the-weeks-ai-fueled-meltdown-was-,"Every time William publishes a story, you’ll get an alert straight to your inbox!
By clicking “Sign up”, you agree to receive emails from Business Insider. In addition, you accept Insider’s Terms of S...",Morningstar says the week's AI-fueled meltdown was a big overreaction—and 2 stocks in particular are now a bargain buy for investors,"The bottom fell out of the sector last week. But fears have become overdone, according to Morningstar, and it's time to start buying.",,https://www.businessinsider.com/ai-software-stock-picks-to-buy-claude-anthropic-microsoft-morningstar-2026-2,Morningstar says the week's AI-fueled meltdown was a big overreaction—and 2 stocks in particular are now a bargain buy for investors,"The bottom fell out of the sector last week. But fears have become overdone, according to Morningstar, and it's time to start buying.",https://i.insider.com/69860ac1d3c7faef0ecdc4a5?width=1200&format=jpeg,,True,True,"data:image/svg+xml,%3Csvg xmlns='http://www.w3.org/2000/svg' viewBox='0 0 1 1'%3E%3C/svg%3E"
e34c232404a8a507260ffcd9ca70b163,20260207174008,10,"I got let go from my job. Now, NFL and college teams pay me for my muddy footballs.","Daniel Kolcun didn't hesitate — the day after he was let go from his job, he founded his company Gridiron Football Prep, and got to work.",Business Insider,business,https://www.businessinsider.com/laid-off-now-make-muddy-footballs-for-nfl-college-teams-2026-2,https://i.insider.com/69864a7aa645d1188188e2cd?width=1200&format=jpeg,published,,2026-02-07T17:40:08.542282,2026-02-07T17:40:08.542282,0,"This as-told-to essay is based on conversations with Daniel Kolcun, owner of Gridiron Football Prep. It has been edited for length and clarity.
I got let go from my job in 2021 as part of a companywide reduction.
At the time, I had been working in football product management at Wilson Sporting Goods, overseeing football products and working with teams, factories, and leather suppliers across college and professional football.
Wherever I went, the same topic of discussion came up: What's the best way to break in a football?
I had been preparing footballs for years as an add-on service within my role for select teams.
During COVID, that service expanded when equipment managers didn't have access to their facilities; they would ask for help, and I'd stay late, come in on weekends, or use downtime to prep footballs so they were ready to use.
Over time, I learned how leather behaves in different weather, which products hold up, how to customize prep options to meet quarterbacks' needs, and which processes are duplicative.
After the layoff, I had teams who were interested in continuing to work with me. So the day after I was let go, I started an LLC for my company, Gridiron Football Prep.
I run Gridiron Football Prep out of my home in New Jersey with my wife, Emily, who handles product development and business operations. The workload is intense. At any given time, there can be hundreds of footballs in different stages of preparation — brushed, conditioned, balmed, mudded, and drying.
When a football leaves the factory, it's missing key elements that prevent it from performing at the highest level. Quarterbacks may find it too slick, too stiff, or inconsistent in moisture, which can affect how the ball feels in their hands. Prepping a football to a quarterback's specific needs, so it feels more worn, tacky, soft, and usable in addition to performing better in different weather conditions.
Every football goes through a custom, multi-step process. There's brushing to open the leather's pores, conditioning to soften it, balming to add controlled tack, heat to bake products into the leather, and mudding to even the surface and help with moisture management.
The mud I use comes from New Jersey. I apply it by hand, so it spreads evenly across the leather and acts as an emulsifier, bringing the ball's natural tack to the surface. It also helps manage moisture and gives the football a more consistent color and feel.
The hands-on work averages at least 30 minutes per ball, but drying time stretches a full batch to about 72 hours. During peak season, I aim to finish roughly 50 footballs a day.
Orders vary. Some college programs send 150 to 200 footballs before a season. Professional teams can go through hundreds over the course of a year. My pricing typically ranges from about $40 to $75 per ball, depending on volume, customization, and turnaround time.
The goal is simple: I don't want the quarterback thinking about the ball. If they're thinking about grip, something went wrong.
Football has been a part of my life for decades. I played the sport through high school and college, then stayed in the space through equipment work and product development roles over the years.
I still watch football like a former player, but now I see it through a different lens — one shaped by deadlines, weather forecasts, and preparation cycles. Most of the time, the work I do doesn't show up on screen because that means the football is performing the way it's supposed to.
Then there's the occasional snap where it matters. That might only be 1%. But sometimes, that 1% is enough to justify building a business around it.
I never made it to the NFL as a player, but this is how I contribute to the game now.","i-got-let-go-from-my-job.-now,-nfl-and-college-tea","This as-told-to essay is based on conversations with Daniel Kolcun, owner of Gridiron Football Prep. It has been edited for length and clarity.
I got let go from my job in 2021 as part of a companywid...","I got let go from my job. Now, NFL and college teams pay me for my muddy footballs.","Daniel Kolcun didn't hesitate — the day after he was let go from his job, he founded his company Gridiron Football Prep, and got to work.",,https://www.businessinsider.com/laid-off-now-make-muddy-footballs-for-nfl-college-teams-2026-2,"I got let go from my job. Now, NFL and college teams pay me for my muddy footballs.","Daniel Kolcun didn't hesitate — the day after he was let go from his job, he founded his company Gridiron Football Prep, and got to work.",https://i.insider.com/69864a7aa645d1188188e2cd?width=1200&format=jpeg,,True,True,"data:image/svg+xml,%3Csvg xmlns='http://www.w3.org/2000/svg' viewBox='0 0 1 1'%3E%3C/svg%3E"
7ee0f61355b270b7d7aa8bc96d34bb94,20260207174012,11,"I'm on top of my finances, but my partner couldn't care less about hers. How do I convince her to take this seriously?","""For Love & Money"" answers your relationship and money questions. This week, a reader is frustrated that his partner's financial avoidance.",Business Insider,business,https://www.businessinsider.com/partner-refuses-personal-finance-planning-goals-saving-investing-money-avoider-2026-2,https://i.insider.com/698508d5e1ba468a96ab8272?width=1200&format=jpeg,published,,2026-02-07T17:40:12.544804,2026-02-07T17:40:12.544804,0,"My partner and I have been together for almost 10 years now. In that time, we have gone on very different personal finance journeys. I have spent the last six or seven years learning how to manage money, including handling debt, saving, and investing for future goals, while my partner has mostly stayed in the same position.
Every time I try to have a serious conversation about future goals, my partner either avoids, deflects, or gets defensive. I've concluded that she is a ""money avoider."" As I get closer to my goals, it's increasingly frustrating to be with someone who doesn't want to participate in working toward my goals. I know that some of my goals are things that she would also love to do, but she still doesn't want to actively engage in our finances to achieve those goals.
It feels as though we're in a canoe going down a river, but I'm the only one paddling. How can I get my partner to engage more with me and our finances?

                          Every time Olivia publishes a story, you’ll get an alert straight to your inbox!
                        

                          Stay connected to Olivia and get more of their work as it publishes.
                        

                            By clicking “Sign up”, you agree to receive emails from Business Insider. In addition, you accept Insider's
                            Terms of Service and
                            Privacy Policy.
                          
For Love & Money answers your relationship and money questions. Looking for advice on how your savings, debt, or another financial challenge is affecting your relationships? Submit your question in this Google form.
One of the most complicated parts of sharing a life with someone is that, as much as we may imagine ourselves as two parts of the same whole, we are still different people growing at different rates and wanting different things. We may romanticize opposites attracting, but forging a life with someone who has different hang-ups, desires, and experiences is hard work.
In our relationships, we often recognize that compromise is the only way forward. Introverts agree to host more parties, even if they believe their partner is a bit socially desperate. Type B individuals learn to use the calendar app on their phones, even if they think it's too rigid a way to live their lives. Health nuts agree to the occasional cheat meal, even if it means an extra workout the next day. In such cases, compromise works because socializing, scheduling, and pizza aren't black-and-white — but some things are. For instance, you're either saving for retirement, or you aren't.
In your letter, you described your dilemma in two different, contradictory ways: you and your partner are at different places in your financial journeys, and you're together in a canoe, with you as the only one paddling. Which is it? Are you going down the river in the same boat, or are you in two separate canoes, and she's failing to keep up?
If you're on separate journeys, all you can do is keep moving forward, with or without her. This may look like staying together and maintaining separate finances. Many couples choose to weave the minutiae of their lives together, aiming to create a beautiful tapestry with their favorite person. Sometimes, though, all this leads to is a tangled mess, and it's perfectly valid to want to keep some parts of your lives, such as your finances, separate, no matter how much you love one another.
However, much like a float trip where you and your partner are in separate canoes, you must remain aware of certain realities, such as differing canoe speeds, varied rower experience, and the fact that even the best outdoors people need support now and then. Or, to drop the analogy for a moment, even if you keep your finances separate, your partner's less fiscally astute and engaged approach will likely still affect you. Learning how to support her without treating her money management style as your burden to bear or a personal attack will be crucial to making separate finances a successful relationship strategy.
But, if you want to be in the same boat — and it sounds like you do — you can teach her how to paddle, even if she's resistant, slow to learn, or not naturally inclined. There may be reasons behind her avoidance. She might be too afraid of the future to plan for it, or others have always handled money issues for her, or she feels overwhelmed and doesn't know where to start.
You can start her paddle lessons by talking about money in the context of an exciting shared future. Start small. Plan a vacation that requires saving together. Don't drench these conversations in financial literacy; instead, focus on the destination and experiences you're both looking forward to. Meanwhile, weave healthy routines into the planning, such as scheduling regular check-ins to review the numbers, having transparent conversations about setbacks and wins, and discussing which travel items you want to prioritize, such as whether flying first class is worth the extra expense.
Build on this foundation to save for things that will bring you closer, like a house, a pet, or shared investment opportunities. Again, keep the focus on the future and treat the finances as a means to that end. Over time, as your healthy routines become easy habits and your shared goals grow more serious, your partner may find that managing money becomes more second nature. She may also discover which personal finance methods work best for herself, which may or may not be the same as yours.
One line from your letter I found puzzling was the one about it being frustrating to be with someone ""who doesn't want to participate in working toward my goals."" Why would she want to work toward your goals? Perhaps it's because, as you said, she doesn't have any of her own. Again, this brings us back to the question: same boat, or separate canoes? If you want to get her invested, you need to help her develop her own goals, as well as identify shared goals that resonate with both of you, rather than you alone.
Six or seven years into your personal finance journey, it's understandable that you'd like a partner who can talk compound interest and Roth IRAs rather than one who needs to be gently shown why financial planning matters in the first place, and have her hand held while she learns how to do it. If you love her, though, she's worth the wait. And based on the 10 years of life you've shared with her and the fact that you asked how you could get her to be more engaged with finances, and not whether to stay with her or not, it's clear you do.
Keep paddling down that river. And remember, the best way to encourage your partner to pick up her oar isn't by only teaching her your favorite techniques, but rather by helping her visualize the destination.
Looking for advice on how your savings, debt, or another financial challenge is affecting your relationships? Write to For Love & Money using this Google form.","im-on-top-of-my-finances,-but-my-partner-couldnt-c","My partner and I have been together for almost 10 years now. In that time, we have gone on very different personal finance journeys. I have spent the last six or seven years learning how to manage mon...","I'm on top of my finances, but my partner couldn't care less about hers. How do I convince her to take this seriously?","""For Love & Money"" answers your relationship and money questions. This week, a reader is frustrated that his partner's financial avoidance.",,https://www.businessinsider.com/partner-refuses-personal-finance-planning-goals-saving-investing-money-avoider-2026-2,"I'm on top of my finances, but my partner couldn't care less about hers. How do I convince her to take this seriously?","""For Love & Money"" answers your relationship and money questions. This week, a reader is frustrated that his partner's financial avoidance.",https://i.insider.com/698508d5e1ba468a96ab8272?width=1200&format=jpeg,,True,True,"data:image/svg+xml,%3Csvg xmlns='http://www.w3.org/2000/svg' viewBox='0 0 1 1'%3E%3C/svg%3E"
8075099706e0b1439a124e67422eec79,20260207174015,12,Ex-Google X leader thinks AI is about to expose a fatal flaw in capitalism,"Mo Gawdat warns AI could disrupt capitalism, as automation replaces human labor, urging a rethink of economic systems for future stability.",Business Insider,business,https://www.businessinsider.com/ex-google-x-exec-mo-gawdat-ai-threatens-ceos-capitalism-2026-2,https://i.insider.com/69862d88e1ba468a96ab92b4?width=1200&format=jpeg,published,,2026-02-07T17:40:15.763196,2026-02-07T17:40:15.763196,0,"Artificial intelligence is colliding with capitalism in a way the system can't absorb. That's what Mo Gawdat told Business Insider's Reem Makhoul over an interview in September.
After decades working inside Big Tech, including senior leadership roles at Microsoft and Google X, Gawdat has come to believe that the economic model underpinning modern capitalism breaks once machines replace most of the human workforce.
""The very base of capitalism, which is labor arbitrage — to hire you for a dollar and then sell what you make for two — is going to disappear,"" he told Business Insider.
In Gawdat's view, AI isn't just automating tasks. It's removing the need for human labor and, eventually, human decision-making at scale.
When that happens, wages, jobs, and consumption — the pillars that keep capitalism running — start to fall apart, he said. However, while we may be in for a rocky ride ahead, the ultimate destination is one worth aiming for.
Capitalism, Gawdat argues, is built on a simple idea: pay people less than the value of what they produce, sell the output for more, and keep the difference. That model depends on human labor.
As machines take on more work, the cost of making things keeps falling. AI pushes production closer and closer to zero cost, Gawdat says.
When that happens, familiar ideas about pricing, profit, and scarcity stop working the way they always have.
You can't run an economy on productivity alone, he added. If people don't earn wages, they can't buy things. And without buyers, the system stalls.
Gawdat is blunt about what he thinks comes next.
He expects large waves of job losses across blue- and white-collar work. Lawyers, analysts, writers, executives — all of them, he said, are exposed.
""Your life and mine will witness times where there will be 20%, 30%, 50% unemployment in certain sectors,"" he said.
He's especially skeptical of tech leaders who frame AI-driven layoffs as efficiency wins. In the long run, he said, AI systems will come for them, too.
""Those CEOs forget that sooner or later the AI will replace them too,"" he said, adding, ""AI is better than humans at every task, including being a CEO.""
What will happen when the capitalist system built around jobs suddenly has far fewer of them?
Without some form of guaranteed income, consumption collapses. And when consumption collapses, capitalism can't function. Governments will be forced to rethink how money flows through society.
""Without consumption, there is no economy,"" he said, adding, ""So they're going to have to give people some kind of income to keep going.""
He thinks different regions will handle this transition differently. Western economies, which place heavy value on productivity and individual output, may struggle the most.
Despite the warnings, Gawdat doesn't see AI itself as dangerous.
He describes intelligence as neutral — powerful, but directionless on its own. The real risk, he said, is what happens during the transition, when AI systems are highly capable but still answering to human incentives built around greed, competition, and power.
""The challenge that humanity faces today is not the rise of AI, it's the rise of AI in an age where humanity is at its lowest morality,"" he said.
Over time, Gawdat believes machines will make more rational decisions than today's political and corporate leaders. That shift, he argues, could ultimately produce a fairer system than the one we have now.
Capitalism, in his view, won't survive in its current form. But that doesn't mean the future has to be bleak.
""It's an invitation to change,"" he said. ""And if you change, you would create not only an opportunity to survive, but an opportunity to thrive.""
Subscribers get unlimited access to:",ex-google-x-leader-thinks-ai-is-about-to-expose-a-,"Artificial intelligence is colliding with capitalism in a way the system can't absorb. That's what Mo Gawdat told Business Insider's Reem Makhoul over an interview in September.
After decades working...",Ex-Google X leader thinks AI is about to expose a fatal flaw in capitalism,"Mo Gawdat warns AI could disrupt capitalism, as automation replaces human labor, urging a rethink of economic systems for future stability.",,https://www.businessinsider.com/ex-google-x-exec-mo-gawdat-ai-threatens-ceos-capitalism-2026-2,Ex-Google X leader thinks AI is about to expose a fatal flaw in capitalism,"Mo Gawdat warns AI could disrupt capitalism, as automation replaces human labor, urging a rethink of economic systems for future stability.",https://i.insider.com/69862d88e1ba468a96ab92b4?width=1200&format=jpeg,,True,True,"data:image/svg+xml,%3Csvg xmlns='http://www.w3.org/2000/svg' viewBox='0 0 1 1'%3E%3C/svg%3E"
