id,run_id,row_id,title,description,source,category,link,image_url,status,scheduled_at,created_at,updated_at,likes,content,slug,excerpt,meta_title,meta_description,meta_keywords,canonical_url,og_title,og_description,og_image,focus_keyword,is_indexable,is_followable,images
089a9e52f787d903fc9b7084d21d2f31,20260207174035,17,Why 'Big Short' investor Michael Burry's pick for the next Warren Buffett is GameStop's Ryan Cohen,"Michael Burry of ""The Big Short"" fame said that Ryan Cohen has the potential to follow Warren Buffett's playbook and build huge value at GameStop.",Business Insider,business,https://www.businessinsider.com/michael-burry-next-warren-buffett-gamestop-ryan-cohen-acquisition-deal-2026-2,https://i.insider.com/69870e48a645d1188188ea7b?width=1200&format=jpeg,published,,2026-02-07T17:40:35.911439,2026-02-07T17:40:35.911439,0,"Every time Theron publishes a story, you’ll get an alert straight to your inbox!
By clicking “Sign up”, you agree to receive emails from Business Insider. In addition, you accept Insider’s Terms of Service and Privacy Policy.
A pet-supplies entrepreneur turned video-game retailer CEO who's been dubbed the ""Meme King"" might seem an unlikely candidate for the next Warren Buffett.
But Michael Burry of ""The Big Short"" fame told Business Insider in a brief email that he sees Chewy cofounder and GameStop CEO Ryan Cohen as Buffett's spiritual successor.
That's because Cohen approaches business and investing in a similar way to Buffett, who retired as Berkshire Hathaway's CEO at the end of last year.
Burry — who shifted from running a hedge fund to writing on Substack late last year — has drawn parallels between Cohen and Buffett, and made the case for applying the Berkshire playbook to GameStop, in recent posts and replies to reader comments.
In a December post, Burry recalled his first phone call with Cohen in October 2019, after both value investors had built sizable stakes in beaten-down GameStop.

                          Every time Theron publishes a story, you’ll get an alert straight to your inbox!
                        

                          Stay connected to Theron and get more of their work as it publishes.
                        

                            By clicking “Sign up”, you agree to receive emails from Business Insider. In addition, you accept Insider's
                            Terms of Service and
                            Privacy Policy.
                          
Cohen said it didn't bother him if an investment took years to pay off, signaling to Burry he was ""more patient than most.""
""I believed he possibly had the temperament to be the next Buffett, but I did not get to know him that well,"" Burry wrote.
Cohen told Business Insider in October 2020 that Buffett was one of the ""two biggest influences on my professional life,"" along with his father.
He credited the legendary investor with shaping his ability to think independently, be greedy when others are fearful, and exercise discipline in capital allocation.
Cohen showed Buffett-style conviction and concentration when, after selling Chewy for more than $3 billion in 2017, he plowed virtually all of his wealth into two Berkshire favorites: Apple and Wells Fargo.
After leaving Chewy, Cohen pivoted to activist investing. He revealed a stake in GameStop in the fall of 2020 and parlayed it into a board seat in January 2021.
His appointment, coupled with Burry's previous endorsement of the stock, helped galvanize retail traders to turn GameStop into the first meme stock of many.
They catapulted the shares up as much as 2,500% by late January 2021, valuing the retailer at $34 billion at the peak — roughly triple its market cap today.
Cohen became GameStop's chairman in June 2021 and was appointed CEO in September 2023. He telegraphed Buffett-like intentions in December 2023, when the board gave the green light for the company to invest in stocks and handed control of its securities portfolio to Cohen.
Signaling his ambitions, GameStop's investor-relations page has been revamped to mimic Berkshire's famously spartan website.
Since taking charge of GameStop, Cohen has urged frugality, one of Buffett's signature values. Cohen doesn't take a paycheck, echoing Buffett, who received a modest $100,000 salary as Berkshire CEO for over 40 years.
Similar to Buffett, who keeps more than 99% of his personal wealth in Berkshire stock, Cohen has significant ""skin in the game"" as GameStop's largest individual shareholder with a roughly 9% stake.
Also like Buffett, Cohen has many loyal and passionate shareholders who trust him to make the right calls. He has capitalized on that support by issuing shares, 0% convertible debt, and short-term warrants, boosting GameStop's cash pile to around $9 billion as of November 1.
""What he has done at GameStop in terms of governance, divestiture, and clever accretive dilution through capital raises strikes me as a decent throwback model of Buffett,"" Burry wrote on Substack.
Understanding what Cohen is cooking up, and why Burry sees shades of Buffett, requires some knowledge of Berkshire's history.
Over six decades, Buffett transformed Berkshire from a failing textile mill into a $1 trillion conglomerate that owns scores of businesses, including Geico and BNSF Railway, and holds multibillion-dollar stakes in Coca-Cola, American Express, and other public companies.
Buffett and his late business partner, Charlie Munger, structured Berkshire as a web of decentralized, autonomous businesses to allow them to focus on allocating capital between subsidiaries, outside investments such as stocks, and other deals.
They also acquired insurers such as National Indemnity that generate ""float"" — cash left over after premiums are collected and claims are paid — which they used to make further acquisitions and investments.
As Berkshire expanded, it became harder for Buffett to find needle-moving deals, forcing him to spend more and more of his time ""elephant hunting.""
Similarly, Cohen has said in recent days that he's seeking to make a ""transformational"" acquisition. He told The Wall Street Journal that he wants to grow GameStop's market value from about $11 billion today to more than $100 billion, and has a deal in mind that's ""either going to be genius or totally, totally foolish.""
Cohen told CNBC that he envisioned GameStop buying a much larger company than itself — one that's undervalued, high quality, and has ""sleepy"" management. He said the right transaction could pave the way for GameStop's valuation to reach ""several hundreds of billions"" over time.
Burry wrote on Substack that he expects Cohen to strike deals that will ""fundamentally change"" the company, leaving GameStop as a ""vestigial"" limb of a much larger enterprise.
He proposed that Cohen might buy a company like Berkshire-owned See's Candies. Buffett has called the boxed-chocolate seller his ""dream business"" because it has modest capital needs, possesses brand-driven pricing power, and provides excess cash for future investments.
Burry sketched out how GameStop might acquire a trio of businesses: ADT, Wayfair, and Assured Guaranty. He dubbed the approach ""Instant Berkshire,"" which he defined as ""creating a portfolio of great companies that generate excess capital or float for additional investment beyond what is required for their growth.""
Imagining himself in Cohen's shoes, Burry wrote that he would close a deal like that, then ""proceed to live my life doing my best Warren Buffett impression. Patiently buying all or in part great businesses and doing sweetheart financing deals in tough times.""
Cohen's compensation package was revamped in January to include several performance-based milestones. He now stands to earn stock awards potentially worth up to $35 billion if he can lift GameStop's market value by nearly 10-fold to $100 billion, and boost its annual adjusted profits to $10 billion. The company made $179 million by that measure in the nine months to November 1.
Burry flagged on Substack the risk of capital misallocation, or Cohen cutting the wrong deal. But he said that he's been adding to his GameStop stake in recent weeks, calling the stock a rare bargain.
""I believe GME gives me tremendous optionality in a young properly incentivized CEO/chairman with the right mindset to do something special,"" he wrote. ""It seems to me far less speculative than most stocks in the market today.""
Burry added that GameStop trades close to its tangible asset value, so that betting on it is ""almost as asymmetric as it gets these days"" in US stocks.
GameStop's shares are up 24% this year but have whipsawed in recent days. They closed at around $25 on Friday, down 80% from their meme-stock peak in January 2021.
David Kass, a finance professor at the University of Maryland and longtime Buffett blogger, told Business Insider that Cohen has an ""outstanding track record"" of investments to date.
""Although there is only one Warren Buffett, Ryan Cohen has the potential to succeed following a similar game plan,"" he added.
Larry Cunningham, the author of several books about Buffett and the director of the University of Delaware's Weinberg Center, told Business Insider that it would be extremely challenging for anyone to emulate Buffett's singular career.
""History counsels caution in anointing any 'next Buffett,' since his record reflects a rare mix of temperament, discipline, structure, and historical circumstance that is essentially impossible to replicate,"" he said.
As a longtime Buffett acolyte himself, Burry knows what a daunting comparison he's made — but nonetheless sees an opportunity for Cohen to pursue a familiar yet unprecedented path.
""Just about every investor that knows Buffett's story well has thought of doing something like this,"" Burry wrote. ""I believe this is the first time someone is poised to do it — and is doing it in a most unusual and fairly ingenious way.""
Subscribers get unlimited access to:",why-big-short-investor-michael-burrys-pick-for-the,"Every time Theron publishes a story, you’ll get an alert straight to your inbox!
By clicking “Sign up”, you agree to receive emails from Business Insider. In addition, you accept Insider’s Terms of Se...",Why 'Big Short' investor Michael Burry's pick for the next Warren Buffett is GameStop's Ryan Cohen,"Michael Burry of ""The Big Short"" fame said that Ryan Cohen has the potential to follow Warren Buffett's playbook and build huge value at GameStop.",,https://www.businessinsider.com/michael-burry-next-warren-buffett-gamestop-ryan-cohen-acquisition-deal-2026-2,Why 'Big Short' investor Michael Burry's pick for the next Warren Buffett is GameStop's Ryan Cohen,"Michael Burry of ""The Big Short"" fame said that Ryan Cohen has the potential to follow Warren Buffett's playbook and build huge value at GameStop.",https://i.insider.com/69870e48a645d1188188ea7b?width=1200&format=jpeg,,True,True,"data:image/svg+xml,%3Csvg xmlns='http://www.w3.org/2000/svg' viewBox='0 0 1 1'%3E%3C/svg%3E"
0f0b40ccf0f5c57ac56087f1f7d12c47,20260207174039,18,Prediction markets are booming. Some lawmakers are betting against them.,"Just like with social media and AI, Congress is only slowly catching up with something that's increasingly a feature of everyday life.",Business Insider,business,https://www.businessinsider.com/prediction-markets-capitol-hill-lawmakers-concerns-2026-2,https://i.insider.com/69861e41a645d1188188d962?width=1200&format=jpeg,published,,2026-02-07T17:40:39.884506,2026-02-07T17:40:39.884506,0,"Every time Bryan publishes a story, you’ll get an alert straight to your inbox!
By clicking “Sign up”, you agree to receive emails from Business Insider. In addition, you accept Insider’s Terms of Service and Privacy Policy.
Ask a member of Congress about the rise of prediction markets, and there's a decent chance they'll air some concerns.
""I think it's bad,"" said Democratic Rep. Alexandria Ocasio-Cortez of New York. ""Obviously, I'm not gonna make many friends with this opinion.""
""It's kind of sad,"" said Republican Rep. Abe Hamadeh of Arizona. ""I think gambling has really destroyed a lot of young men's lives recently.""
Prediction markets like Kalshi and Polymarket — where individuals can bet money on anything from sports, to the weather, to which words the president might use in a given speech — are exploding in popularity, buoyed by their use in the 2024 presidential election, a friendly regulatory approach from the Trump administration, and the occasional PR stunt.
But as with the rise of social media or the widespread adoption of generative AI, Congress is only slowly catching up with an industry that's increasingly a feature of everyday life for many Americans.

                          Every time Bryan publishes a story, you’ll get an alert straight to your inbox!
                        

                          Stay connected to Bryan and get more of their work as it publishes.
                        

                            By clicking “Sign up”, you agree to receive emails from Business Insider. In addition, you accept Insider's
                            Terms of Service and
                            Privacy Policy.
                          
There have been a handful of one-off bills, including a recent bill to ban government officials from insider trading and a 2024 bill to specifically ban betting on elections. But no one seems to be thinking about the industry in a comprehensive way, despite some major unresolved legal questions, including whether the platforms should be regulated by states or the federal government.
""The status quo strikes me as unsustainable in the long run,"" said Democratic Rep. Ritchie Torres of New York, the author of the insider trading bill. He said that his proposal is ""a logical place to start, but I envision it not as a ceiling, but as a floor.""
Meanwhile, prediction markets are trying to get ahead of the backlash, including meeting directly with members of Congress and hiring some of their former colleagues to bring the industry's message to Washington.
""We've had dozens of conversations with lawmakers on both sides of the aisle over the past few months,"" Kalshi spokesman Jack Such told Business Insider. ""We've always been a regulatory-first company and have made clear to lawmakers that we look forward to working in partnership with them to keep prediction markets transparent and safe.""
And many on Capitol Hill still have yet to make up their minds when it comes to prediction markets.
""It's an issue I'm still examining,"" Republican Sen. Ted Cruz of Texas, the chairman of the Senate Commerce Committee, told Business Insider. ""And I'm listening to arguments on both sides.""
For many lawmakers, the most immediate and tangible concern is the potential for corruption.
That's been especially true since early January, when an anonymous Polymarket trader made hundreds of thousands of dollars off a well-timed bet on former Venezuelan President Nicolas Maduro's capture.
Torres introduced his bill in the wake of that trade, while 12 Democratic senators sent a letter to Commodity Futures Trading Commission Chairman Michael Selig urging a crackdown on potential insider trading.
It's not just a matter of a White House ally possibly knowing about US military plans ahead of time. Both Polymarket and Kalshi host prediction markets where people can bet on the length and content of political speeches and press briefings.
Ocasio-Cortez argued that such a market would be an easy way for her to enrich her associates by letting them know the length of her speeches ahead of time.
""If you are a person with power that can determine outcomes, then you can use that as an avenue for doling out favors,"" she said.
Amid the insider trading concerns, Kalshi has sought to reassure the public that insider trading is forbidden on the platform, that it tracks suspicious trades, and that it supports Torres's bill. On Thursday, the company announced an expansion of its surveillance and enforcement frameworks, with CEO Tarek Mansour writing on X that the company has initiated over 200 investigations in the last year.
The Coalition for Prediction Markets, a group backed in part by Kalshi, also recently hired former Reps. Sean Patrick Maloney of New York and Patrick McHenry of North Carolina. And last week, the coalition took out a full-page ad in the Washington Post touting support for a ban on insider trading and broader regulation.
Mansour has also been meeting with lawmakers himself. Republican Sen. Tommy Tuberville of Alabama, one of those lawmakers, said he came away intrigued by the industry.
""It's kind of instant polling, is the way I see it. And it's about anything,"" Tuberville told Business Insider. ""I think it's interesting. How long it'll last, I don't know.""
By contrast, Polymarket — the platform where the infamous Maduro trade occurred — has stayed relatively quiet, and the company did not respond to a request for comment on this story.
There are also broader concerns that prediction markets may have a harder time assuaging, including not just the harms that can come with gambling, but also the perception that these markets reduce broad swaths of life to tradable commodities.
""I find something concerning about the gamification of every aspect of human existence,"" said Democratic Rep. Ro Khanna of California. ""We've, as people, become more uncomfortable with the unknowable, and with the mysteries of life, and this is a further step in that direction.""
Both Kalshi and Polymarket have pitched themselves as something more noble than mere casinos. To hear them tell it, prediction markets aggregate the collective wisdom of thousands of bettors, making for a valuable source of information about future events.
Torres, who said that he monitored prediction markets during the 2024 election alongside polling, said he could see the potential in that respect.
""I tend to think that polling is reliable, but you could lie to a pollster,"" Torres said. ""If you have skin in the game, if you're risking money, you actually have an incentive for truth-telling.""
Democratic Sen. Chris Murphy of Connecticut, who recently wrote a lengthy thread on X arguing that prediction markets were contributing to a ""dystopian world,"" said he viewed the platforms as little more than a ""scam.""
""I have plenty of ways of finding out what the conventional wisdom is,"" Murphy told Business Insider. ""Why do I need a prediction market to do it, if the prediction market is also scamming millions of people out of money?""
Subscribers get unlimited access to:",prediction-markets-are-booming.-some-lawmakers-are,"Every time Bryan publishes a story, you’ll get an alert straight to your inbox!
By clicking “Sign up”, you agree to receive emails from Business Insider. In addition, you accept Insider’s Terms of Ser...",Prediction markets are booming. Some lawmakers are betting against them.,"Just like with social media and AI, Congress is only slowly catching up with something that's increasingly a feature of everyday life.",,https://www.businessinsider.com/prediction-markets-capitol-hill-lawmakers-concerns-2026-2,Prediction markets are booming. Some lawmakers are betting against them.,"Just like with social media and AI, Congress is only slowly catching up with something that's increasingly a feature of everyday life.",https://i.insider.com/69861e41a645d1188188d962?width=1200&format=jpeg,,True,True,"data:image/svg+xml,%3Csvg xmlns='http://www.w3.org/2000/svg' viewBox='0 0 1 1'%3E%3C/svg%3E"
d4ee50c507116cd4680d7027edd05d40,20260207174043,19,Replit's CEO thinks AI will end soul-crushing corporate work — and bring entrepreneurship inside big companies,"Replit founder Amjad Masad says AI can remove drudgery at work, letting employees build and own ideas inside large companies.",Business Insider,business,https://www.businessinsider.com/replit-ceo-says-ai-could-end-soul-crushing-corporate-work-2026-2,https://i.insider.com/69807a99a645d11881886de9?width=1200&format=jpeg,published,,2026-02-07T17:40:43.975640,2026-02-07T17:40:43.975640,0,"Every time Thibault publishes a story, you’ll get an alert straight to your inbox!
By clicking “Sign up”, you agree to receive emails from Business Insider. In addition, you accept Insider’s Terms of Service and Privacy Policy.
Amjad Masad thinks the modern workplace is broken — and he believes AI can help fix it.
The Replit founder and CEO says traditional corporate work has become deeply alienating, with employees siloed into narrow roles where ideas die in backlogs.
""One thing that I found extremely depressing is how atomized and siloed people are,"" Masad recently said on the ""Possible"" podcast with Reid Hoffman. ""People become sort of cogs in the machine. And I don't think that is conducive to the human spirit.""
AI, he said, is starting to reverse that dynamic by letting people inside big companies build, test, and ship ideas themselves — without waiting for engineering approval.
Masad's bet is that AI agents can automate much of the repetitive, standardized work that dominates corporate life — documentation, internal tools, workflows — freeing employees to think and act more like entrepreneurs.

                          Every time Thibault publishes a story, you’ll get an alert straight to your inbox!
                        

                          Stay connected to Thibault and get more of their work as it publishes.
                        

                            By clicking “Sign up”, you agree to receive emails from Business Insider. In addition, you accept Insider's
                            Terms of Service and
                            Privacy Policy.
                          
""As the boring things, the automated things actually are taken care of by machines, we're left to be more entrepreneurial and more creative,"" he said.
Masad isn't the only tech leader seeing huge potential in deploying AI agents.
OpenAI CEO Sam Altman has said AI agents can already handle work typically done by junior employees, Microsoft's AI platform product lead Asha Sharma has said they could flatten corporate hierarchies, and McKinsey's CEO Bob Sternfels has said the firm is already deploying 25,000 AI agents alongside its human workforce.
On the ""Possible"" podcast, Masad pointed to one case, where an employee at a big real estate marketplace had an idea to improve how buyers were routed to agents, but couldn't get engineering resources.
In the past, Masad said, ""the idea is dead,"" but now, the employee built a working routing algorithm himself using Replit, an AI-powered coding platform that lets users build and deploy software without traditional engineering support.
""He built a new routing algorithm that drove tens of millions of dollars, if not hundred million dollars, to the business,"" Masad said.
The result wasn't just business impact — the employee was promoted repeatedly and now helps guide the company's AI strategy at the board level, he said.
Masad sees this as a form of entrepreneurship inside a large business where domain experts — not just engineers — can turn insight into execution.
That shift, he said, restores meaning to work by reconnecting people with the outcomes they create.
""Humans are fundamentally creative,"" he added.
If AI succeeds at removing drudgery rather than replacing judgment, Masad believes corporate jobs could become less soul-crushing and far more human.
Subscribers get unlimited access to:",replits-ceo-thinks-ai-will-end-soul-crushing-corpo,"Every time Thibault publishes a story, you’ll get an alert straight to your inbox!
By clicking “Sign up”, you agree to receive emails from Business Insider. In addition, you accept Insider’s Terms of...",Replit's CEO thinks AI will end soul-crushing corporate work — and bring entrepreneurship inside big companies,"Replit founder Amjad Masad says AI can remove drudgery at work, letting employees build and own ideas inside large companies.",,https://www.businessinsider.com/replit-ceo-says-ai-could-end-soul-crushing-corporate-work-2026-2,Replit's CEO thinks AI will end soul-crushing corporate work — and bring entrepreneurship inside big companies,"Replit founder Amjad Masad says AI can remove drudgery at work, letting employees build and own ideas inside large companies.",https://i.insider.com/69807a99a645d11881886de9?width=1200&format=jpeg,,True,True,"data:image/svg+xml,%3Csvg xmlns='http://www.w3.org/2000/svg' viewBox='0 0 1 1'%3E%3C/svg%3E"
