id,run_id,row_id,title,description,source,category,link,image_url,status,scheduled_at,created_at,updated_at,likes,content,slug,excerpt,meta_title,meta_description,meta_keywords,canonical_url,og_title,og_description,og_image,focus_keyword,is_indexable,is_followable,images
a86bd8b051716d77824c9ce92f1bff3f,20260207173931,1,The CEO of private jet firm Flexjet explains how it prepares for the Super Bowl — one of its busiest and most expensive times of the year,"The Super Bowl will see private jets charged event fees in the tens of thousands, and special procedures to deal with high traffic.",Business Insider,business,https://www.businessinsider.com/super-bowl-private-jets-flexjet-ceo-explains-how-it-prepares-2026-2,https://i.insider.com/6984b512d3c7faef0ecdad98?width=1200&format=jpeg,published,,2026-02-07T17:39:31.858403,2026-02-07T17:39:31.858403,0,"Every time Pete publishes a story, you’ll get an alert straight to your inbox!
By clicking “Sign up”, you agree to receive emails from Business Insider. In addition, you accept Insider’s Terms of Service and Privacy Policy.
Super Bowl LX comes to San Francisco this weekend, and that means scores of wealthy football fans arriving by private jet.
For Andrew Collins, CEO of private jet provider Flexjet, it's one of the busiest times of year and comes with its own set of challenges.
It ""is really time-sensitive because you don't know who's going to be in the Super Bowl until almost the last minute,"" Collins told Business Insider in an interview.
The deciding conference championships happen two weeks before the big event. Sunday's Super Bowl will see the New England Patriots take on the Seattle Seahawks at Levi's Stadium in the Bay Area.
Collins himself, a Patriots fan, said his son is ""a little bummed out"" because they were close to going, but ""then my schedule sort of precluded it.""

                          Every time Pete publishes a story, you’ll get an alert straight to your inbox!
                        

                          Stay connected to Pete and get more of their work as it publishes.
                        

                            By clicking “Sign up”, you agree to receive emails from Business Insider. In addition, you accept Insider's
                            Terms of Service and
                            Privacy Policy.
                          
Flexjet offers fractional ownership, allowing customers to buy a share of an aircraft based on how often they want to fly it.
The Super Bowl is one of just a handful of days when customers need to give longer notice to fly, which Flexjet calls ""published peak days,"" Collins said. Instead of a typical 10-hour notification, it would be as long as 72 hours.
Flexjet reports that its flight requests are pacing ahead of last year's Super Bowl in New Orleans. It's also operating nearly 30% more flights into the Bay Area compared to the same week last year
San Jose Mineta International Airport, a five-mile drive from Levi's Stadium, said it expects more than 230 additional commercial flights this week.
But private fliers use fixed-base operators: dedicated private terminals, often luxurious, that also provide other services such as refuelling.
Compared to the commercial side of airports, they also tend to be ""much more fluid and dynamic"" during big events, Collins said. ""So they will charge special amenities and things like that, that can get very high.""
At San Jose Mineta International, FBOs are charging special-event fees ranging from $3,675 for a single-prop plane to $28,810 for a Gulfstream G650.
""It has been a fact of life for the past few years, especially,"" Collins added, of the event fees. He put this down to two things: the rising popularity of private aviation, and the acquisition of more FBOs by private equity firms.
Flexjet is also adding a pop-up private terminal at Oakland Airport with its own lounge.
Flying private might help well-heeled sports fans avoid the crowds in airport terminals, but, just like roads during a big event, the sky also gets congested.
Due to the expected high traffic, the Federal Aviation Administration has implemented special procedures at 17 Bay Area airports to enhance safety and minimize delays. These include extended air traffic control operating hours and restrictions on the number of flights.
For private-jet operators like Flexjet, ensuring flights run smoothly often comes down to who you know.
""In order to do large events like that, you have to have a very robust set of relationships,"" said Collins. ""We have significant formal and informal relationships across airports and across fixed-based operators.""
As the firm plans its schedules and customers book flights, these contacts can help point them in the right direction.
""They might shift you in terms of, you might want to think about having somebody come in at this point versus this point because the traffic flow is going to be easier,"" Collins said.
Planning flights already involves several variables, but big events add more factors to consider: From the surrounding infrastructure to special event fees and slot programs. Flexjet's operations team spends months planning for big events, and works around the clock from its control center in Cleveland.
""It can be the Super Bowl, it can be an F1 race. It can be that slots are really in demand and limited parking. It could be weather,"" Collins told Business Insider.
""There are a lot of things, but you have to be ready for that,"" he added. ""You have to be planning in as many ways as possible and as proactively as you can.""",the-ceo-of-private-jet-firm-flexjet-explains-how-i,"Every time Pete publishes a story, you’ll get an alert straight to your inbox!
By clicking “Sign up”, you agree to receive emails from Business Insider. In addition, you accept Insider’s Terms of Serv...",The CEO of private jet firm Flexjet explains how it prepares for the Super Bowl — one of its busiest and most expensive times of the year,"The Super Bowl will see private jets charged event fees in the tens of thousands, and special procedures to deal with high traffic.",,https://www.businessinsider.com/super-bowl-private-jets-flexjet-ceo-explains-how-it-prepares-2026-2,The CEO of private jet firm Flexjet explains how it prepares for the Super Bowl — one of its busiest and most expensive times of the year,"The Super Bowl will see private jets charged event fees in the tens of thousands, and special procedures to deal with high traffic.",https://i.insider.com/6984b512d3c7faef0ecdad98?width=1200&format=jpeg,,True,True,"data:image/svg+xml,%3Csvg xmlns='http://www.w3.org/2000/svg' viewBox='0 0 1 1'%3E%3C/svg%3E"
87c2f734b370e1f6d118a2ba72126254,20260207173936,2,We asked 13 rising-star VCs how they use AI. Here's what they told us.,"For up-and-coming venture capitalists, tools like ChatGPT and NotebookLM have become a core part of the job.",Business Insider,business,https://www.businessinsider.com/how-venture-capital-investors-use-ai-chatgpt-notebooklm-2026-2,https://i.insider.com/6984eeabd3c7faef0ecdb608?width=1200&format=jpeg,published,,2026-02-07T17:39:36.564959,2026-02-07T17:39:36.564959,0,"These days, plenty of venture capitalists are trying to spot the next big thing in artificial intelligence. For some, the best way to do that is to use the technology themselves.
For a generation raised on Google Docs and Slack, tools like ChatGPT and Google's NotebookLM have become a core part of the job. They offer ways to learn new markets faster, spot non-obvious companies, stress-test investment theses, and turn a swamp of meetings into searchable insights.
Business Insider asked its 2026 Rising Stars of Venture Capital honorees how they use AI in their day-to-day work — and which tools they rely on most.
The following has been edited for length and clarity.
Miloni Madan Presler, partner at IVP:
Shruti Kumar, vice president at Tusk Ventures:
Sophie Beshar, vice president at Insight Partners:
Meera Oak, partner at Alumni Ventures:
Angèle Sahraoui, investor at Slow Ventures:
Manmeet Gujral, vice president at CapitalG:
Lexi Henkel, managing director at Maverick Ventures
James Flynn, partner at Sequoia Capital:
Adil Bhatia, vice president at Redpoint Ventures:
Max Abram, partner at Scale Venture Partners:
Sudhee Chilappagari, principal at Battery Ventures:
Gloria Zhang, vice president at DCM Ventures:
Christine Esserman, partner at Accel:
Julia Hornstein contributed to this report.
Subscribers get unlimited access to:",we-asked-13-rising-star-vcs-how-they-use-ai.-heres,"These days, plenty of venture capitalists are trying to spot the next big thing in artificial intelligence. For some, the best way to do that is to use the technology themselves.
For a generation rais...",We asked 13 rising-star VCs how they use AI. Here's what they told us.,"For up-and-coming venture capitalists, tools like ChatGPT and NotebookLM have become a core part of the job.",,https://www.businessinsider.com/how-venture-capital-investors-use-ai-chatgpt-notebooklm-2026-2,We asked 13 rising-star VCs how they use AI. Here's what they told us.,"For up-and-coming venture capitalists, tools like ChatGPT and NotebookLM have become a core part of the job.",https://i.insider.com/6984eeabd3c7faef0ecdb608?width=1200&format=jpeg,,True,True,"data:image/svg+xml,%3Csvg xmlns='http://www.w3.org/2000/svg' viewBox='0 0 1 1'%3E%3C/svg%3E"
a7681395dd5433abad6de4c06255e178,20260207173942,3,'I hate being idle': Why many airline pilots say they're turning to day-trading as a side hustle in their off time,"More pilots have turned to trading and investing in recent years, largely due to rising salaries, a lot of free time, and a desire to be independent.",Business Insider,business,https://www.businessinsider.com/pilots-trading-stocks-side-hustle-financial-freedom-retail-investors-2026-2,https://i.insider.com/6984f3d6e1ba468a96ab7f19?width=1200&format=jpeg,published,,2026-02-07T17:39:42.850784,2026-02-07T17:39:42.850784,0,"Every time Jennifer publishes a story, you’ll get an alert straight to your inbox!
By clicking “Sign up”, you agree to receive emails from Business Insider. In addition, you accept Insider’s Terms of Service and Privacy Policy.
Jonathan Prieur's career in markets began just as his flying career seemed to abruptly end. The 49-year-old pilot had a contract to switch to a new airline in 2020, which was canceled when the pandemic brought air travel to a halt. Stressed out, he turned to something he had put on the back burner for years, but had always hoped would boost his income: trading.
For Prieur, who now flies for Qatar Airways and has a stable income, the crisis has blown over — but he's still day trading. In between trips and after long flying shifts, he takes off his pilot hat and jumps headfirst into markets, executing short-term forex trades with profits that range from the low single digits to more than 10% on a month, according to his own account and recent brokerage statements he showed Business Insider.
The side gig won't turn him into a millionaire, but it's the principle of trading on the side that matters, Prieur said, adding that he hopes to one day achieve financial freedom for his own peace of mind.
""Yes, the trading is stressful, yes the mortgage and whatnot. But I know that if at least I'm working on my trading, I am trying to find a solution,"" Prieur said. ""It's not far away.""
Pilots have long been avid investors, but those in the profession say that the yearning for financial freedom has sharpened in recent years, ever since the pandemic upended air travel and pushed many to search for alternative sources of income.

                          Every time Jennifer publishes a story, you’ll get an alert straight to your inbox!
                        

                          Stay connected to Jennifer and get more of their work as it publishes.
                        

                            By clicking “Sign up”, you agree to receive emails from Business Insider. In addition, you accept Insider's
                            Terms of Service and
                            Privacy Policy.
                          
That, paired with six-figure salaries and a lot of free time — two perks that have always come attached to the pilot role — was the perfect recipe for the surge of pilots who have turned to markets in recent years. Trading for them is either in pursuit of financial freedom, or simply to fill long stretches of downtime, according to pilots and others in the aviation business who spoke with Business Insider.
The percentage of pilots who have developed a side hustle unrelated to aviation rose four percentage points over the last two decades, according to data from the workforce intelligence firm Revelio Labs.
The proportion of pilots with a finance-related side-hustle, while small, has nearly doubled over that timeframe. Sharp increases were seen in the years after the Great Financial Crisis and in 2020, two periods when pilots faced elevated unemployment.
Chatter about markets has always made its way into the cockpit, but pilots have become more active investors in recent years alongside the broader retail-trading boom, according to Alex Tapia, a wealth planner who works with aviation professionals. Over the last five years, he estimates his firm, Pilot Money, has seen a 50% increase in clients who are short-term investors and are active in markets.
Pilots tend to be private, Prieur said. He himself keeps his own trading under wraps, out of fear of drawing jealousy or ""bad energy."" But, should a fellow pilot talk markets, it's often met with a flood of enthusiasm.
A few things explain why it's become a popular pursuit.
For one, many pilots are sitting on a healthy nest egg and have plenty of cash to spare for cultivating a hobby in markets, Tapia said. The average annual salary of pilots and co-pilots soared 98% from 1995 to 2020, according to the most recent available data from the MIT Airline Data Project.
Excess time is another factor. The FAA prevents pilots from flying more than 100 hours a month, the equivalent of around 12 business days.
""I always call it the best part-time job in the world,"" Tapia said.
Many pilots' sense of independence tends to lead them to markets. They're often skeptical of management and are used to preparing for the worst-case scenarios, according to Casey Smith, the president of Wiser Wealth Management, another wealth manager that works heavily with pilots.
Greg Dlugi, a pilot for TUI Airways who trades on the side, said he noticed investing culture got a big push in the industry in 2020, when the pandemic showed many pilots just how fragile and economically sensitive the travel industry can be.
Dlugi, who also regularly takes pilots under his wing to teach them how to trade, says he believes the lifestyle is ideal for a trader, since being away from friends and family for extended periods of time is all part of the package. Though he prefers to trade at home, Dlugi says he regularly scans the markets in between flights and is ready to pounce on a good trade, should he see one in the hotel room or in long layovers.
Across all his accounts, he aims for a 5% average return a month, he told Business Insider.
""The idea is I can sit on a beach in Barbados and flick open my laptop and trade the Dow Jones, for example. I don't have to sit down in a office to do that, and I don't have to have a warehouse with stuff I'm selling on Amazon,"" he said of the freedom.
Prieur, who studied forex under Dlugi's mentorship, has a similar schedule. Though being in the right time zone to capture the New York or London sessions can be tricky, he says the trading in between trips generally doesn't interfere with flying, since he keeps his risk manageable enough that he doesn't have to worry about positions while in the air.
Prieur believes he's around five years away from becoming truly financially independent. Though he hopes to fly forever, the comfort of knowing he could support himself is a huge perk.
""I could say, 'Hey, if the flying were to stop tomorrow, I could self-sustain myself and my family,'"" he said.
Nyasha Madziwa, a 23-year-old pilot who is now completing his training to become a flight instructor, has similar goals in mind. He began learning how to trade forex during the pandemic, partly because he aspires to be a private pilot — more exciting, but less financially lucrative compared to being a commercial pilot.
Madziwa said his days are tightly structured around flying and trading, jumping into the markets for several hours after driving home from the airport.
""I hate being idle,"" Madziwa said. ""I'm going to focus on forex as a means of financial freedom, then I'm going to focus on flying as a dream,"" he added, though he noted he was still working towards being a profitable trader.
Pilots tend to be much better at flying than at trading, Tapia and Smith, who are both former pilots themselves, said.
""Here's the issue with airline pilots. You want your pilot to be very confident. And that confidence sometimes goes into other areas where they probably statistically don't understand,"" Wiser Wealth's Smith said.
Tapia said overconfidence can proliferate in the profession, something that can be a hindrance to seeing a return in the market.
""It tends to work against you when you do it with your own money.""",i-hate-being-idle:-why-many-airline-pilots-say-the,"Every time Jennifer publishes a story, you’ll get an alert straight to your inbox!
By clicking “Sign up”, you agree to receive emails from Business Insider. In addition, you accept Insider’s Terms of...",'I hate being idle': Why many airline pilots say they're turning to day-trading as a side hustle in their off time,"More pilots have turned to trading and investing in recent years, largely due to rising salaries, a lot of free time, and a desire to be independent.",,https://www.businessinsider.com/pilots-trading-stocks-side-hustle-financial-freedom-retail-investors-2026-2,'I hate being idle': Why many airline pilots say they're turning to day-trading as a side hustle in their off time,"More pilots have turned to trading and investing in recent years, largely due to rising salaries, a lot of free time, and a desire to be independent.",https://i.insider.com/6984f3d6e1ba468a96ab7f19?width=1200&format=jpeg,,True,True,"data:image/svg+xml,%3Csvg xmlns='http://www.w3.org/2000/svg' viewBox='0 0 1 1'%3E%3C/svg%3E"
a69a980172aa6e183c750499aedd4396,20260207173946,4,A stranger told me to smile at the gym. He didn't know I was miscarrying.,"A woman recalls being told to smile by a stranger while miscarrying, and why the experience reflects a common form of entitlement women face.",Business Insider,business,https://www.businessinsider.com/when-a-man-told-me-to-smile-2026-2,https://i.insider.com/69865b14d3c7faef0ecdd5c8?width=1200&format=jpeg,published,,2026-02-07T17:39:46.245783,2026-02-07T17:39:46.245783,0,"Every time Chaunie publishes a story, you’ll get an alert straight to your inbox!
By clicking “Sign up”, you agree to receive emails from Business Insider. In addition, you accept Insider’s Terms of Service and Privacy Policy.
Unfortunately, I'm sure that as women, we have all had our own ""you should smile more"" moment. My most memorable one happened when I was 29 and in line to use the restroom at our local gym.
An older man with gray hair, whom I had never seen before, was also waiting to use the bathroom and tried to make eye contact with me. I was in no mood to converse or chit-chat, so I simply stood there, neutrally. I did my best to ignore him. I tried in vain to look everywhere but at him, but he inched closer.
""You know, you really should smile,"" he finally uttered. ""What could be so bad that you can't smile?""
I needed the bathroom to check that I hadn't bled through my leggings because I was actively miscarrying a pregnancy.
I was at the gym because my miscarriage was not a ""quick"" one. It happened to be an awful, excruciating, drawn-out loss that took three months from start to finish — it turns out the pregnancy was a non-fallopian ectopic, so the tissue had implanted somewhere in my body that the doctors couldn't find. Every week, my hCG rose, followed by a large bleeding, followed by the doctors thinking it was ""over,"" only to have the process repeat itself over and over, until I was finally given medicine to stop the dividing tissue.

                          Every time Chaunie publishes a story, you’ll get an alert straight to your inbox!
                        

                          Stay connected to Chaunie and get more of their work as it publishes.
                        

                            By clicking “Sign up”, you agree to receive emails from Business Insider. In addition, you accept Insider's
                            Terms of Service and
                            Privacy Policy.
                          
All that to say, it was one of the most isolating, awful experiences of my life, and going to the gym was my only way of coping. There were moments I was physically well enough to be active, and unexpected moments of bleeding, and some general days of just moderate bleeding, so I was doing everything I could just to function and make it through.
Going to the gym was part of my daily routine at the time, and physically moving my body helped take my mind off what was happening inside my body, so that's how I found myself in line to use the bathroom with the man who asked me the dreaded question.
This person literally knew nothing about me at the time. What if I had just found out I had cancer? What if my parent had just died? What if I had a kid in the hospital? 
All I remember from that moment is the punch-gutted feeling in my stomach, the franticness I felt in trying to avoid his eyes because, the flash of white hot rage in my chest at his words, and the enveloping wave of grief that arose when I remembered the secret I was carrying.
I wish I could tell you that I had told him exactly what was happening to me, but I honestly can't remember what happened after that. 
What I do remember is how it felt. And that feeling is what has prompted me to tell that story, over and over, to my own four daughters, who have all already experienced their own versions of the ""why don't you smile more"" demands from people.
I tell them that story so they know that when it happens to them, they know they don't need to perform for anyone.  And that they owe no one a smile.
Subscribers get unlimited access to:",a-stranger-told-me-to-smile-at-the-gym.-he-didnt-k,"Every time Chaunie publishes a story, you’ll get an alert straight to your inbox!
By clicking “Sign up”, you agree to receive emails from Business Insider. In addition, you accept Insider’s Terms of S...",A stranger told me to smile at the gym. He didn't know I was miscarrying.,"A woman recalls being told to smile by a stranger while miscarrying, and why the experience reflects a common form of entitlement women face.",,https://www.businessinsider.com/when-a-man-told-me-to-smile-2026-2,A stranger told me to smile at the gym. He didn't know I was miscarrying.,"A woman recalls being told to smile by a stranger while miscarrying, and why the experience reflects a common form of entitlement women face.",https://i.insider.com/69865b14d3c7faef0ecdd5c8?width=1200&format=jpeg,,True,True,"data:image/svg+xml,%3Csvg xmlns='http://www.w3.org/2000/svg' viewBox='0 0 1 1'%3E%3C/svg%3E"
