id,run_id,row_id,title,description,source,category,link,image_url,status,scheduled_at,created_at,updated_at,likes,content,slug,excerpt,meta_title,meta_description,meta_keywords,canonical_url,og_title,og_description,og_image,focus_keyword,is_indexable,is_followable,images
b12f556822f19d9d476c5b4e43691ad0,20260207162539,1,"FBI Announces ‘New Message’ in Nancy Guthrie Disappearance, Restricts Road Access to Her Home","The FBI says it is knows of a new message sent to a local news outlet regarding the disappearance of Nancy Guthrie, 84, who is believed to have been kidnapped from her Tucson, Ariz., home on Sat. Jan. 31",KC Baker,entertainment,https://people.com/fbi-announces-new-message-in-nancy-guthrie-disappearance-restricts-road-access-to-her-home-11901416,https://people.com/thmb/qgtrJKtbGUcSVBPF8BxxS3G11Ho=/1500x0/filters:no_upscale():max_bytes(150000):strip_icc():focal(749x0:751x2)/scene-outside-Nancy-Guthries-home-020626-6-0cebc4d2098c42578b3c8963dcb589d2.jpg,published,,2026-02-07T16:25:39.864901,2026-02-07T16:25:39.864901,0,"The 'Today' show host's mother, Nancy Guthrie, 84, was taken against her will from her home on Jan. 31, police said
Nathan Congleton/NBCU Photo Bank/NBCUniversal via Getty; Danielle Bacher
The FBI is acknowledging a new message tied to the disappearance of Today show host Savannah Guthrie's 84-year-old mother, Nancy Guthrie, who authorities believe was kidnapped from her Tuscon, Ariz., home last weekend.
""The FBI and Pima County Sheriff’s Department are aware of a new message regarding Nancy Guthrie,"" the Pima County Sheriff’s Department said in a statement to PEOPLE on Friday, Feb. 6.
""Investigators are actively inspecting the information provided in the message for its authenticity,"" the statement continued. ""While this is one new piece of information, the FBI and the Pima County Sheriff’s Department are still asking anyone with tips to contact the FBI at 1-800-CALL-FBI. The FBI continues to offer a reward of up to $50,000 for information leading to the recovery of Nancy Guthrie and/or the arrest and conviction of anyone involved in her disappearance.""
Tucson-based KOLD News/News 13 shared that it received the message earlier in the day. ""13 News received a new message this morning, February 6, regarding the Nancy Guthrie disappearance,"" News 13 stated.
""We are not releasing details out of respect to the family,"" the outlet added.
KOLD News/News 13 said it forwarded the message to law enforcement along with the IP address from the initial note. The IP address is not the same IP address as the initial note, but ""it appears the sender used the same type of secure server to hide their IP address,"" the outlet said.
""The new note contains information the senders seem to think will prove to investigators they’re the same people who sent the first note,"" News 13 stated.
On Friday afternoon, a large number of FBI personnel including Evidence Recovery Team and Forensics Team members, along with more than two dozen sheriffs showed up at Nancy's house, where they searched the back of the property, PEOPLE can confirm.
""We are back at the house again as part of customary investigation follow up,"" an FBI spokesperson tells PEOPLE. ""We were planning on getting back to the house today even before that message came in.""
Speaking about the large FBI presence at the property, he said, ""When the FBI is involved, we bring lots of resources.""
The Pima County Sheriff's Office said in a post on X that investigators were conducting a follow-up at the Guthrie home and in the surrounding area, and that the roadway in front of the home is currently restricted.
“Nobody on foot can pass the cones,"" a sergeant at the scene tells PEOPLE. ""We need everyone out right now. This is for further investigation.”

Nancy was reported missing on Sunday, Feb. 1, by her family when she failed to show up at church.
Law enforcement launched a massive investigation into Nancy's disappearance, saying they believe the grandmother was taken against her will, Pima County Sheriff Chris Nanos said at a press conference on Tuesday, Feb. 3.
On Wednesday, Feb. 4, the Today show host, 54, her sister Annie, and her brother Camron made an emotional plea to the potential kidnapper in a video posted to Instagram, asking for the safe return of their mother.
""We need to know without a doubt that she is alive and that you have her,"" Savannah said in the video.
Nancy was last seen on Jan. 31 when her son-in-law, Tommaso Cioni, dropped her off at her house sometime around 9:48 p.m. after she had dinner with him and Annie at their nearby home, Nanos told The New York Times.
A trail of what appears to be blood was seen on the front steps of Nancy's home that authorities confirmed is hers.
On Wed., Feb. 4, Nanos said authorities believe Nancy is still alive.
Want to keep up with the latest crime coverage? Sign up for  PEOPLE's free True Crime newsletter for breaking crime news, ongoing trial coverage and details of intriguing unsolved cases.
Savannah has been in Arizona with her family as they wait for answers about Nancy.
In a statement on X, FBI Phoenix said, ""While this is one new piece of information, the FBI and the Pima County Sheriff’s Department are still asking anyone with tips to contact the FBI at 1-800-CALL-FBI. 
""The FBI continues to offer a reward of up to $50,000 for information leading to the recovery of Nancy Guthrie and/or the arrest and conviction of anyone involved in her disappearance.""",fbi-announces-‘new-message’-in-nancy-guthrie-disap,"The 'Today' show host's mother, Nancy Guthrie, 84, was taken against her will from her home on Jan. 31, police said
Nathan Congleton/NBCU Photo Bank/NBCUniversal via Getty; Danielle Bacher
The FBI is acknowledging a new message tied to the disappeara...","FBI Announces ‘New Message’ in Nancy Guthrie Disappearance, Restricts Road Access to Her Home","The FBI says it is knows of a new message sent to a local news outlet regarding the disappearance of Nancy Guthrie, 84, who is believed to have been kidnapped from her Tucson, Ariz., home on Sat. Jan. 31",,https://people.com/fbi-announces-new-message-in-nancy-guthrie-disappearance-restricts-road-access-to-her-home-11901416,"FBI Announces ‘New Message’ in Nancy Guthrie Disappearance, Restricts Road Access to Her Home","The FBI says it is knows of a new message sent to a local news outlet regarding the disappearance of Nancy Guthrie, 84, who is believed to have been kidnapped from her Tucson, Ariz., home on Sat. Jan. 31",https://people.com/thmb/qgtrJKtbGUcSVBPF8BxxS3G11Ho=/1500x0/filters:no_upscale():max_bytes(150000):strip_icc():focal(749x0:751x2)/scene-outside-Nancy-Guthries-home-020626-6-0cebc4d2098c42578b3c8963dcb589d2.jpg,,True,True,"https://people.com/thmb/8fpgtNG4gc0FjmfqFVr4xXMCOd8=/1500x0/filters:no_upscale():max_bytes(150000):strip_icc():focal(749x0:751x2):format(webp)/scene-outside-Nancy-Guthries-home-020626-6-0cebc4d2098c42578b3c8963dcb589d2.jpg,https://tpc.googlesyndication.com/simgad/5747940643582955249?"
76d36b3d91973702b183a6c4e6d4b097,20260207162545,2,Sheriff Believes Nancy Guthrie 'Went to Bed' Before She Was Abducted Overnight,"Investigators are still searching for ""Today"" host Savannah Guthrie's 84-year-old mom, who has been missing since Sat. Jan. 31.",KC Baker,entertainment,https://people.com/sheriff-believes-nancy-guthrie-went-to-bed-before-she-was-abducted-overnight-11901657,https://people.com/thmb/mgW5KXXmjyI55NChUJiEi1Tk1GY=/1500x0/filters:no_upscale():max_bytes(150000):strip_icc():focal(749x282:751x284)/chris-nanos-savannah-guthrie-nancy-guthrie-020626-1-07ecc1e3410c45ac9e1d7ae636e69108.jpg,published,,2026-02-07T16:25:45.283982,2026-02-07T16:25:45.283982,0,"Investigators are still searching for ""Today"" host Savannah Guthrie's 84-year-old mom, who has been missing since Sat. Jan. 31
NBC; Savannah Guthrie/Instagram
Speculation about exactly what Nancy Guthrie did after she returned home on the night she vanished has mounted since the 84-year-old was reported missing over the weekend.
On Sat. Jan. 31 at 9:48 p.m., the 84-year-old mother of Today show host Savannah Guthrie, 54, returned to her Tucson, Ariz., home after having dinner with her daughter Annie and her husband at their house, Pima County Sheriff Chris Nanos said at a press conference on Thursday, Feb. 5.
Her family dropped her off and that was apparently the last time anyone saw Nancy.
""At 9:50 p.m. that garage door closes, because [at] that time we assume that Nancy's home and probably going to bed,"" Nanos said at the press conference.
On Friday, Feb. 6, Nanos cleared up the confusion when he told PEOPLE, ""We know she had gone to bed.""
In a previous interview with NBC News, Nanos said, “When you’re taken from your bed and you don’t want to go somewhere, that’s an abduction.”
But Nanos “meant that figuratively and did not mean she was literally taken from her bed,” the sheriff’s department later clarified to NBC.
After Nancy went to bed, however, authorities aren't exactly sure what she did, Nanos told PEOPLE.
""Did she get up and answer the door?"" he says. ""Did she get up to go to the bathroom? Did she go to get something out of the refrigerator?
""I just know that this 84-year-old mom, grandma, went to bed that night and in the morning she was missing,"" he says.
Pima County Sheriff's Department
From what authorities have said, there was no activity at the house until 1:47 a.m., when Nancy's doorbell camera disconnected, he said at the press conference.
At 2:12 a.m., the software from the doorbell camera detected someone, but no video is available because there was no subscription, so investigators cannot tell who or what that was at this point. ""We just have no video, but we're not giving up on that,"" Nanos said at the press conference.
At 2:28 a.m., Nancy's pacemaker app indicated a disconnection from her phone. Nearly 40 minutes passed between the time the doorbell camera detected a person and the time Nancy's pacemaker app indicated a disconnect.
Nanos has said previously that he believes Nancy is alive.
Authorities, though, say they have no suspects at the moment.
They are looking into alleged ransom notes that were sent to various news outlets.
During the Feb. 5 press conference, FBI Phoenix Special Agent in Charge Heith Janke said one individual has been arrested for making a phony ransom demand.
Savannah and her siblings addressed their mother's possible abductors in a tearful plea video posted to Instagram on Wednesday, Feb. 4.
Want to keep up with the latest crime coverage? Sign up for  PEOPLE's free True Crime newsletter for breaking crime news, ongoing trial coverage and details of intriguing unsolved cases.
The notes included a dollar amount and two deadlines — the first at 5 p.m. on Thursday, Feb. 5 and a second for Monday, Feb. 9, if the initial demand was not met. He added that one note referenced an Apple Watch and another mentioned a floodlight, but provided ""no proof of life.""
Anyone with tips or leads is asked to call 1-800-CALL-FBI in addition to the Pima County Sheriff’s Department number, 520-351-4900.",sheriff-believes-nancy-guthrie-went-to-bed-before-,"Investigators are still searching for ""Today"" host Savannah Guthrie's 84-year-old mom, who has been missing since Sat. Jan. 31
NBC; Savannah Guthrie/Instagram
Speculation about exactly what Nancy Guthrie did after she returned home on the night she v...",Sheriff Believes Nancy Guthrie 'Went to Bed' Before She Was Abducted Overnight,"Investigators are still searching for ""Today"" host Savannah Guthrie's 84-year-old mom, who has been missing since Sat. Jan. 31.",,https://people.com/sheriff-believes-nancy-guthrie-went-to-bed-before-she-was-abducted-overnight-11901657,Sheriff Believes Nancy Guthrie 'Went to Bed' Before She Was Abducted Overnight,"Investigators are still searching for ""Today"" host Savannah Guthrie's 84-year-old mom, who has been missing since Sat. Jan. 31.",https://people.com/thmb/mgW5KXXmjyI55NChUJiEi1Tk1GY=/1500x0/filters:no_upscale():max_bytes(150000):strip_icc():focal(749x282:751x284)/chris-nanos-savannah-guthrie-nancy-guthrie-020626-1-07ecc1e3410c45ac9e1d7ae636e69108.jpg,,True,True,"https://people.com/thmb/xYByjNWbMdYAmts-fjkYMWY0YZQ=/1500x0/filters:no_upscale():max_bytes(150000):strip_icc():focal(749x282:751x284):format(webp)/chris-nanos-savannah-guthrie-nancy-guthrie-020626-1-07ecc1e3410c45ac9e1d7ae636e69108.jpg,https://tpc.googlesyndication.com/simgad/5747940643582955249?"
59fd68abc7dfbb1ddded29595c419d4a,20260207162548,3,Pamela Anderson’s Icy Blue Jacket Is the Playful Layer We Want to Wear Now Through Spring — Shop Her Look from $33,"Pamela Anderson wore an ice blue puffer jacket with a pale blue turtleneck sweater and straight-leg jeans while on set for her new movie “Somedays.” We found similar styles at Amazon, including a puffer coat under $35 and jeans from top brands like Levi’s, Lee, and Gap. Our finds start at $15",Izzy Baskette,entertainment,https://people.com/pamela-anderson-puffer-coat-straight-leg-jeans-blueprint-february-2026-11899426,https://people.com/thmb/u16a_-3GHVLY_KnNohn6ikg0oBA=/1500x0/filters:no_upscale():max_bytes(150000):strip_icc():focal(2999x0:3001x2)/peo-pamela-anderson-tout-5334c80c7c2e4b5f926e3fc071b95b08.jpg,published,,2026-02-07T16:25:48.916716,2026-02-07T16:25:48.916716,0,"If you click on links we provide, we may receive compensation.
Trade your basic black puffer for one of these colorful picks
Welcome to The Blueprint, where we break down the celebrity looks we want to wear right now and build them back up, piece by piece.
From Pamela Anderson’s peaceful existence on Vancouver Island to her minimalist beauty routine, there’s not much of her life I don’t want to copy — and my latest fangirl moment is fashion-related. 
Anderson wore an icy blue ensemble while filming her new movie Somedays, consisting of a baby blue puffer coat, a pale blue turtleneck top, and medium-wash straight-leg jeans. Her outfit expertly demonstrated how color can transform a typically bland one into a playful statement. That’s especially the case for her cozy coat, which I most often see in more mundane shades like black and navy. 
In fact, I figured out how to replicate her look with budget-friendly styles from Amazon’s fashion department — shop the three key staples you’ll need from $15.
Anderson’s frosty blue coat makes me want to roll my eyes at the sight of my boring black puffer hanging in my closet. On my hunt for whimsy, I was pleasantly surprised to find this similar style for under $35. I personally prefer slightly cropped silhouettes like this one because they don’t hide my curves behind heavy layers. Plus, the shortened hem doesn’t negate function. 
One customer noted that the coat is “incredibly lightweight yet surprisingly warm.” Other shoppers recommend sizing up one to accommodate for thick sweaters and hoodies. 
Straight-leg jeans are more comfortable than skinny jeans and still elongate your legs — a win-win. I gravitated towards these Levi’s because they have a slim silhouette and high waistline like Anderson’s. Buyers compliment the jeans’ soft material and comfortable fit. One shopper’s highest praise was: “The waist doesn’t gap, even when I’m squatting.”
In line with the monochromatic theme, Anderson’s character layered a muted blue turtleneck under her puffer. This cotton-blend option has a fitted (but not too tight) shape, foldover neckline, and ribbed hem. “The fabric feels soft against the skin but still has enough structure to hold its shape, and the knit is thick enough to be cozy without feeling bulky,” wrote a buyer. 
More Pamela Anderson-inspired clothing below includes a blue puffer that can be easily packed and an oversized turtleneck sweater.",pamela-anderson’s-icy-blue-jacket-is-the-playful-l,"If you click on links we provide, we may receive compensation.
Trade your basic black puffer for one of these colorful picks
Welcome to The Blueprint, where we break down the celebrity looks we want to wear right now and build them back up, piece by...",Pamela Anderson’s Icy Blue Jacket Is the Playful Layer We Want to Wear Now Through Spring — Shop Her Look from $33,"Pamela Anderson wore an ice blue puffer jacket with a pale blue turtleneck sweater and straight-leg jeans while on set for her new movie “Somedays.” We found similar styles at Amazon, including a puffer coat under $35 and jeans from top brands like Levi’s, Lee, and Gap. Our finds start at $15",,https://people.com/pamela-anderson-puffer-coat-straight-leg-jeans-blueprint-february-2026-11899426,Pamela Anderson’s Icy Blue Jacket Is the Playful Layer We Want to Wear Now Through Spring — Shop Her Look from $33,"Pamela Anderson wore an ice blue puffer jacket with a pale blue turtleneck sweater and straight-leg jeans while on set for her new movie “Somedays.” We found similar styles at Amazon, including a puffer coat under $35 and jeans from top brands like Levi’s, Lee, and Gap. Our finds start at $15",https://people.com/thmb/u16a_-3GHVLY_KnNohn6ikg0oBA=/1500x0/filters:no_upscale():max_bytes(150000):strip_icc():focal(2999x0:3001x2)/peo-pamela-anderson-tout-5334c80c7c2e4b5f926e3fc071b95b08.jpg,,True,True,https://people.com/thmb/BajGjqKELy_Y1G-CVIYNmdjrY54=/1500x0/filters:no_upscale():max_bytes(150000):strip_icc():focal(2999x0:3001x2):format(webp)/peo-pamela-anderson-tout-5334c80c7c2e4b5f926e3fc071b95b08.jpg
fd50dbdc8370549dcc6c4c32c1680687,20260207162552,4,Taylor Swift Sends Message to 'Really Inspiring' Athletes During Winter Olympics 2026 Opening Ceremony,Musician Taylor Swift pre-recorded a message for athletes that debuted during the Milano Cortina Winter Olympics Opening Ceremony.,Daniela Avila,entertainment,https://people.com/taylor-swift-sends-message-to-athletes-during-2026-winter-olympics-opening-ceremony-11901766,https://people.com/thmb/hJYe3dg3yOb9eRVOZ_yz30Nb1WM=/1500x0/filters:no_upscale():max_bytes(150000):strip_icc():focal(749x0:751x2)/taylor-swift-020626-1-af16303c178e469589c3d73d8886d5be.jpg,published,,2026-02-07T16:25:52.715575,2026-02-07T16:25:52.715575,0,"""I hope that this is an experience that you will cherish for the rest of your life,"" Swift said
Taylor Swift is wishing athletes good luck ahead of the 2026 Winter Olympics.
During the Milano Cortina Winter Olympics Opening Ceremony, the pop star made a cameo and shared a touching message with the athletes.
""I just wanted to say thank you!"" Swift, 36, said in pre-recorded video, wearing a Ralph Lauren Team U.S.A. Polo Bear Long Sleeve.
""Getting to learn your stories and see everything that you’ve sacrificed and all your determination and hard work and passion and everything that’s gotten you to this point where you’re so excellent at something, it’s just really inspiring,"" she continued.
""I am very grateful for everything you've done to get to this point in your life and grateful you brought us all along with you on this journey so that we get to watch you do this,"" the ""Fate of Ophelia"" singer concluded.
""I just hope that you have a wonderful Olympic games. Wishing you all the best of luck and a safe journey and I hope that this is an experience that you will cherish for the rest of your life.""
Swift's message to the athletes came hours after she dropped her star-studded music video for ""Opalite"" on Spotify and Apple Music.
The video begins as a satirical commercial for an ""Opalite"" spray that promises instant happiness — and turns into a cameo-packed love story around unconventional connections.
In an Instagram post, Swift said that the idea for the video ""crash landed into [her] imagination"" while promoting her 12th album on Graham Norton's talk show back in October 2025.
""I remember thinking I got ridiculously lucky with the group I was paired with,"" Swift explained, mentioning the group of actors and singers, which included Cillian Murphy, Domhnall Gleeson, Greta Lee, Jodie Turner-Smith and Lewis Capaldi, as people whose work she's ""admired from afar.""
She also thought it ""would be wild"" to include her fellow guests and Norton in the video, ""like a school group project, but for adults, and it isn’t mandatory.""
""To my delight, everyone from the show made the effort to time travel back to the 90’s with us and help with this video,"" the ""Cruel Summer"" singer wrote. ""You might even recognize some friendly faces from The Eras Tour ... I had more fun than I ever imagined - Made new friends, metaphors, and fashion choices. It was an absolute thrill to create this story and these characters.""

""Opalite"" was featured on her latest studio album Life of a Showgirl.
To learn more about all the Olympic and Paralympic hopefuls, come to people.com to check out ongoing coverage before, during and after the games. Watch the Milan Cortina Olympics and Paralympics, beginning Feb. 6, on NBC and Peacock.",taylor-swift-sends-message-to-really-inspiring-ath,"""I hope that this is an experience that you will cherish for the rest of your life,"" Swift said
Taylor Swift is wishing athletes good luck ahead of the 2026 Winter Olympics.
During the Milano Cortina Winter Olympics Opening Ceremony, the pop star mad...",Taylor Swift Sends Message to 'Really Inspiring' Athletes During Winter Olympics 2026 Opening Ceremony,Musician Taylor Swift pre-recorded a message for athletes that debuted during the Milano Cortina Winter Olympics Opening Ceremony.,,https://people.com/taylor-swift-sends-message-to-athletes-during-2026-winter-olympics-opening-ceremony-11901766,Taylor Swift Sends Message to 'Really Inspiring' Athletes During Winter Olympics 2026 Opening Ceremony,Musician Taylor Swift pre-recorded a message for athletes that debuted during the Milano Cortina Winter Olympics Opening Ceremony.,https://people.com/thmb/hJYe3dg3yOb9eRVOZ_yz30Nb1WM=/1500x0/filters:no_upscale():max_bytes(150000):strip_icc():focal(749x0:751x2)/taylor-swift-020626-1-af16303c178e469589c3d73d8886d5be.jpg,,True,True,"https://people.com/thmb/tji5n60h2qHdNzRPWZb22W2eQJA=/600x0/filters:no_upscale():max_bytes(150000):strip_icc():format(webp)/WinterOlympics2026_ResizedLogo_320height-13253ba80eed4a6b948c18a7277e33db.jpg,https://tpc.googlesyndication.com/simgad/5747940643582955249?,https://people.com/thmb/BTphq7z6ViAQX9_y2sW5DabS34s=/1500x0/filters:no_upscale():max_bytes(150000):strip_icc():focal(749x0:751x2):format(webp)/taylor-swift-020626-1-af16303c178e469589c3d73d8886d5be.jpg"
