id,run_id,row_id,title,description,source,category,link,image_url,status,scheduled_at,created_at,updated_at,likes,content,slug,excerpt,meta_title,meta_description,meta_keywords,canonical_url,og_title,og_description,og_image,focus_keyword,is_indexable,is_followable,images
eca7d0cf1764742579581f64625cfe19,20260207182217,15,"All About Alex Cooper, Host of the 'Call Her Daddy' Podcast","Alex Cooper, host of the 'Call Her Daddy' podcast on Spotify, is known for her interviews with some of Hollywood's biggest celebrities. Here's everything to know about Cooper.",Skyler Caruso,entertainment,https://people.com/human-interest/all-about-alex-cooper/,https://people.com/thmb/lPH8WnHRJQbRSqeqXwBFjRc9kqo=/1500x0/filters:no_upscale():max_bytes(150000):strip_icc():focal(879x452:881x454)/alex-cooper-facts-022423-2-390a5bb1f15b4aecbd7e1153654ecb8c.jpg,published,,2026-02-07T18:22:17.482570,2026-02-07T18:22:17.482570,0,"Here's everything to know about Alex Cooper, the podcast host who's famously interviewed stars including Miley Cyrus, Jane Fonda and Hailey Bieber
Alex Cooper is the name behind one of the most successful podcasts to date: Call Her Daddy.
Self-titled the ""Founding Father,"" Cooper has taken the podcast in a direction that's evolved tremendously since its release in 2018. Originally synonymous with its sex-heavy topics in what was branded ""female locker-room talk,"" her podcast now puts ""a modern twist on feminism"" in each episode that airs, according to marketing materials.
While Call Her Daddy covers a wide range of topics in typical podcast fashion, Cooper has become known for her tell-all interviews with Hollywood's A-listers. Guests have included Miley Cyrus, Chelsea Handler, John Mayer, Kelsea Ballerini and fake German heiress Anna Delvey.
In June 2021, Cooper and Spotify made a three-year deal worth more than $60 million in total, per Variety, which makes it the streaming platform's biggest exclusive deal for a female-led podcast ever. ""I want to be the biggest podcast in the world,"" Cooper revealed to the Wall Street Journal.
With an annual salary of $20 million, Cooper is now the highest-paid female podcaster on Spotify — and second only to Joe Rogan overall, the Los Angeles Times reported in June 2022. ""A woman just got what in the past would've been a male contract,"" she told the outlet.
As for her personal life, Cooper married Hollywood producer Matt Kaplan in April 2024.
Here's everything to know about Cooper, from her days as a Division I college athlete to her globally recognized career.
Prior to Cooper's three-year Spotify deal in 2021, Barstool Sports acquired Call Her Daddy approximately one month after its first episode aired in 2018.
Since the podcast's debut, the show's structure has evolved tremendously. Among one of the major changes? Cooper now hosts solo, a duty that came after parting ways with Sofia Franklyn — her former co-host, best friend and business partner — in April 2020.
The podcast went dark that year, leading tabloids and fans — deemed the ""Daddy Gang"" — to speculate about a fallout between Cooper and Franklyn, especially since the two posted that they ""legally can't speak out"" on the behind-the-scenes talk at the time.
Details remain murky as to what exactly caused the partnership to ""go up in flames,"" as Time put it, but it was in part due to a contract renegotiation with Barstool Sports. Ultimately, Cooper picked Call Her Daddy back up, while Franklyn started her own show a few months later.
For years, Call Her Daddy was synonymous with sex. It was known for raunchy talk and coining concepts like the ""Gluck Gluck 9000"" (an oral sex technique, FYI), keeping with the program's original ""female locker-room talk"" ethos.
Today, Cooper still exudes big-sister energy with the sex advice she distributes, but her content has evolved and expanded — despite people telling her ""they miss the old Call Her Daddy,"" she told the Los Angeles Times. Now, she covers a wider range of topics and caters to a broader demographic.
""It was like, 'How many times can we talk about sex?'"" she told the Los Angeles Times. ""I was getting a little bit bored. I need to be mentally stimulated by my content.""
Since then, topics on the show have included ""reclaiming your power"" after experiencing trauma, sexual fluidity, self-love and debunking mental health stigmas. Most of all, she wants to expand her conversations into the realm of female empowerment.
Furthermore, Call Her Daddy has taken on an interview-heavy format, featuring conversations between Cooper and some of the biggest names in Hollywood. The Q&A style is intimate, and Cooper gets stars to be candid about headline-making topics.
For example, when Jamie Lynn Spears was a guest on the show, she hoped to put to rest the accusations that she didn't help her sister Britney throughout her conservatorship. Hailey Baldwin Bieber revealed her favorite sex position with husband Justin Bieber, while Jane Fonda opened up about the ""secret life"" she used to live while struggling with an eating disorder.
On April 6, 2024, Cooper and Kaplan wed in Riviera Maya, Mexico.
“It was everything we wanted it to be,” the podcast host told Vogue. “It was emotional, heartfelt, and we tailored it to exactly how we always envisioned it.”
Cooper walked down the aisle in a custom gown by designer Danielle Frankel, while Kaplan donned a custom suit by The Cloakroom.
The Hollywood producer proposed to Cooper in March 2023 at their home in Los Angeles.
""I like, blacked out,"" Cooper recalled of the moment her now-husband got down on one knee. ""I think I said, 'yes,' at first. It was very surreal.""
Their engagement came after three years of dating, during most of which Cooper kept Kaplan's identity a secret from her fans. When mentioning him on her podcast, she would refer to him as only ""Mr. Sexy Zoom Man"" until revealing his identity in April 2023.
Although Cooper's fanbase has primarily consisted of millennials and Gen-Z over the years, there are two people who have been loyal followers since day one: her parents.
""They have always been my number one supporters,"" Cooper told Today. ""Even when people in my extended family would be like, 'Has she lost her mind?', my parents were like, 'No, because we know Alex and we know how we raised her and we know her talent.'""
Cooper's mom Laurie, a psychologist, has appeared on Call Her Daddy several times in the past. But while Cooper has created a name for herself as a go-to for advice, she's also gained some guidance from the person who knows her best.
""If she's talking to me about relationships, it's like, 'Do not lose yourself just to be with someone. Stay true to who you are,'"" Cooper told E! News. ""I think that goes through to every other aspect whether that's job, friendship, life, career.""
If there's something Cooper wants to make clear, it's that her success wasn't something that she just ""fell into."" Having attended Boston University as a Division I soccer player while majoring in film and television, the Call Her Daddy host worked hard to land where she is now.
Cooper's publicist considers her a ""one-woman operation,"" the Los Angeles Times reported. In addition to recording her own podcasts, she researches and edits almost entirely herself. According to Time, Spotify claims she's the most ""hands-on"" podcasting talent on its roster.
""There's this assumption that making a podcast is easy, but it's a lot of f—ing work. I take it with great pride that my whole life revolves around it,"" she told the Los Angeles Times. ""Every Sunday I'm working, I work seven days a week. And I love it. I would not want to do anything else.""","all-about-alex-cooper,-host-of-the-call-her-daddy-","Here's everything to know about Alex Cooper, the podcast host who's famously interviewed stars including Miley Cyrus, Jane Fonda and Hailey Bieber
Alex Cooper is the name behind one of the most successful podcasts to date: Call Her Daddy.
Self-titled...","All About Alex Cooper, Host of the 'Call Her Daddy' Podcast","Alex Cooper, host of the 'Call Her Daddy' podcast on Spotify, is known for her interviews with some of Hollywood's biggest celebrities. Here's everything to know about Cooper.",,https://people.com/human-interest/all-about-alex-cooper/,"All About Alex Cooper, Host of the 'Call Her Daddy' Podcast","Alex Cooper, host of the 'Call Her Daddy' podcast on Spotify, is known for her interviews with some of Hollywood's biggest celebrities. Here's everything to know about Cooper.",https://people.com/thmb/lPH8WnHRJQbRSqeqXwBFjRc9kqo=/1500x0/filters:no_upscale():max_bytes(150000):strip_icc():focal(879x452:881x454)/alex-cooper-facts-022423-2-390a5bb1f15b4aecbd7e1153654ecb8c.jpg,,True,True,https://people.com/thmb/emi0oShAxW7sZd4uW-7W8COxWAk=/1500x0/filters:no_upscale():max_bytes(150000):strip_icc():focal(879x452:881x454):format(webp)/alex-cooper-facts-022423-2-390a5bb1f15b4aecbd7e1153654ecb8c.jpg
50715675665b3ab5523cab42361003c5,20260207182223,16,Cosmetic Procedures,Cosmetic Procedures,People Staff,entertainment,https://people.com/cosmetic-procedures/,https://people.com/thmb/p59pCo344i0_rNdqBqhEEvBxyQM=/1500x0/filters:no_upscale():max_bytes(150000):strip_icc():focal(319x0:321x2)/people_social_image-60e0c8af9eb14624a5b55f2c29dbe25b.png,published,,2026-02-07T18:22:23.354222,2026-02-07T18:22:23.354222,0,,cosmetic-procedures,...,Cosmetic Procedures,Cosmetic Procedures,,https://people.com/cosmetic-procedures/,Cosmetic Procedures,Cosmetic Procedures,https://people.com/thmb/p59pCo344i0_rNdqBqhEEvBxyQM=/1500x0/filters:no_upscale():max_bytes(150000):strip_icc():focal(319x0:321x2)/people_social_image-60e0c8af9eb14624a5b55f2c29dbe25b.png,,True,True,"https://people.com/thmb/Jj3Q2udX-sx4IfXmvxtVGwk8cKc=/364x242/filters:no_upscale():max_bytes(150000):strip_icc():format(webp)/Singer-Lived-with-Outstretched-Earlobes-Heres-Why-He-Decided-to-Surgically-Reverse-Them-020326-fde4a3ebfe204220a0d3f7772ba51e3e.jpg,https://people.com/thmb/U18A-pdLN9RFBOxa_naPQwaw-wc=/364x242/filters:no_upscale():max_bytes(150000):strip_icc():format(webp)/brigette-pheloung-teeth-bonding-020526-1-4ffc0b581d3f497d9b3e057c6039be30.jpg,https://people.com/thmb/oP91n_RKQoqJTAwU1-d0HVzxOz0=/364x242/filters:no_upscale():max_bytes(150000):strip_icc():format(webp)/woman-face-laser-treatment-013026-ed386cd978334a5aabf8c489b8f4e6a2.jpg"
