id,run_id,row_id,title,description,source,category,link,image_url,status,scheduled_at,created_at,updated_at,likes,content,slug,excerpt,meta_title,meta_description,meta_keywords,canonical_url,og_title,og_description,og_image,focus_keyword,is_indexable,is_followable,images
f56c9ab8ca33120644ca6ec56b682331,20260207182126,4,Cardi B,"Cardi B is a rapper and reality TV star. The Bronx native first gained attention on Instagram before joining the cast of VH1's reality TV series 'Love & Hip-Hop: New York' in 2015. She released her debut single ""Bodak Yellow"" in 2017, earning two Grammy nominations. In 2019, she won her first Grammy for best rap album.",People Staff,entertainment,https://people.com/tag/cardi-b/,https://people.com/thmb/p59pCo344i0_rNdqBqhEEvBxyQM=/1500x0/filters:no_upscale():max_bytes(150000):strip_icc():focal(319x0:321x2)/people_social_image-60e0c8af9eb14624a5b55f2c29dbe25b.png,published,,2026-02-07T18:21:26.013435,2026-02-07T18:21:26.013435,0,,cardi-b,...,Cardi B,"Cardi B is a rapper and reality TV star. The Bronx native first gained attention on Instagram before joining the cast of VH1's reality TV series 'Love & Hip-Hop: New York' in 2015. She released her debut single ""Bodak Yellow"" in 2017, earning two Grammy nominations. In 2019, she won her first Grammy for best rap album.",,https://people.com/tag/cardi-b/,Cardi B,"Cardi B is a rapper and reality TV star. The Bronx native first gained attention on Instagram before joining the cast of VH1's reality TV series 'Love & Hip-Hop: New York' in 2015. She released her debut single ""Bodak Yellow"" in 2017, earning two Grammy nominations. In 2019, she won her first Grammy for best rap album.",https://people.com/thmb/p59pCo344i0_rNdqBqhEEvBxyQM=/1500x0/filters:no_upscale():max_bytes(150000):strip_icc():focal(319x0:321x2)/people_social_image-60e0c8af9eb14624a5b55f2c29dbe25b.png,,True,True,"https://people.com/thmb/6vToWFN4cUOwmFbZVaB0vRHViyY=/364x242/filters:no_upscale():max_bytes(150000):strip_icc():format(webp)/stefon-diggs-cardi-b-091825-53be1c02a6894423a6b49e0e4be56736.jpg,https://people.com/thmb/7xIS6l7S3Cdo6m-o_zwYD5czNYU=/364x242/filters:no_upscale():max_bytes(150000):strip_icc():format(webp)/cardi-b-plastic-surgery-split-020526-dcdd6f55a4ac43758e02397208d95e33.jpg,https://people.com/thmb/ZaLzuob9HFUFJroe-2DvO3ySbVQ=/364x242/filters:no_upscale():max_bytes(150000):strip_icc():format(webp)/cardi-b-stefon-diggs-bad-bunny-020326-461cc70328fd4c9e990676c24b1e9e03.jpg"
07961ab6e515c286dda2170435b1b598,20260207182130,5,Mariah Carey,"Mariah Carey is a Grammy-winning American singer, songwriter, and actress. Since the success of her 1990 self-titled album, Carey has become one of the best-selling musicians of all time. With 19 number-one singles, Carey has more than any other solo artist. She was inducted into the Songwriters Hall of Fame in 2020.",People Staff,entertainment,https://people.com/tag/mariah-carey/,https://people.com/thmb/p59pCo344i0_rNdqBqhEEvBxyQM=/1500x0/filters:no_upscale():max_bytes(150000):strip_icc():focal(319x0:321x2)/people_social_image-60e0c8af9eb14624a5b55f2c29dbe25b.png,published,,2026-02-07T18:21:30.003165,2026-02-07T18:21:30.003165,0,,mariah-carey,...,Mariah Carey,"Mariah Carey is a Grammy-winning American singer, songwriter, and actress. Since the success of her 1990 self-titled album, Carey has become one of the best-selling musicians of all time. With 19 number-one singles, Carey has more than any other solo artist. She was inducted into the Songwriters Hall of Fame in 2020.",,https://people.com/tag/mariah-carey/,Mariah Carey,"Mariah Carey is a Grammy-winning American singer, songwriter, and actress. Since the success of her 1990 self-titled album, Carey has become one of the best-selling musicians of all time. With 19 number-one singles, Carey has more than any other solo artist. She was inducted into the Songwriters Hall of Fame in 2020.",https://people.com/thmb/p59pCo344i0_rNdqBqhEEvBxyQM=/1500x0/filters:no_upscale():max_bytes(150000):strip_icc():focal(319x0:321x2)/people_social_image-60e0c8af9eb14624a5b55f2c29dbe25b.png,,True,True,"https://people.com/thmb/v3WoqPRxxy5Dy9io1g6l3UaIrRk=/364x242/filters:no_upscale():max_bytes(150000):strip_icc():format(webp)/Mariah-Carey-MusiCares-2026-Persons-of-the-Year-013026-1-eda273dc07714354a8408432e68f18b4.jpg,https://people.com/thmb/hPODhU5nOqDoucy5F3u2kn4wbQI=/364x242/filters:no_upscale():max_bytes(150000):strip_icc():format(webp)/mariah-carey-olympics-oening-ceremony-1-020626-13d7a52d1c554a67b611284ec8d1ee07.jpg,https://people.com/thmb/6tevur9YU8Qw24Vs6Vd1ffDxlpw=/364x242/filters:no_upscale():max_bytes(150000):strip_icc():format(webp)/mariah-carey-opening-ceremony-2026-winter-olympics-020226-2-91af3003bed64692ab57a276d37dee8c.jpg"
24ef3f0cb603a24f09ac5e7c3eaca67b,20260207182135,6,Cardi B Reveals Her Butt Injections Leaked for 5 Days: 'It Was the Craziest Pain Ever',Cardi B opens up about the body enhancement she received four years ago,Jillian Ruffo,entertainment,https://people.com/style/cardi-b-butt-enhanced-in-basement/,https://people.com/thmb/xDT8i6ZNiVmkQzQAHp9xstVBv5Y=/1500x0/filters:no_upscale():max_bytes(150000):strip_icc():focal(751x0:753x2)/cardi-b6-502d67a8544a490f97cc6d365ff0b42d.jpg,published,,2026-02-07T18:21:35.723239,2026-02-07T18:21:35.723239,0,"The rapper tells GQ about getting scary plastic surgery in a basement four years ago
There’s very little Cardi B hasn’t shared about herself, whether it’s anecdotes from her former career as a stripper or insight on how she’s grappling with the pressures of instant fame. But her latest revelation might be her most personal yet.
In a new interview with GQ, the rapper, who confirmed rumors of her pregnancy during an SNL performance over the weekend, revealed that four years ago she had shady butt injection plastic surgery done in a basement in Queens.
The star said she received an underground, $800 butt-enhancing treatment at the age of 21 because she wanted to make more money as a stripper. But because she “didn’t have enough meat” on her body, she couldn’t go for liposuction to transfer fat to her backside. So instead, she had a woman inject fillers into the area.
“They don’t numb your ass with anything,” she told GQ of the dangerous plastic surgery procedure. “It was the craziest pain ever. I felt like I was gonna pass out. I felt a little dizzy. And it leaks for, like, five days.”
https://www.instagram.com/p/BfUnrG2hsxE/?hl=en&taken-by=iamcardib
It seems that Cardi was one of the lucky ones, because when she went back for a second round of injections, the woman who administered them was allegedly in jail.
RELATED PHOTOS: Stars Who Love Their Plastic Surgery
“But by the time I was gonna go get it, the lady got locked up ’cause she’s supposedly killed somebody. Well, somebody died on her table.”
RELATED PHOTOS: All the Fabulous Ways Cardi B Hid Her Baby Bump This Year
The star, who feels empowered showing some skin on stage and social media, revealed a personal body transformation on Saturday, flaunting her baby bump during a performance on Saturday Night Live.
“The love I’m receiving is overwhelming😩!” she wrote in response to her supporters. “I can’t thank you enough for always finding the time to share your support!! Thank you a million times @badgalriri.”",cardi-b-reveals-her-butt-injections-leaked-for-5-d,"The rapper tells GQ about getting scary plastic surgery in a basement four years ago
There’s very little Cardi B hasn’t shared about herself, whether it’s anecdotes from her former career as a stripper or insight on how she’s grappling with the press...",Cardi B Reveals Her Butt Injections Leaked for 5 Days: 'It Was the Craziest Pain Ever',Cardi B opens up about the body enhancement she received four years ago,,https://people.com/style/cardi-b-butt-enhanced-in-basement/,Cardi B Reveals Her Butt Injections Leaked for 5 Days: 'It Was the Craziest Pain Ever',Cardi B opens up about the body enhancement she received four years ago,https://people.com/thmb/xDT8i6ZNiVmkQzQAHp9xstVBv5Y=/1500x0/filters:no_upscale():max_bytes(150000):strip_icc():focal(751x0:753x2)/cardi-b6-502d67a8544a490f97cc6d365ff0b42d.jpg,,True,True,https://people.com/thmb/sTSOJxdMn5IeqBvizoOE3y2H5XQ=/4000x0/filters:no_upscale():max_bytes(150000):strip_icc():focal(751x0:753x2):format(webp)/cardi-b6-502d67a8544a490f97cc6d365ff0b42d.jpg
7dc62b66998930a7336511e6f2d5115b,20260207182139,7,Cardi B Shares Advice for Anyone Considering Plastic Surgery After Removing Her Butt Injections,The rapper warned her fans to do research and listen to doctors before getting any cosmetic procedures,Vanessa Etienne,entertainment,https://people.com/health/cardi-b-shares-advice-for-anyone-considering-plastic-surgery-after-removing-her-butt-injections/,https://people.com/thmb/OMBCfKOB1OBmgVG-CNdMHO6IBBY=/1500x0/filters:no_upscale():max_bytes(150000):strip_icc():focal(719x319:721x321)/cardi-b-ama-120222-44ddfa224b924896a4e86d672b2330d6.jpg,published,,2026-02-07T18:21:39.886294,2026-02-07T18:21:39.886294,0,"The rapper warned her fans to do research and listen to doctors before getting any cosmetic procedures
Cardi B is giving an update on her experience with plastic surgery.
The ""Up"" rapper, 30, recently appeared on Instagram Live and warned her followers about doing their research before getting cosmetic procedures done. She explained that she wanted to be open with her fans because ""a lot of people thought as soon as I gave birth [to son Wave, 15 months] I got my body done.""
""In August I got surgery and I removed 95% of my biopolymers... if you don't know what it is, it's ass shots. It was a really crazy process,"" Cardi B — who previously discussed getting the illegal silicone shots for $800 in a basement in 2014 — explained. ""All I'm going to say is that if you're young, if you're 19, 20, 21, and sometimes you're too skinny, and you be like 'OMG I don't have enough fat to put in my ass,' so you result to ass shots, DON'T!""
""When it comes to BBLs, if y'all want advice from me, before you get your BBL done you have to make sure your blood levels are all right,"" she added. ""If a doctor says your blood levels are too low or you have diabetes or whatever, don't do it.""
Cardi B, who also confirmed her recent rhinoplasty, has never shied away from discussing her plastic surgery experiences. Back in 2021, she said the enhancements make her feel confident.
""Well, I'm from New York, right? And New York is a melting pot, especially where I grew up in the Bronx. I was really skinny when I was younger, and in the Bronx, it's about being thick and having an ass so young boys would be like, 'Look at your flat ass. You ain't got no titties.' And it would make me feel so ugly and undeveloped,"" the rapper said in an intimate conversation with Mariah Carey for her Interview cover story.
When Cardi was old enough to work as a dancer in a strip club, she used her earnings to get breast implants, which was the first step toward forgetting about her insecurities.
""When I was 18 and became a dancer, I had enough money to afford to buy boobs, so every insecurity that I felt about my breasts was gone,"" she said at the time. But by age 20, enhancing her butt became her next priority. ""When I was 20, I went to the urban strip club, and in the urban strip clubs, you had to have a big butt. So I felt insecure about that. It took me back to high school. So I got my ass done.""
In addition to her previous augmentations, the rapper underwent a second breast surgery as well as liposuction in 2019 following the birth of daughter Kulture, now 4.",cardi-b-shares-advice-for-anyone-considering-plast,"The rapper warned her fans to do research and listen to doctors before getting any cosmetic procedures
Cardi B is giving an update on her experience with plastic surgery.
The ""Up"" rapper, 30, recently appeared on Instagram Live and warned her followe...",Cardi B Shares Advice for Anyone Considering Plastic Surgery After Removing Her Butt Injections,The rapper warned her fans to do research and listen to doctors before getting any cosmetic procedures,,https://people.com/health/cardi-b-shares-advice-for-anyone-considering-plastic-surgery-after-removing-her-butt-injections/,Cardi B Shares Advice for Anyone Considering Plastic Surgery After Removing Her Butt Injections,The rapper warned her fans to do research and listen to doctors before getting any cosmetic procedures,https://people.com/thmb/OMBCfKOB1OBmgVG-CNdMHO6IBBY=/1500x0/filters:no_upscale():max_bytes(150000):strip_icc():focal(719x319:721x321)/cardi-b-ama-120222-44ddfa224b924896a4e86d672b2330d6.jpg,,True,True,
621f5120e7972e437beb949d0d1b0275,20260207182144,8,Cardi B Reveals She Got Another Round of Butt Injections Removed in January,Rapper Cardi B revealed during a recent Instagram Live that she got another round of butt injections removed in January 2024.,Ingrid Vasquez,entertainment,https://people.com/cardi-b-reveals-she-got-another-round-of-butt-injections-removed-in-january-8720876,https://people.com/thmb/E9uD2b9A73C0JEuv1ywCMBEPNCY=/1500x0/filters:no_upscale():max_bytes(150000):strip_icc():focal(749x0:751x2)/cardi-b-091924-52596036a42047d788d773a98eb8e32d.jpg,published,,2026-02-07T18:21:44.401080,2026-02-07T18:21:44.401080,0,"The mom of three began the process in 2022
Cardi B is giving fans an update on her butt injection removal process.
In a recent Instagram Live, the rapper, 31, who welcomed a daughter earlier in September, announced that she had more of her butt injections removed earlier in the year.
""In January, right after I shot 'Like What,' I went and got surgery. I got some more butt injections removed. Because, you know, it takes rounds to get your butt injections removed. I got some of my butt injections removed. And I also went to fix, like, you know, certain things [with] my fibrosis,"" said Cardi.
Pierrick Rocher/BFA.com/Shutterstock 
The Grammy winner previously revealed during a December 2022 Instagram Live that she had ""95%"" of her biopolymers removed from her buttocks that August. Biopolymers are silicone shots that Cardi previously told GQ she got for $800 in a basement in 2014.
The PEOPLE Puzzler crossword is here! How quickly can you solve it? Play now!
In 2017, the U.S. Food and Drug Administration issued a safety communication warning consumers that ""injectable silicone used for body contouring is not FDA-approved and can cause serious side effects that may be permanent or may even lead to death.""
""Side effects can include ongoing pain and serious injuries, such as scarring, tissue death, and permanent disfigurement; if the silicone migrates beyond the injection site, it could cause an embolism (blockage of a blood vessel), stroke, infections and death. Serious complications may occur right away or could develop weeks, months, or years later,"" added the federal agency.
Later in the Instagram Live, Cardi also shared how she ""automatically"" knew she was pregnant again when she ""woke up one morning and my mouth tasted like copper.""
In addition to their newborn, Cardi and Offset share daughter Kulture Kiari, 6, son Wave Set, 3.
The mom of three has been candid about her postpartum journey on Instagram, giving fans a view of her stair master workouts and new mindset.

Never miss a story — sign up for PEOPLE's free daily newsletter to stay up-to-date on the best of what PEOPLE has to offer​​, from celebrity news to compelling human interest stories.
""This is my third baby and postpartum is a little different from my first two... I'm not doing heaving lifting, no muscle straining, squatting none of that... just cardio,"" she previously wrote on X. ""Sometimes to avoid postpartum depression you gotta keep your mind busy and for me that's work and staying active...""",cardi-b-reveals-she-got-another-round-of-butt-inje,"The mom of three began the process in 2022
Cardi B is giving fans an update on her butt injection removal process.
In a recent Instagram Live, the rapper, 31, who welcomed a daughter earlier in September, announced that she had more of her butt injec...",Cardi B Reveals She Got Another Round of Butt Injections Removed in January,Rapper Cardi B revealed during a recent Instagram Live that she got another round of butt injections removed in January 2024.,,https://people.com/cardi-b-reveals-she-got-another-round-of-butt-injections-removed-in-january-8720876,Cardi B Reveals She Got Another Round of Butt Injections Removed in January,Rapper Cardi B revealed during a recent Instagram Live that she got another round of butt injections removed in January 2024.,https://people.com/thmb/E9uD2b9A73C0JEuv1ywCMBEPNCY=/1500x0/filters:no_upscale():max_bytes(150000):strip_icc():focal(749x0:751x2)/cardi-b-091924-52596036a42047d788d773a98eb8e32d.jpg,,True,True,https://people.com/thmb/MHboSdxb2Qo9JvUjGMc6HrEcE2g=/1500x0/filters:no_upscale():max_bytes(150000):strip_icc():focal(749x0:751x2):format(webp)/cardi-b-091924-52596036a42047d788d773a98eb8e32d.jpg
f40473bc175bcc8a31fc6a7b14404475,20260207182149,9,Cardi B Says Kim Kardashian Gave Her Plastic Surgery Advice After Botched Nose Fillers,"Cardi B revealed she had ""no choice"" but to get a nose job after getting bad fillers done in 2019",Vanessa Etienne,entertainment,https://people.com/health/cardi-b-says-kim-kardashian-gave-her-plastic-surgery-advice-after-botched-nose-fillers/,https://people.com/thmb/D_ghd2eD3B125-z5CIam868bdcw=/1500x0/filters:no_upscale():max_bytes(150000):strip_icc():focal(299x319:301x321)/cardi-b-kim-kardashian-011923-f730f661ba814eec980bba77776d1e59.jpg,published,,2026-02-07T18:21:49.743682,2026-02-07T18:21:49.743682,0,"Cardi B revealed she had “no choice” but to get a nose job after getting bad fillers done in 2019
Cardi B has never shied away from discussing her plastic surgery experiences, and now the rapper is detailing her unwanted nose job after receiving botched fillers.
The 30-year-old appeared on a new episode of REVOLT's The Jason Lee Show where she opened up her past cosmetic procedures and how Kim Kardashian gave her surgeon recommendations for a nose job.
""I always felt like I had a big nose,"" Cardi told host Jason Lee. ""Even before I was famous, I was like 'Damn, I've got my daddy's nose.' I was always afraid to do my nose but I finally took that step.""
The ""WAP"" rapper recalled being told by several people back in 2018 that nose fillers were a better and non-surgical way to make her nose smaller, so she went through with it.
""I did fillers on my nose in 2019. And that s— f—--- my nose up,"" she said before admitting that she didn't even know how the fillers were supposed to work. ""I was like, 'Oh my God, what did I do to myself?'""
Cardi said it's important for her to share her horror story for those who are considering similar procedures.
""When you see stuff on Instagram, it just makes sense. But fillers just made my nose longer and it got wider,"" Cardi explained, adding that because of the botched procedure she had ""no choice"" but to get surgery on her nose.
Lee then asked the Grammy winner how she decides which doctors perform her surgeries, recalling a moment when Kardashian, 42, gave her some advice.
""I remember the time we were at Kris' [Jenner] house and Kim gave you a list of people you could call to get help,"" he said. ""You didn't call none of those people?""
""No, I called a couple of people that she gave me,"" Cardi responded, noting that she ultimately went with someone else and got her rhinoplasty in 2020.
Now, Cardi said she's done with plastic surgery, boasting, ""I look great."" During the podcast, she also assured that there's nothing wrong with her decision to get any cosmetic procedures.
""This is the tricky thing about a lot of people. People will assume when you do surgery or something, you're insecure about yourself or you hate yourself, and that's just not the truth,"" Cardi said. ""If I want to correct something, if I want to do a little something-something like … I'm gonna do it. I like being perfect. I like a certain type of body, like, for myself.""",cardi-b-says-kim-kardashian-gave-her-plastic-surge,"Cardi B revealed she had “no choice” but to get a nose job after getting bad fillers done in 2019
Cardi B has never shied away from discussing her plastic surgery experiences, and now the rapper is detailing her unwanted nose job after receiving botc...",Cardi B Says Kim Kardashian Gave Her Plastic Surgery Advice After Botched Nose Fillers,"Cardi B revealed she had ""no choice"" but to get a nose job after getting bad fillers done in 2019",,https://people.com/health/cardi-b-says-kim-kardashian-gave-her-plastic-surgery-advice-after-botched-nose-fillers/,Cardi B Says Kim Kardashian Gave Her Plastic Surgery Advice After Botched Nose Fillers,"Cardi B revealed she had ""no choice"" but to get a nose job after getting bad fillers done in 2019",https://people.com/thmb/D_ghd2eD3B125-z5CIam868bdcw=/1500x0/filters:no_upscale():max_bytes(150000):strip_icc():focal(299x319:301x321)/cardi-b-kim-kardashian-011923-f730f661ba814eec980bba77776d1e59.jpg,,True,True,https://people.com/thmb/Jd-7UWIch9rXvEdobAYNx_fUvuY=/1500x0/filters:no_upscale():max_bytes(150000):strip_icc():focal(299x319:301x321):format(webp)/cardi-b-kim-kardashian-011923-f730f661ba814eec980bba77776d1e59.jpg
806de424a47366f7ad55dc56430439c5,20260207182154,10,Cardi B Confirms She Got Liposuction: 'I Shouldn't Really Be Performing',"The rapper told the crowd at the Beale Street Music Festival that she's not supposed to be ""moving too much""",Julie Mazziotta,entertainment,https://people.com/health/cardi-b-confirms-liposuction/,https://people.com/thmb/nTi8_YstV0JUt7bErDSTAIYw6Qg=/1500x0/filters:no_upscale():max_bytes(150000):strip_icc():focal(665x0:667x2)/gettyimages-1140635996_1-2000-2f5e661c241d41a4b153a0f78ea3e41b.jpg,published,,2026-02-07T18:21:54.398780,2026-02-07T18:21:54.398780,0,"The rapper told the crowd at the Beale Street Music Festival that she's not supposed to be ""moving too much""
Cardi B is owning up to getting liposuction.
After denying it for months, the 26-year-old rapper told the crowd at the Beale Street Music Festival in Memphis on Sunday night that she did get the plastic surgery.
A few songs into her set, Cardi B, dressed in a skin-tight, sparkly red jumpsuit, said that she shouldn’t really be on stage.
“I have some news for y’all. I should have canceled today,” she said at the festival, sponsored by Facebook. “I shouldn’t really be performing because moving too much is gonna f— up my lipo. But bitch I’m still gonna get my motherf—ing money back, let’s go!”
The crowd erupted into laughs and cheers after her announcement.
Back in August, one month after giving birth to her first child, daughter Kulture Kiari, Cardi B floated the idea of getting liposuction.
“I still feel like I got a lot of love handles right here,” she said, while pulling on her tummy. “It’s not much but it’s like — I’m used to having, like, a real tight stomach … I might just get a little lipo, you know what I’m sayin’?”
RELATED VIDEO: Cardi B Says She Did Not Get Liposuction After Giving Birth — and Shows Off Her Abs
Two months later, in October, the “I Like It” singer showed off her toned stomach on her Instagram story, but said it was all natural.
“I never did lipo, bro. Never,” she told the camera.
However, last Wednesday she revealed that she had a second breast augmentation.
“I just got my boobs redone,” she said. “I feel good, but then sometimes I feel like not, you know? [When] your skin is stretched out. Yes, my daughter f—ed me up. She did. She so did.”
A day later, Cardi B wowed fans with her rock-hard abs at the Billboard Music Awards. Decked out in an ab-baring, two-piece yellow outfit, she went on to win six awards.
Cardi B will attend the annual Met Gala on Monday night in New York City — this year the event has a camp theme.",cardi-b-confirms-she-got-liposuction:-i-shouldnt-r,"The rapper told the crowd at the Beale Street Music Festival that she's not supposed to be ""moving too much""
Cardi B is owning up to getting liposuction.
After denying it for months, the 26-year-old rapper told the crowd at the Beale Street Music Fes...",Cardi B Confirms She Got Liposuction: 'I Shouldn't Really Be Performing',"The rapper told the crowd at the Beale Street Music Festival that she's not supposed to be ""moving too much""",,https://people.com/health/cardi-b-confirms-liposuction/,Cardi B Confirms She Got Liposuction: 'I Shouldn't Really Be Performing',"The rapper told the crowd at the Beale Street Music Festival that she's not supposed to be ""moving too much""",https://people.com/thmb/nTi8_YstV0JUt7bErDSTAIYw6Qg=/1500x0/filters:no_upscale():max_bytes(150000):strip_icc():focal(665x0:667x2)/gettyimages-1140635996_1-2000-2f5e661c241d41a4b153a0f78ea3e41b.jpg,,True,True,https://tpc.googlesyndication.com/simgad/5747940643582955249?
