id,run_id,row_id,title,description,source,category,link,image_url,status,scheduled_at,created_at,updated_at,likes,content,slug,excerpt,meta_title,meta_description,meta_keywords,canonical_url,og_title,og_description,og_image,focus_keyword,is_indexable,is_followable,images
629546bf092f697d8e980f8edd9e8b47,20260207162727,26,Wayfair’s Under-the-Radar Storefront Is My Secret for Better Sleep — I’m Shopping These Bedtime Upgrades from $14,"Wayfair has a secret storefront full of bedding finds for better sleep. One editor, who struggles with sleep, shared her top picks, including a cozy Eddie Bauer comforter, silk pillowcases, and cooling sheets. Prices start at $14",Michelle Baricevic,entertainment,https://people.com/wayfair-better-sleep-storefront-february-2026-11899700,https://people.com/thmb/oCUUgztjjjTz3l4AhUeUz1vBKzg=/1500x0/filters:no_upscale():max_bytes(150000):strip_icc():focal(2999x0:3001x2)/peo-wayfair-better-sleep-storefront-roundup-tout-59802b95eb024ce8b3af55046ecdf0d8.jpg,published,,2026-02-07T16:27:27.716743,2026-02-07T16:27:27.716743,0,"If you click on links we provide, we may receive compensation.
Including luxurious silk pillowcases, a cozy Eddie Bauer comforter, and cooling sheets
I’m a terrible sleeper. My brain doesn’t know how to shut off when I go to bed, and I’m lucky if I get one or two hours of sleep per night. 
Though drinking copious amounts of coffee helps me function, I recently learned that updating your sleep space can improve your shut-eye. So, I’m turning to Wayfair’s under-the-radar Sounder Sleep Shop for a little sleep aid. It’s filled with cozy comforters, cooling pillows, and snuggly quilts to help me—and you—get off to dreamland faster.
Below, you’ll find my top 10 upgrades from brands like Eddie Bauer and Laura Ashley, starting at just $14. 
Your bedroom should be your personal oasis, so I’m using this Eddie Bauer comforter and the included pillow shams to boost my room’s cozy factor. Featuring brushed micro-suede on one side and snuggly faux shearling on the other, this reversible find will go a long way toward helping me relax come bedtime and stay warm during the remaining six weeks of winter. Reviewers add that it’s the “perfect weight” and “fits great on [a] bed,” with another person sharing that it’s so warm, you won’t need another blanket underneath.
Since I normally don’t get enough of it, I know sleep is a luxury in more ways than one. These thermoregulating silk pillowcases might be enough to convince my overactive mind to settle down for the night. They’re made from super-soft Mulberry silk, which shoppers say helps prevent wrinkles and tame frizzy hair. Now that’s beauty sleep I can get behind. 
In addition to being a bad sleeper, I also run hot when I go to bed. These cooling sheets should help me on both fronts. Older shoppers say they’re a “game changer for hot flashes,” while others add that they “feel unbelievably soft and silky — almost like hotel luxury bedding,” thanks to their bamboo fabric. 
Lately, I've gotten into the habit of reading at night to quiet my brain and unwind before going to sleep. I do most of this reading in the armchair that sits in the corner of my bedroom, and I am already looking forward to wrapping myself in this throw blanket while curling up with my next novel. I’m drawn to its chunky, knitted texture. It’s hypoallergenic, making it a safe choice for me and others who have sensitive skin. Shoppers add that it has a “high-end look that instantly elevates” any space, and its generous size is suitable for draping over the end of your bed.
Get a better night’s sleep by grabbing these bedding upgrades from Wayfair while they’re on sale for up to 71 percent off.",wayfair’s-under-the-radar-storefront-is-my-secret-,"If you click on links we provide, we may receive compensation.
Including luxurious silk pillowcases, a cozy Eddie Bauer comforter, and cooling sheets
I’m a terrible sleeper. My brain doesn’t know how to shut off when I go to bed, and I’m lucky if I g...",Wayfair’s Under-the-Radar Storefront Is My Secret for Better Sleep — I’m Shopping These Bedtime Upgrades from $14,"Wayfair has a secret storefront full of bedding finds for better sleep. One editor, who struggles with sleep, shared her top picks, including a cozy Eddie Bauer comforter, silk pillowcases, and cooling sheets. Prices start at $14",,https://people.com/wayfair-better-sleep-storefront-february-2026-11899700,Wayfair’s Under-the-Radar Storefront Is My Secret for Better Sleep — I’m Shopping These Bedtime Upgrades from $14,"Wayfair has a secret storefront full of bedding finds for better sleep. One editor, who struggles with sleep, shared her top picks, including a cozy Eddie Bauer comforter, silk pillowcases, and cooling sheets. Prices start at $14",https://people.com/thmb/oCUUgztjjjTz3l4AhUeUz1vBKzg=/1500x0/filters:no_upscale():max_bytes(150000):strip_icc():focal(2999x0:3001x2)/peo-wayfair-better-sleep-storefront-roundup-tout-59802b95eb024ce8b3af55046ecdf0d8.jpg,,True,True,https://people.com/thmb/vjZ7ZHNoaDAVmG5ir7_HY3QNNKI=/1500x0/filters:no_upscale():max_bytes(150000):strip_icc():focal(2999x0:3001x2):format(webp)/peo-wayfair-better-sleep-storefront-roundup-tout-59802b95eb024ce8b3af55046ecdf0d8.jpg
ffba407f332422169e7df52b98ab1f30,20260207162732,27,Home Products,"Our PEOPLE.com shopping editors test and review all the best home products and find the best deals on everything from home decor, vacuums, and sheets to kitchen appliances and furniture.",People Staff,entertainment,https://people.com/shopping-home,https://people.com/thmb/p59pCo344i0_rNdqBqhEEvBxyQM=/1500x0/filters:no_upscale():max_bytes(150000):strip_icc():focal(319x0:321x2)/people_social_image-60e0c8af9eb14624a5b55f2c29dbe25b.png,published,,2026-02-07T16:27:32.589592,2026-02-07T16:27:32.589592,0,,home-products,...,Home Products,"Our PEOPLE.com shopping editors test and review all the best home products and find the best deals on everything from home decor, vacuums, and sheets to kitchen appliances and furniture.",,https://people.com/shopping-home,Home Products,"Our PEOPLE.com shopping editors test and review all the best home products and find the best deals on everything from home decor, vacuums, and sheets to kitchen appliances and furniture.",https://people.com/thmb/p59pCo344i0_rNdqBqhEEvBxyQM=/1500x0/filters:no_upscale():max_bytes(150000):strip_icc():focal(319x0:321x2)/people_social_image-60e0c8af9eb14624a5b55f2c29dbe25b.png,,True,True,"https://people.com/thmb/DBefbsXCYQs3fmDoFV6BxDGBlHI=/364x242/filters:no_upscale():max_bytes(150000):strip_icc():format(webp)/peo-ent-team-affnet-roundup---pottery-barn-furniture-deals-tout-9ffc868bb8c64b5ebd410fe8e09fc066.jpg,https://people.com/thmb/6Yh_hkpae5ddfSNefqRo8UcDmX0=/364x242/filters:no_upscale():max_bytes(150000):strip_icc():format(webp)/peo-i-set-a-dollar50-limit-for-my-boyfriends-valentines-day-gifts-tout-7927cec329f4430fb36700aac23a657f.jpg,https://people.com/thmb/Qn4VdkFuyvuAyf5hYJCCNK7rSIo=/364x242/filters:no_upscale():max_bytes(150000):strip_icc():format(webp)/peo-wayfair-better-sleep-storefront-roundup-tout-59802b95eb024ce8b3af55046ecdf0d8.jpg"
7ef08487b6bf5d8f6a9dd54a529ee31f,20260207162735,28,Doctor Dismissed 40-Year-Old's ‘Frog Throat’ for Years. Then She Had Her Entire Thyroid Removed (Exclusive),"A doctor dismissed one woman's concerns over a growing goiter after her thyroid testing panel came back ‘normal.’ After years of physical and mental health issues, she had to have her entire thyroid removed, only to learn she had been dealing with undiagnosed Hashimoto’s disease, an autoimmune disorder, the whole time.",Tereza Shkurtaj,entertainment,https://people.com/doctor-dismissed-womans-frog-throat-then-had-thyroid-removed-exclusive-11899514,https://people.com/thmb/KlXVKp_VycayN6tWXSe3N-xVtCE=/1500x0/filters:no_upscale():max_bytes(150000):strip_icc():focal(749x0:751x2)/thyroid-goiter-6-020426-10a51aa8d1de4aafad1b8cdd679bdb87.jpg,published,,2026-02-07T16:27:35.492658,2026-02-07T16:27:35.492658,0,"“I knew there was something deeper going on but [the doctor] never listened to me or my concerns,” Heather Wallace tells PEOPLE
Around May 2017, Heather Wallace began noticing swelling in her neck that resembled a goiter – a visible enlargement of the thyroid gland.
Concerned by its rapid growth and the development of a persistent cough, she went to see an endocrinologist in April 2018.
At the appointment, the doctor ran standard thyroid tests that measured both thyroxine (T4) and the thyroid-stimulating hormone (TSH) to determine whether her thyroid was functioning properly.
When those results came back “normal,” the mother of three pushed for more thorough testing, but her request was ultimately dismissed for years. “I knew there was something deeper going on, but [the doctor] never listened to me or my concerns,” Wallace, 40, tells PEOPLE exclusively.
As the goiter continued to grow, Wallace slowly began to realize how much it was shaping her everyday life in ways she hadn’t initially connected.
Activities she once took for granted – long walks, keeping up with her children, even basic movement – left her unusually winded. At the time, she assumed she was simply out of shape, not recognizing that the strain on her body had been building for years.
“Some days I would truthfully just forget that I had a giant goiter in my neck because my body didn’t feel inflamed or bothered,” Wallace admits. “But there were other days when I would be in a flare, and my throat would feel so thick and large.”
Never miss a story — sign up for PEOPLE's free daily newsletter to stay up-to-date on the best of what PEOPLE has to offer​​, from celebrity news to compelling human interest stories.
Living with a visibly enlarged neck also meant navigating constant public attention. Strangers stared, and while Wallace understood that her case was unusual, the awareness never stopped weighing on her.
The attention became more painful when online comments turned into mockery, with people calling her “frog throat girl” and comparing her to a bullfrog.
“My mental health was definitely affected,” Wallace reveals, adding that the emotional toll often brought on bouts of depression. “I had such negative views about my looks, I felt so ugly.”
With a combination of persistent symptoms, unanswered questions and changes to her appearance, Wallace tells PEOPLE it all started to eat away at her self-esteem. “After years of trying to figure out the reason for my goiter with no avail… I felt so defeated,” she says. 
Eventually, after getting the opinion of yet another doctor, surgery became unavoidable. In December 2025, Wallace went into the operating room expecting a hemithyroidectomy, or thyroid lobectomy, believing only her right thyroid lobe would be removed. She was “heartbroken” to later learn they had to remove the entire gland.
“It was such a disappointment,” she admits. “When I woke up and found out I had lost my entire thyroid, I was so very sad.”
That sense of grief quickly turned into anger when she learned that a later biopsy of her thyroid showed signs of undiagnosed Hashimoto’s disease, an autoimmune disorder in which ""immune-system cells lead to the death of the thyroid's hormone-producing cells,"" per the Mayo Clinic.
“I had spent years seeing doctors and never once did any of them test for Hashimoto’s until now,” Wallace shares. “I just wish I would have known this from the start so I could have taken care of myself in ways I didn’t know I should have because I didn’t know I had autoimmune issues until it was too late.”
Two months after the surgery, Wallace says life without a thyroid has stabilized. Medication adjustments have helped ease the side effects of an initially high hormone dose, and her body is responding well.
Emotionally, the process has been more complicated. She is still working through the weight of losing a vital organ and relying on daily medication to survive.
Over time, however, her relationship with her body has shifted in a surprising way. Without the goiter, Wallace says she feels more at home in her own skin than she has in nearly a decade.
“Once I got [the goiter] removed, I was finally able to wear necklaces again after eight years, I finally had a stronger jawline again, and I can hug my family without my neck getting squished between us,” she explains. “I think finally looking like the woman I was when I married my husband 10 years ago has really helped rebuild my confidence.”
Today, Wallace hopes her experience encourages others to trust themselves when something in their body feels off.
“Advocate for yourself,” she warns – urging patients to ask questions, seek support and push for thorough testing.
For those living with visible medical conditions, she emphasizes that judgment does not define worth.
“You have a purpose in this life and you can change so many people's lives because of the issues you have to face on a daily basis,” Wallace tells PEOPLE. “Let your heart shine brighter than the dark world around you.”",doctor-dismissed-40-year-olds-‘frog-throat’-for-ye,"“I knew there was something deeper going on but [the doctor] never listened to me or my concerns,” Heather Wallace tells PEOPLE
Around May 2017, Heather Wallace began noticing swelling in her neck that resembled a goiter – a visible enlargement of th...",Doctor Dismissed 40-Year-Old's ‘Frog Throat’ for Years. Then She Had Her Entire Thyroid Removed (Exclusive),"A doctor dismissed one woman's concerns over a growing goiter after her thyroid testing panel came back ‘normal.’ After years of physical and mental health issues, she had to have her entire thyroid removed, only to learn she had been dealing with undiagnosed Hashimoto’s disease, an autoimmune disorder, the whole time.",,https://people.com/doctor-dismissed-womans-frog-throat-then-had-thyroid-removed-exclusive-11899514,Doctor Dismissed 40-Year-Old's ‘Frog Throat’ for Years. Then She Had Her Entire Thyroid Removed (Exclusive),"A doctor dismissed one woman's concerns over a growing goiter after her thyroid testing panel came back ‘normal.’ After years of physical and mental health issues, she had to have her entire thyroid removed, only to learn she had been dealing with undiagnosed Hashimoto’s disease, an autoimmune disorder, the whole time.",https://people.com/thmb/KlXVKp_VycayN6tWXSe3N-xVtCE=/1500x0/filters:no_upscale():max_bytes(150000):strip_icc():focal(749x0:751x2)/thyroid-goiter-6-020426-10a51aa8d1de4aafad1b8cdd679bdb87.jpg,,True,True,https://people.com/thmb/PlZBYhFKl39-R_XPELdHGxacR18=/1500x0/filters:no_upscale():max_bytes(150000):strip_icc():focal(749x0:751x2):format(webp)/thyroid-goiter-6-020426-10a51aa8d1de4aafad1b8cdd679bdb87.jpg
9bf9eab983d57aa083771c7df5908dfe,20260207162740,29,Health,"Get the latest health news and features from PEOPLE.com, including breaking news about celebrity health, wellness and explainers on medical conditions.",People Staff,entertainment,https://people.com/health/,https://people.com/thmb/5BnpLIFg1En0cQVBY5N333vF5oI=/1500x0/filters:no_upscale():max_bytes(150000):strip_icc():focal(1499x0:1501x2)/People_HealthBanner_FINAL-5bcfc223dd224773a778a8bf7607e3d3.jpg,published,,2026-02-07T16:27:40.631337,2026-02-07T16:27:40.631337,0,,health,...,Health,"Get the latest health news and features from PEOPLE.com, including breaking news about celebrity health, wellness and explainers on medical conditions.",,https://people.com/health/,Health,"Get the latest health news and features from PEOPLE.com, including breaking news about celebrity health, wellness and explainers on medical conditions.",https://people.com/thmb/5BnpLIFg1En0cQVBY5N333vF5oI=/1500x0/filters:no_upscale():max_bytes(150000):strip_icc():focal(1499x0:1501x2)/People_HealthBanner_FINAL-5bcfc223dd224773a778a8bf7607e3d3.jpg,,True,True,"https://people.com/thmb/pkauLg5X63a__Z3Rjg9hPoI0uYA=/800x533/filters:no_upscale():max_bytes(150000):strip_icc():format(webp)/al-roker-verywell-10125-3e56a485c0c742a8b16e7c5cc1cddc37.jpg,https://people.com/thmb/jZZawxhlnk9TNwCSyO1ofzTxSkg=/1500x0/filters:no_upscale():max_bytes(150000):strip_icc():format(webp)/People_HealthBanner_FINAL-5bcfc223dd224773a778a8bf7607e3d3.jpg"
75b33dc99b4c5d5d0e925bf6f8426fb0,20260207162743,30,"Woman in Her 40s, Who Says She's Often Mistaken for Being Almost 2 Decades Younger, Reveals Her Beauty Secrets",A woman in her 40s says she is mistaken for being almost two decades younger than she actually is. Jessica Jerrard — a former model who now works in cybersecurity — will get hit on by younger guys and will 'sometimes get ID'd' while 'buying some wine or a vape.',Nicholas Rice,entertainment,https://people.com/woman-in-her-40s-is-often-mistaken-as-being-years-younger-reveals-beauty-secrets-11901200,https://people.com/thmb/GbRprr8-9F2_jnMJRvwo4neZT0s=/1500x0/filters:no_upscale():max_bytes(150000):strip_icc():focal(749x0:751x2)/Jessica-Jerrard.436-020326-ca046f0028244d26b09edd7caf3ef7cc.jpg,published,,2026-02-07T16:27:43.935994,2026-02-07T16:27:43.935994,0,"""People are often saying they can't believe [my age], and they think I'm 10 or 15 years younger,"" Jessica Jerrard said
Nicholas Rice is a Senior News Editor, Weekends for PEOPLE Magazine. He began working with the brand as an Editorial Intern in early 2020, before later transitioning to staff positions. Nicholas writes and edits multiple stories per day on average for PEOPLE, spanning across each vertical the brand covers.
A woman in her 40s says she is mistaken for being almost two decades younger than she actually is — and she doesn't mind.
""People are often saying they can't believe [my age], and they think I'm 10 or 15 years younger,"" Jessica Jerrard said, per SWNS.
""My kids are still young, so I don't get sister comparisons, but on work nights out, people just assume I'm the same age as my colleagues, and they get a bit freaked out when I reveal how old I am,"" she added.
Jerrard — a former model who now works in cybersecurity — also said she will get hit on by younger guys, including men in their 20s, and will ""sometimes get ID'd"" while ""buying some wine or a vape.""
""I've had it in the last five years. It is nice when you do,"" she admitted.
Never miss a story — sign up for PEOPLE's free daily newsletter to stay up-to-date on the best of what PEOPLE has to offer​​, from celebrity news to compelling human interest stories.

Looking back at her life, Jerrard said, ""When I was younger, I thought 40 was really old.""
The mom of two added that ""it does feel good"" when people think she's younger than she is, but there's also ""a pressure.""
The PEOPLE Puzzler crossword is here! How quickly can you solve it? Play now!
In addition to maintaining an exercise regimen, Jerrard said her youthful look can also be credited to how she has adjusted her skincare routine.
""When lip fillers started getting popular 15 years ago, I think it was about getting bigger lips, and you want more and more, but I think it just does make you look older,"" she said. ""I used to get my lips done nearly every month, and because you're seeing it every day, it's like an addiction, and then it migrates to other areas of the face. It's not what I recommend.""

Another cause of concern, according to Jerrard? Tanning.
""I used to really be into tanning when I was younger, and I was always told how bad they were, but in the past five years, I've noticed the texture of my skin not looking as good as it used to,"" she explained.
After trying ""loads of things,"" including ""micro-needling,"" Jerrard said, ""I've been putting more of my investment in skin care in facials, and that's been great. It is something that I want to maintain.""
And when it comes to one specific product that has been her saving grace, Jerrard credits a ""Tretinoin prescription cream.""
""It's made a huge difference,"" she said.","woman-in-her-40s,-who-says-shes-often-mistaken-for","""People are often saying they can't believe [my age], and they think I'm 10 or 15 years younger,"" Jessica Jerrard said
Nicholas Rice is a Senior News Editor, Weekends for PEOPLE Magazine. He began working with the brand as an Editorial Intern in earl...","Woman in Her 40s, Who Says She's Often Mistaken for Being Almost 2 Decades Younger, Reveals Her Beauty Secrets",A woman in her 40s says she is mistaken for being almost two decades younger than she actually is. Jessica Jerrard — a former model who now works in cybersecurity — will get hit on by younger guys and will 'sometimes get ID'd' while 'buying some wine or a vape.',,https://people.com/woman-in-her-40s-is-often-mistaken-as-being-years-younger-reveals-beauty-secrets-11901200,"Woman in Her 40s, Who Says She's Often Mistaken for Being Almost 2 Decades Younger, Reveals Her Beauty Secrets",A woman in her 40s says she is mistaken for being almost two decades younger than she actually is. Jessica Jerrard — a former model who now works in cybersecurity — will get hit on by younger guys and will 'sometimes get ID'd' while 'buying some wine or a vape.',https://people.com/thmb/GbRprr8-9F2_jnMJRvwo4neZT0s=/1500x0/filters:no_upscale():max_bytes(150000):strip_icc():focal(749x0:751x2)/Jessica-Jerrard.436-020326-ca046f0028244d26b09edd7caf3ef7cc.jpg,,True,True,https://people.com/thmb/1Atkri0H21xK_NMNoFL5OPClTr8=/1500x0/filters:no_upscale():max_bytes(150000):strip_icc():focal(749x0:751x2):format(webp)/Jessica-Jerrard.436-020326-ca046f0028244d26b09edd7caf3ef7cc.jpg
b5f3f10ba33505401e2f27f4c141188c,20260207162750,31,Beauty & Style,"Get the latest style news and features from PEOPLE.com, including breakdowns of what celebrities are wearing and sale updates on major brands.",People Staff,entertainment,https://people.com/beauty-style/,https://people.com/thmb/i_4nQcYv0w2V5K7o9dLQYovtvLs=/1500x0/filters:no_upscale():max_bytes(150000):strip_icc():focal(1199x0:1201x2)/102020-style4-bbfa998679024aabb262f5debf9666d3.png,published,,2026-02-07T16:27:50.007303,2026-02-07T16:27:50.007303,0,,beauty-&-style,...,Beauty & Style,"Get the latest style news and features from PEOPLE.com, including breakdowns of what celebrities are wearing and sale updates on major brands.",,https://people.com/beauty-style/,Beauty & Style,"Get the latest style news and features from PEOPLE.com, including breakdowns of what celebrities are wearing and sale updates on major brands.",https://people.com/thmb/i_4nQcYv0w2V5K7o9dLQYovtvLs=/1500x0/filters:no_upscale():max_bytes(150000):strip_icc():focal(1199x0:1201x2)/102020-style4-bbfa998679024aabb262f5debf9666d3.png,,True,True,"https://people.com/thmb/RjdwxhWNXxAk5Ezrh6Hv1ENpEho=/364x242/filters:no_upscale():max_bytes(150000):strip_icc():format(webp)/peo-amazon-roundup-celeb-tout-7a79b4bb0a2e4e49a4b7b66629c12cac.jpg,https://people.com/thmb/8k6d1rMwmudgSQmDpzg-SebvwxA=/364x242/filters:no_upscale():max_bytes(150000):strip_icc():format(webp)/Jessica-Jerrard.436-020326-ca046f0028244d26b09edd7caf3ef7cc.jpg,https://tpc.googlesyndication.com/simgad/5747940643582955249?,https://people.com/thmb/kiw3Di8orVGBvjJ--AWLfmVvsZc=/2048x0/filters:no_upscale():max_bytes(150000):strip_icc():format(webp)/102020-style4-bbfa998679024aabb262f5debf9666d3.png,https://people.com/thmb/J13ffA63yCbnqgkKKHU6iykCYxY=/364x242/filters:no_upscale():max_bytes(150000):strip_icc():format(webp)/peo-michelle-pfeiffer-pants-tout-c12ee71bf50a448789f8d0087e7173bb.jpg"
