id,run_id,row_id,title,description,source,category,link,image_url,status,scheduled_at,created_at,updated_at,likes,content,slug,excerpt,meta_title,meta_description,meta_keywords,canonical_url,og_title,og_description,og_image,focus_keyword,is_indexable,is_followable,images
7b017689e6ee5d63d6c72c7535e1d3f5,20260207182106,1,"Norovirus Is Ripping Through Hockey Teams at the 2026 Winter Olympics, Causing Scheduling Issues","Team Finland's women's hockey team had a number of players come down the virus, and Team Switzerland had one, prompting a game postponement on Thursday, Feb. 5 and another possible one on Saturday, Feb. 7.",Rachel DeSantis,entertainment,https://people.com/norovirus-ripping-through-hockey-teams-2026-winter-olympics-11901995,https://people.com/thmb/I8lQSfDBs6Vwdgz-0DCPDeMT5W8=/1500x0/filters:no_upscale():max_bytes(150000):strip_icc():focal(1499x0:1501x2)/GettyImages-2260254499-bdcf7b8b33bf49ef9c1c26c9146001b8.jpg,published,,2026-02-07T18:21:06.236389,2026-02-07T18:21:06.236389,0,"Team Finland and Team Switzerland have had players affected by norovirus
The Olympic Village is all fun and games — until someone catches the highly contagious norovirus.
The notorious stomach virus has been slowly making its way through a few women’s hockey teams, prompting delays and postponements at the 2026 Winter Olympics in Milan.
On Feb. 5, the Games announced that the women’s Finland versus Canada ice hockey game would be postponed after Team Finland experienced a norovirus breakout.
“The decision was taken following consultations with medical professionals after cases of norovirus were identified within Team Finland,” the Games said in a press release. “It was made collectively and in accordance with established health and safety principles, with the health and wellbeing of players, team staff, officials and all tournament participants as the highest priority.”
The release acknowledged the “disappointment” of the postponement, but said it was a “responsible and necessary decision that reflects the spirit of the Olympic Games and the integrity of the competition.”
Thirteen members of Team Finland were either infected with the virus or in quarantine, the Associated Press reported. General manager Kimmo Oikarinen told the outlet on Feb. 6 that while the illnesses were “disappointing,” things were “getting better for the team.""
“Forfeit is the last thing we want to do. I don’t believe we will go there. I do not see that happening,” he said. “It is the Olympic Games, and we have been waiting for this for years. We all wanted to play, but there are things that happen. The main focus was to make sure our players will be healthy as soon as possible.”
Norovirus is a contagious virus that causes vomiting and diarrhea, per the Centers for Disease Control and Prevention. While most people with the illness get better within one to three days, they can still spread the virus for a few days after.
Meanwhile, the Swiss Hockey Federation announced on Feb. 6 that one of its female hockey players had also tested positive for norovirus, shortly after Team Switzerland beat the Czech Republic in a hockey game.
The organization’s statement said the infected athlete had been housed in a single room since she arrived at the Olympic Village on Monday, Feb. 2, and was isolated from the team after she started exhibiting symptoms. 
Though the athlete was symptom-free as of Feb. 6, the team was isolated after the match, and the women’s Swiss national hockey team did not take part in the opening ceremony.
The Swiss Hockey Federation said on Saturday, Feb. 7 that the team will go ahead with their game against Canada as planned, because no one else has exhibited symptoms.
""The incubation period has now passed. Thanks to the immediate response and the prompt isolation of the affected player and the team, the potential chain of infection was broken early on,” said Hanspeter Betscharat, chief medical officer for the Swiss Olympic team. ""From a medical perspective, there are currently no concerns about the match taking place, provided no further players show symptoms.”",norovirus-is-ripping-through-hockey-teams-at-the-2,"Team Finland and Team Switzerland have had players affected by norovirus
The Olympic Village is all fun and games — until someone catches the highly contagious norovirus.
The notorious stomach virus has been slowly making its way through a few women’...","Norovirus Is Ripping Through Hockey Teams at the 2026 Winter Olympics, Causing Scheduling Issues","Team Finland's women's hockey team had a number of players come down the virus, and Team Switzerland had one, prompting a game postponement on Thursday, Feb. 5 and another possible one on Saturday, Feb. 7.",,https://people.com/norovirus-ripping-through-hockey-teams-2026-winter-olympics-11901995,"Norovirus Is Ripping Through Hockey Teams at the 2026 Winter Olympics, Causing Scheduling Issues","Team Finland's women's hockey team had a number of players come down the virus, and Team Switzerland had one, prompting a game postponement on Thursday, Feb. 5 and another possible one on Saturday, Feb. 7.",https://people.com/thmb/I8lQSfDBs6Vwdgz-0DCPDeMT5W8=/1500x0/filters:no_upscale():max_bytes(150000):strip_icc():focal(1499x0:1501x2)/GettyImages-2260254499-bdcf7b8b33bf49ef9c1c26c9146001b8.jpg,,True,True,"https://people.com/thmb/MfShs8SPzcxcaNr_NWSdqChH5V4=/1500x0/filters:no_upscale():max_bytes(150000):strip_icc():focal(1499x0:1501x2):format(webp)/GettyImages-2260254499-bdcf7b8b33bf49ef9c1c26c9146001b8.jpg,https://people.com/thmb/tji5n60h2qHdNzRPWZb22W2eQJA=/600x0/filters:no_upscale():max_bytes(150000):strip_icc():format(webp)/WinterOlympics2026_ResizedLogo_320height-13253ba80eed4a6b948c18a7277e33db.jpg"
8a2ad3cdb4e6e6be5f29bef222045974,20260207182111,2,"Everything Cardi B Has Said About Her Plastic Surgery, from Removing Her Butt Injections to Getting a Boob Job at 18",Cardi B has received cosmetic procedures ranging from a rhinoplasty to liposuction. Here’s everything Cardi B has said about getting plastic surgery.,Kelsey Lentz,entertainment,https://people.com/all-about-cardi-b-plastic-surgery-11892480,https://people.com/thmb/BdZXOpnz8uAjKSio60e6rWp17G0=/1500x0/filters:no_upscale():max_bytes(150000):strip_icc():focal(988x322:990x324)/cardi-b-plastic-surgery-split-020526-dcdd6f55a4ac43758e02397208d95e33.jpg,published,,2026-02-07T18:21:11.687801,2026-02-07T18:21:11.687801,0,"Cardi B has always spoken candidly about her experiences under the knife
Mireya Acierto/Getty ; Cardi B/Instagram
Cardi B is an open book when it comes to the work she’s had done.
The “Bodak Yellow” rapper has undergone several elective surgeries since she shot to fame in 2017, and she’s never shied away from discussing her experiences under the knife with her fans.
Cardi has also been candid about the motivation behind her cosmetic work, which has more to do with her personal preferences than with self-esteem.
“People will be assuming that when you do surgery, you’re insecure about yourself or you hate yourself, and that’s just not the truth,” she explained during a November 2024 appearance on The Jason Lee podcast. “If I want to correct something or do a little something something, I’m going to do it.”
“I like being perfect,” she added. “I like a certain type of body for myself.”
From her breast augmentation to the procedures she’s regretted, here’s everything Cardi B has said about plastic surgery.
Long before she became famous, Cardi used money she earned working as a stripper to pay for a breast augmentation. During a 2021 conversation with Mariah Carey for Interview Magazine, the rapper shared that she had been insecure about her breasts since she was young.
“I was really skinny when I was younger, and in the Bronx, it’s about being thick and having an ass, so young boys would be like, ‘Look at your flat ass. You ain’t got no titties,' "" she recalled. ""And it would make me feel so ugly and undeveloped.""
She continued, “When I was 18 and became a dancer, I had enough money to afford to buy boobs, so every insecurity that I felt about my breasts was gone.”
Soon after getting her breasts done, Cardi moved on to her butt, and at age 21, she got biopolymer injections, silicone-based fillers that are not approved by the FDA and can cause life-threatening complications. The procedure cost the rapper $800 and was performed in a basement in Queens, N.Y.
“They don’t numb your ass with anything,” she told GQ in 2018 of the risky procedure. “It was the craziest pain ever. I felt like I was gonna pass out. I felt a little dizzy. And it leaks for, like, five days.”
Years later, in August 2022, Cardi had “95%” of her biopolymers removed. She opened up about the process during an Instagram Live that December and offered her fans some advice about plastic surgery.
“All I'm going to say is that if you're young, if you're 19, 20, 21, and sometimes you're too skinny, and you be like 'OMG I don't have enough fat to put in my ass,' so you result to ass shots, DON'T!” she said.
Cardi continued, “When it comes to BBLs, if y'all want advice from me, before you get your BBL done you have to make sure your blood levels are all right. If a doctor says your blood levels are too low or you have diabetes or whatever, don't do it.""
In January 2024, Cardi got another round of injections removed.
Shortly after her debut on Love & Hip Hop: New York, Cardi treated herself to a smile makeover with celebrity cosmetic dentist Dr. Catrise Austin. She had several porcelain veneers placed, and the experience was featured in the first episode of season 7 of the reality show.
“It was just something that people kept talking about … and I knew I was going to do more on TV,” she told a reporter at the season 7 premiere in November 2016. “I don't want my teeth distracting people from my talents or what I do.”
The rapper was so happy with her new smile that she included the line “Got a bag and fixed my teeth” in her breakout hit, “Bodak Yellow.”
During her appearance on The Jason Lee podcast, Cardi opened up about how she never liked her nose and always wanted it to be smaller.
""I always felt like I had a big nose,"" she explained. ""Even before I was famous, I was like 'Damn, I've got my daddy's nose.' ... I was always afraid to do my nose and I finally took that step.""
In 2019, she opted for nose fillers, as several people told her it was a better, non-surgical way to make her nose smaller. However, the fillers had the opposite effect.
“That s--- f---ed my nose up,” she said. “I was like, 'Oh my Gosh, what the f--- did I do to myself?' ""
“When you see stuff on Instagram, it makes sense. But fillers made my nose longer ... it got wider,"" she added.
Cardi then went through with a rhinoplasty in 2020.
While performing at the Beale Street Musical Festival in May 2019, Cardi revealed that she had recently undergone liposuction.
“I have some news for y’all. I should have canceled today,” she told her fans. “I shouldn’t really be performing because moving too much is gonna f--- up my lipo. But b---- I’m still gonna get my motherf---ing money back, let’s go!”
A few weeks later, Cardi had to postpone several scheduled performances after being given “strict doctor’s orders” to take it easy after her surgery, her rep told PEOPLE.
Cardi first floated the idea of liposuction in August 2018, one month after she welcomed her daughter, Kulture Kiari, whom she shares with ex-husband Offset.
“I still feel like I got a lot of love handles right here,” she said during an Instagram Live. “It’s not much but it’s like — I’m used to having, like, a real tight stomach.”
Years later, while appearing on Alex Cooper’s Call Her Daddy podcast in September 2025, the “WAP” rapper addressed a misconception that she is “always [on] the table” and explained that she didn’t get liposuction or any other procedure immediately after she gave birth.
“I take my time because I don’t want to die,” she explained. “You have to wait six, seven months before you get any type of surgery after you give birth because you lose so much blood. Your body is still contracting. Your organs are still contracting. Your breasts are getting smaller.”
In the same interview, Cardi opened up about whether she regrets any of the procedures she’s had.
“I look at myself in the mirror and it's like, I really wouldn’t change a thing,” she told Cooper. “Maybe I would like my butt to be smaller … but it’s, like I said, really hard for my butt to get smaller. I already did a reduction.”
She went on to describe how painful and lengthy the reduction process is, adding about her critics, “I’m not going to put myself in that position again because you don’t like my body.”
“I’m comfortable; I learned to live with it. I don’t get no complaints from nobody,” she concluded.
Cardi added that she feels she can't ""win"" the public, who she said will critique celebrities for hiding what procedures they've had done, but equally criticize her for being open.
“It really sucks so much,” she said. “When you do tell them your business, it’s bad too … you can never win.”",everything-cardi-b-has-said-about-her-plastic-surg,"Cardi B has always spoken candidly about her experiences under the knife
Mireya Acierto/Getty ; Cardi B/Instagram
Cardi B is an open book when it comes to the work she’s had done.
The “Bodak Yellow” rapper has undergone several elective surgeries sin...","Everything Cardi B Has Said About Her Plastic Surgery, from Removing Her Butt Injections to Getting a Boob Job at 18",Cardi B has received cosmetic procedures ranging from a rhinoplasty to liposuction. Here’s everything Cardi B has said about getting plastic surgery.,,https://people.com/all-about-cardi-b-plastic-surgery-11892480,"Everything Cardi B Has Said About Her Plastic Surgery, from Removing Her Butt Injections to Getting a Boob Job at 18",Cardi B has received cosmetic procedures ranging from a rhinoplasty to liposuction. Here’s everything Cardi B has said about getting plastic surgery.,https://people.com/thmb/BdZXOpnz8uAjKSio60e6rWp17G0=/1500x0/filters:no_upscale():max_bytes(150000):strip_icc():focal(988x322:990x324)/cardi-b-plastic-surgery-split-020526-dcdd6f55a4ac43758e02397208d95e33.jpg,,True,True,"https://tpc.googlesyndication.com/simgad/5747940643582955249?,https://people.com/thmb/iQGuse_w0MifRugygCW9bviPALY=/1500x0/filters:no_upscale():max_bytes(150000):strip_icc():focal(988x322:990x324):format(webp)/cardi-b-plastic-surgery-split-020526-dcdd6f55a4ac43758e02397208d95e33.jpg"
8c65a24fc92d9c77841e33ca623cc098,20260207182121,3,PEOPLE's Editorial Policy,"PEOPLE, one of the world's most-read digital publications, fights against viral misinformation by having steadfast journalistic standards",People Staff,entertainment,https://people.com/editorial-policy-page-5499057,https://people.com/thmb/AphrjDhRyx9gNUXItjgjEH6TGMk=/1500x0/filters:no_upscale():max_bytes(150000):strip_icc():focal(922x0:924x2)/people-tested-towels-2b64032ba6dd41d1acd74a0eb42335ea.jpg,published,,2026-02-07T18:21:21.249443,2026-02-07T18:21:21.249443,0,"If you read it on PEOPLE, you know it is true. In a world of rumors run wild, there are all kinds of stories that take the internet by storm and provoke strong reactions — even from major public figures — before anybody even knows if the information is true. As one of the world's most-read digital publications, we take seriously our responsibility to fight against viral misinformation by having steadfast journalistic standards that guide us in telling true, accurate, and authoritative stories — always.
Every piece of content on PEOPLE is conceived of, created, and communicated to you with these core principles front of mind.
Bringing you the latest news is a big, never-ending production. Our reporters are among the most connected people in the world: on the red carpet, at the White House, in the worlds of tech, sports, style and beauty, food and more.
But we also shine at finding those small, never-before-heard stories of ordinary people doing extraordinary things—in any zip code in this country and beyond. Our news team members have their fingers on the pulse and keep you plugged in to what's happening, minute by minute, no matter the hour of day, and continuously as the story unfolds. And our expert editors are there to give you the best recommendations: what to watch, read, listen to, wear, cook and buy.
At PEOPLE, we hold some principles sacred. We will not publish a photograph of a celebrity's child taken against their parents' wishes, barring a serious news value. We believe in a person's right to privacy, so we will not expose a pregnancy or someone's health issues against their wishes, nor will we share identifying details that might betray the location of the home where a public figure resides. We always strive to have an open dialogue with the people we cover and give them an opportunity to tell their stories.

You may notice PEOPLE covers some pretty heavy topics, from themes of drug abuse and sexual assault to child abuse or suicide. At every turn, we're committed to helping you gain insight from these incredibly personal stories or be inspired to help: we will help you find a story subject's GoFundMe, if you're moved to make a donation, or we'll give you helpful resources if you or someone in your life is in a similar situation.
We have stringent guidelines for writing about suicide, and work in partnership with #CrisisTextLine to encourage people to make the call for help if they're struggling with their mental health. And we vet and will share links to legitimate 501c3 charities when we cover major developing news about everything from environmental crises to the war in Ukraine.

At its core, PEOPLE is a brand devoted to highlighting diverse stories: The triumphs, tragedies and extraordinary moments in the lives of all people. We have always been committed to representing as many voices as possible and work constantly to seek out and showcase new ones. We seek always to improve the diversity and scope of the talent we profile, stories we cover, people we feature, and platforms we amplify. It is a top priority for PEOPLE to be transparent about the steps we're taking to ensure our content is representative, fair, educational, and inclusive.
At PEOPLE, we strive to be a safe, inclusive, and judgment-free place to consume content. We apply rigorous standards to the language we use around sexual orientation, gender orientation, race, mental and physical health, including body issues and how people become families. PEOPLE is also guided by the People Inc. Anti-Bias Review Board, which advises on our content to ensure that it is free of bias and as inclusive as possible.
Accurate information is at the core of every story we publish at PEOPLE. Our writers and editors investigate rumors and claims and verify all information gathered for all we publish. We consult credible, in-the-know sources to ensure we're providing proper context and background. Our work is rigorously evaluated for accuracy, relevance, and timeliness during the editing process.
But if you ever find fault with a story we've published, or have a substantive update or possible correction to share, we want to hear from you. Please email corrections@people.com.
We are committed to telling you if a factual error has been made on a news story at the time of publication. We will correct the error as quickly as possible and append a clearly-labeled note to inform you of the corrected information. When an article is factually correct, but the language is not as clear or detailed as necessary, the story may be updated without an editor's note.
Our editorial teams do their best to update our large library of ""evergreen"" stories to ensure they continue to be timely, accurate, and relevant. Each article is date-stamped to reflect when they were last updated.

In the age of COVID and vaccine misinformation, no topic requires expert precision and more intense fact-checking than health coverage. To that end, our health team relies on the PEOPLE Health Squad, a team of doctors with specialties in many different areas we have at the ready, to explain and put into context everything from the latest recommendations on booster shots to that episode of And Just Like That that covered perimenopausal menstruation. We told you we take this stuff seriously.

Our writers and editors adhere to strict sourcing standards in all our articles. All facts and claims are backed up by at least one reputable source, and we aim to be transparent as to the origin of information in any developing situation.
In our crime coverage, or in the case of a major disaster, where first responders and law enforcement respond to the scene, we rely on the district's Public Information Officer, interviews directly with members of law enforcement and court documents for the facts of the case. We always make every effort to reach out to legal representation for all defendants, or any individuals that are profiled in our coverage.
PEOPLE journalists often receive information from trustworthy confidential sources whose names are withheld from publication. We want you to understand that these sources are not ""anonymous"" but are known to the PEOPLE team. They are granted confidentiality for publication purposes and the information they provide is verified with other sources. When we grant confidentiality to sources, we aim to provide context to our readers about the reasons they are not named.
At PEOPLE, we never pay for stories or tips, as we believe it can compromise the integrity of our journalism. Likewise, we do not accept monetary compensation in exchange for coverage of products. Our writers and editors are prohibited from giving preferential treatment to any outside resource (company, publication, video, affiliate, website) based on their relationship with the person or company who authors or owns that resource. Each staff member and contributor is held to a high standard of honesty and transparency.
Our goal at PEOPLE is to provide original, unbiased, credible content. We expect all contributors on the network to abide by all applicable laws, standards, and accepted journalistic practices, including:
Part of our mission at PEOPLE is to provide you with thorough, unbiased shopping information. We cover everything from the latest celebrity trends, the best sales, as well as our PEOPLE Tested program which covers everything from skincare to kitchen gadgets. In our PEOPLE Tested program, we do the heavy lifting by running products through vigorous testing at one of our three testing labs throughout the country.
Here, we test products against a comprehensive methodology that rates products on various attributes (think performance, durability, ease of use, etc.). No product makes it into our Pet Awards, Beauty Awards, or Food Awards packages without rigorous testing by a panel of editors and experts. Our goal is to provide you with as much information as possible before you decide to buy something. These product recommendations are purely editorial, and we may receive a commission on any purchases that you make.
Learn more about our testing methodology here.",peoples-editorial-policy,"If you read it on PEOPLE, you know it is true. In a world of rumors run wild, there are all kinds of stories that take the internet by storm and provoke strong reactions — even from major public figures — before anybody even knows if the information...",PEOPLE's Editorial Policy,"PEOPLE, one of the world's most-read digital publications, fights against viral misinformation by having steadfast journalistic standards",,https://people.com/editorial-policy-5499057,PEOPLE's Editorial Policy,"PEOPLE, one of the world's most-read digital publications, fights against viral misinformation by having steadfast journalistic standards",https://people.com/thmb/AphrjDhRyx9gNUXItjgjEH6TGMk=/1500x0/filters:no_upscale():max_bytes(150000):strip_icc():focal(922x0:924x2)/people-tested-towels-2b64032ba6dd41d1acd74a0eb42335ea.jpg,,True,True,
