id,run_id,row_id,title,description,source,category,link,image_url,status,scheduled_at,created_at,updated_at,likes,content,slug,excerpt,meta_title,meta_description,meta_keywords,canonical_url,og_title,og_description,og_image,focus_keyword,is_indexable,is_followable,images
8f05513c2a581808c6e797a8b6f7503d,20260207163112,77,"A Woman Vanished for 2 Years. Now, Someone She Knew Has Admitted Pushing Her Off a Cliff",Loretta Carr was sentenced to life in prison plus 20 years for murder and kidnapping in the death of 37-year-old Mary Beth Isbell.,Christine Pelisek,entertainment,https://people.com/sentencing-alabama-woman-pushed-off-cliff-11901754,https://people.com/thmb/uELNSXOxMzoPqmsm0X_B_iWjE-4=/1500x0/filters:no_upscale():max_bytes(150000):strip_icc():focal(740x393:742x395)/mary-elizabeth-isbell-missing-062923-56725cae8687497d8ca494f4fb2370c1.jpg,published,,2026-02-07T16:31:12.072049,2026-02-07T16:31:12.072049,0,"Loretta Carr was sentenced to life in prison plus 20 years for murder and kidnapping in the death of 37-year-old Mary Beth Isbell
Hartselle Police Department/ Facebook
An Alabama woman was sentenced to life in prison for her role in the death of a woman who was kidnapped and pushed off a cliff.
Loretta Carr was also sentenced to 20 additional years for kidnapping in connection with the 2021 death of 37-year-old Mary Beth Isbell, the District Attorney for the Ninth Judicial Circuit announced on Friday, Feb. 6.
Carr pleaded guilty to first-degree kidnapping and murder on Thursday, Feb. 5, AL.com reported, citing court records. 
Carr’s daughter Jessie Kelly pleaded guilty to murder in August 2025 and was sentenced to 40 years in prison, per WAFF.
According to prosecutors, Carr and Kelly went to Isbell’s home to “confront her because of a relationship she had with Carr’s significant other” on Oct. 18, 2021. The two allegedly attacked Isbell, took her against her will and dragged her inside a vehicle, prosecutors said, citing statements and forensic evidence discovered at Isbell’s residence.
Later that night, they drove to Wolf Creek Overlook at Little River Canyon in Fort Payne where Carr “tied herself with a rope to the barrier at the overlook, forced Isbell to climb over the barrier, and then forced her off the side of the canyon,” per a Ninth Judicial Circuit press release.
DeKalb County Sheriff's Office; Cherokee County Sheriff's Office
Isbell’s body was discovered two years later in the canyon beneath the overlook. 
Want to keep up with the latest crime coverage? Sign up for  PEOPLE's free True Crime newsletter for breaking crime news, ongoing trial coverage and details of intriguing unsolved cases.
Isbell was reported missing in December 2021, per ABC31.

“This is an example of a senseless act destroying a family,” prosecutor Summer Summerford said in the press release. “A mother is left without a daughter, sisters are left without their sibling, and a son is left without his mother.""
""This family has been through so much, but they have walked with us and law enforcement throughout this process and have been so responsive and helpful. Please continue to pray for this family as they continue to figure out how to go through life without their loved one.”
Isbell owned her own remodeling business and was the mother of a teen boy, her family said, according to ABC31.","a-woman-vanished-for-2-years.-now,-someone-she-kne","Loretta Carr was sentenced to life in prison plus 20 years for murder and kidnapping in the death of 37-year-old Mary Beth Isbell
Hartselle Police Department/ Facebook
An Alabama woman was sentenced to life in prison for her role in the death of a wo...","A Woman Vanished for 2 Years. Now, Someone She Knew Has Admitted Pushing Her Off a Cliff",Loretta Carr was sentenced to life in prison plus 20 years for murder and kidnapping in the death of 37-year-old Mary Beth Isbell.,,https://people.com/sentencing-alabama-woman-pushed-off-cliff-11901754,"A Woman Vanished for 2 Years. Now, Someone She Knew Has Admitted Pushing Her Off a Cliff",Loretta Carr was sentenced to life in prison plus 20 years for murder and kidnapping in the death of 37-year-old Mary Beth Isbell.,https://people.com/thmb/uELNSXOxMzoPqmsm0X_B_iWjE-4=/1500x0/filters:no_upscale():max_bytes(150000):strip_icc():focal(740x393:742x395)/mary-elizabeth-isbell-missing-062923-56725cae8687497d8ca494f4fb2370c1.jpg,,True,True,https://people.com/thmb/3aAsC2HEw3lwzE4bKIE4lSyxNUI=/1500x0/filters:no_upscale():max_bytes(150000):strip_icc():focal(740x393:742x395):format(webp)/mary-elizabeth-isbell-missing-062923-56725cae8687497d8ca494f4fb2370c1.jpg
7ea8f011e2480c5a267f876c0add237b,20260207163116,78,"Girl, 12, Walking Dog Was Allegedly Kidnapped and Sexually Assaulted. Here's How Police Rescued Her From a Hotel Room","Authorities in Texas arrested 27-year-old Graham Michael Dunn on kidnapping and sexual assault charges, police announced at a press conference.",Samira Asma-Sadeque,entertainment,https://people.com/girl-walking-dog-kidnapped-confrontation-hotel-11901257,https://people.com/thmb/NcIcfZ_TVwqf48eNLtM9NiPXMZ4=/1500x0/filters:no_upscale():max_bytes(150000):strip_icc():focal(749x0:751x2)/graham-michael-dunn-2-020626-8b294309fbbf45a3a16402fe556143f3.jpg,published,,2026-02-07T16:31:16.344960,2026-02-07T16:31:16.344960,0,"Authorities in Texas arrested 27-year-old Graham Michael Dunn on kidnapping and sexual assault charges, police announced at a press conference
Authorities in southeastern Texas have arrested a man they accuse of kidnapping a girl following a dramatic rescue operation at a hotel.
Graham Michael Dunn, 27, was arrested on several charges, including sexual assault of a child, in connection with the alleged abduction of a 12-year-old girl in Galveston, Texas, on Jan. 30, the Galveston Police Department said at a press briefing this week.
The child was reported missing in the evening on Jan. 30, Chief of Police Doug Balli said at the briefing on Thursday, Feb. 5.
Police believe the girl was walking her dog when she was ""encountered by Graham Dunn,"" who had pulled up in his car. Dunn allegedly got out of the vehicle and forced the child inside of it, before fleeing the area, Balli said.
Investigators followed an ""emergency ping"" on the girl's phone and located the ping at a hotel a few miles away.
Hotel staff initially had difficulty obtaining security footage, but later provided investigators with surveillance video that allegedly shows Dunn entering the hotel with the girl, the police said.
Officers then broke into a room and rescued the child before apprehending Dunn.
While no motive has been discussed about why the child was targeted, police allege Dunn used social media to ""lure"" the girl out.
Want to keep up with the latest crime coverage? Sign up for PEOPLE's free True Crime newsletter for breaking crime news, ongoing trial coverage and details of intriguing unsolved cases.

Dunn has been charged with one count of aggravated kidnapping - sexual assault and two counts of aggravated sexual assault of a child, Detective Hector Dominguez said at Thursday's briefing.
Online court records for Dunn only showed a kidnapping charge as of noon Friday. No plea information was available, and an attorney listed in court records for him did not immediately respond to PEOPLE's request for comment.
If you or someone you know has been a victim of sexual abuse, text ""STRENGTH"" to the Crisis Text Line at 741-741 to be connected to a certified crisis counselor.

If you suspect child abuse, call the Childhelp National Child Abuse Hotline at 1-800-4-A-Child or 1-800-422-4453, or go to www.childhelp.org. All calls are toll-free and confidential. The hotline is available 24/7 in more than 170 languages.","girl,-12,-walking-dog-was-allegedly-kidnapped-and-","Authorities in Texas arrested 27-year-old Graham Michael Dunn on kidnapping and sexual assault charges, police announced at a press conference
Authorities in southeastern Texas have arrested a man they accuse of kidnapping a girl following a dramatic...","Girl, 12, Walking Dog Was Allegedly Kidnapped and Sexually Assaulted. Here's How Police Rescued Her From a Hotel Room","Authorities in Texas arrested 27-year-old Graham Michael Dunn on kidnapping and sexual assault charges, police announced at a press conference.",,https://people.com/girl-walking-dog-kidnapped-confrontation-hotel-11901257,"Girl, 12, Walking Dog Was Allegedly Kidnapped and Sexually Assaulted. Here's How Police Rescued Her From a Hotel Room","Authorities in Texas arrested 27-year-old Graham Michael Dunn on kidnapping and sexual assault charges, police announced at a press conference.",https://people.com/thmb/NcIcfZ_TVwqf48eNLtM9NiPXMZ4=/1500x0/filters:no_upscale():max_bytes(150000):strip_icc():focal(749x0:751x2)/graham-michael-dunn-2-020626-8b294309fbbf45a3a16402fe556143f3.jpg,,True,True,https://people.com/thmb/b8bxJOMotsruUIqvranuyx4JIDY=/1500x0/filters:no_upscale():max_bytes(150000):strip_icc():focal(749x0:751x2):format(webp)/graham-michael-dunn-2-020626-8b294309fbbf45a3a16402fe556143f3.jpg
c19994edd4c450f053e94b65796c0de2,20260207163121,79,Husband of Woman Who Said She Was 'Very Scared' Before Vanishing Will Go to Prison for Manslaughter,"Glenn Jackson entered an Alford plea to a manslaughter charge in connection with the death of his wife Ella, who went missing in 2019.",Liam Quinn,entertainment,https://people.com/alford-plea-manslaughter-jackson-kentucky-11901464,https://people.com/thmb/Xl_N34eYtwNxCNUgJXJ2Iph4hJw=/1500x0/filters:no_upscale():max_bytes(150000):strip_icc():focal(749x0:751x2)/ella-jackson-glenn-jackson-020626-0739ad2544b84d218641759890cef839.jpg,published,,2026-02-07T16:31:21.307417,2026-02-07T16:31:21.307417,0,"Glenn Jackson entered an Alford plea to a manslaughter charge in connection with the death of his wife Ella, who went missing in 2019
A Kentucky man entered an Alford plea to a manslaughter charge in connection with the death of his wife, whom he reported missing six years ago.
Glenn Jackson will now likely face face prison time following the plea, which was reported by the Lexington Herald Leader, Fox 56 and LEX 18.
An Alford plea allows a defendant to maintain innocence while also admitting there is likely enough evidence for prosecutors to secure a conviction.
Ella Diebolt Jackson was reported missing in Richmond, Kent., by Glenn on Oct. 22, 2019, PEOPLE previously reported.
In 2020, Glenn was charged with murder and tampering with evidence in connection with the disappearance of Ella.
A week after Glenn was arrested, Ella's partial skeletal remains were found in a wooded area near a property he owned, per LEX 18.
At the time of her death, Ella and Glenn had a 5-year-old son together.
Ella’s ex-husband, Jason Hans, wrote on Facebook that he remained friends with her even after they divorced more than a decade before her death. He claimed that Ella had begun fearing for her safety in 2015.
Want to keep up with the latest crime coverage? Sign up for PEOPLE's free True Crime newsletter for breaking crime news, ongoing trial coverage and details of intriguing unsolved cases.         
“The messages and rushed phone calls were all too regular in recent years: ‘I need your help,’ ‘I am very scared,’ ‘I am scared to the point of not being ok to get out of the bedroom to get a cup of milk or change my tampon,’ ‘I am being awakened at almost 3 in the morning and dragged through the house,’ ‘It is getting seriously scary [and] I am very worried about my child and myself,'” Hans wrote in 2020.
Glenn, a former lecturer at Eastern Kentucky University, also entered an Alford Plea to abuse of a corpse and tampering with evidence, in addition to mansalughter, per the Herald Leader.
Prosecutors recommended a 14-year sentence for Glenn, who could be released in as little as eight if given credit for house arrest as time served, LEX 18 reported.",husband-of-woman-who-said-she-was-very-scared-befo,"Glenn Jackson entered an Alford plea to a manslaughter charge in connection with the death of his wife Ella, who went missing in 2019
A Kentucky man entered an Alford plea to a manslaughter charge in connection with the death of his wife, whom he rep...",Husband of Woman Who Said She Was 'Very Scared' Before Vanishing Will Go to Prison for Manslaughter,"Glenn Jackson entered an Alford plea to a manslaughter charge in connection with the death of his wife Ella, who went missing in 2019.",,https://people.com/alford-plea-manslaughter-jackson-kentucky-11901464,Husband of Woman Who Said She Was 'Very Scared' Before Vanishing Will Go to Prison for Manslaughter,"Glenn Jackson entered an Alford plea to a manslaughter charge in connection with the death of his wife Ella, who went missing in 2019.",https://people.com/thmb/Xl_N34eYtwNxCNUgJXJ2Iph4hJw=/1500x0/filters:no_upscale():max_bytes(150000):strip_icc():focal(749x0:751x2)/ella-jackson-glenn-jackson-020626-0739ad2544b84d218641759890cef839.jpg,,True,True,https://people.com/thmb/TW-oXltTcBnCxVdKcI-oOHBNFNg=/1500x0/filters:no_upscale():max_bytes(150000):strip_icc():focal(749x0:751x2):format(webp)/ella-jackson-glenn-jackson-020626-0739ad2544b84d218641759890cef839.jpg
28fc2bd0f4366dd24ffc43d6ca8edbe8,20260207163125,80,6 People Tied to an Online 'Cult' Vanished in August 2023. A New TikTok Video May Point to Their Whereabouts,"Police in Berkeley, Missouri, are still searching for six people they believe to be tied to an online cult who vanished in August 2023. They think they may have now found a 'very promising' TikTok video which could lead them to the individuals.",Becca Longmire,entertainment,https://people.com/six-people-tied-to-online-cult-vanished-august-2023-new-tiktok-video-may-lead-to-location-11901019,https://people.com/thmb/BzybMwtaiqkI6FVkIXMf7OqHdLE=/1500x0/filters:no_upscale():max_bytes(150000):strip_icc():focal(749x0:751x2)/missing-cult-members-missouri-011224-1ae3b05496b8482d9b37c5db77ddb482.jpg,published,,2026-02-07T16:31:25.100056,2026-02-07T16:31:25.100056,0,"A man, three women and two young children haven't been heard from since they went missing from their rented home in Berkeley, Missouri, over two years ago
Police believe they may have found a ""very promising"" TikTok video that could potentially lead them to six people in Missouri who have been missing since August 2023.
Ma’Kayla Wickerson, 28, and her now 5-year-old daughter, Malaiyah Wickerson, and Gerrielle German, 30, and her 5-year-old daughter Ashton Mitchell haven't been heard from in years, KTVI's Fox 2 reported. Mikayla Thompson, 27, and Naaman Williams, 32, are also missing.
The missing individuals had been living in a rented home in Berkeley, Mo., near St. Louis Lambert International Airport, PEOPLE previously reported. The group was last seen at a hotel on Aug. 13, 2023, in Florissant, Mo. and no one has heard from them since, Berkeley Police Major Steve Runge said.
Runge told PEOPLE in January 2024 that the four missing adults were believed to be part of a cult allegedly revolving around Rashad Jamal, who was convicted of child molestation charges in 2023 and is currently serving a prison sentence in Georgia.
In recent years, Jamal has amassed thousands of followers on social media with his spiritual teachings, operating what he calls the University of Cosmic Intelligence, which according to its website is “geared toward enlightening and illuminating minds” of Black and Latino people. 
Speaking to the St. Louis Post-Dispatch from prison, Jamal previously denied being a cult leader and maintained his innocence in his child molestation case. 
Runge has now told Fox 2 that police are aware of a new TikTok clip appearing to feature one of the women, which he's described as ""very promising.""
Runge told PEOPLE via email that the video shows Gerielle German.
""We have submitted a legal demand to [TikTok] for the release of user data associated with that user page, as well [as] an IP location for any recent posts,"" he told PEOPLE.
Berkeley Police detective, Sergeant George Ervin, questioned about the video, “Was it actually our missing person? Or is this some copycat just using a picture?” per Fox 2. Ervin is now working to serve TikTok with a warrant to find the account holder.
“I know that it seems like some stuff you’d see fresh out of a movie in Hollywood, but this is real life. These people are missing,” Ervin told the station.
“I really hope we find them,” Runge added, per the outlet. “I’ve promised the families that we will not give up, and we haven’t given up.”
Runge told Fox 2 of the group's disappearance, “There’s no footprint whatsoever, no current digital footprint."" He's obtained a personal record number of search warrants for the case.
“We’re trying to find any lead,” Runge told the station, adding, “Common places they went, rental cars, phone records out of state, out of the country, trying to find any ties to give us a lead as to where they are.”
Before their disappearance, neighbors reported seeing some of the missing six on the roof of their rental home, naked, per Fox 2.
“Really off the grid kind of stuff,” Runge told the outlet. “How to prepare for doomsday. A lot of it, the end of the world is coming. And they had a very solid belief that we’re not from here. We’re not from this planet.”
“We recovered a diary from one of the people that went missing, and the writings in that diary are something you would see with brainwashing, just repetitive, 'I am a god, I am a god, I am a god,'” Runge said, per Fox 2.
Runge previously told PEOPLE that some of Rashad Jamal’s followers, whom he said include three of the missing adults, had changed their names in honor of those they believe to be spiritual gods or goddesses. Williams is also known as Anubis Aramean, Thompson goes by Antu Anum Ahmat, while Wickerson is Intuahma Aquama Auntil, according to Berkeley Police. 
Police also said that the Berkeley quartet had allegedly been exhibiting some of the other followers’ behaviors: total disconnection from family and loved ones, a desire to go off the grid, quitting their jobs and embracing sovereign citizenship, among other behaviors.
“It’s confusing, the internet is [the group's] home,” Runge said in January 2024. “It’s not like, ‘Okay, we’re going to go to St. Louis.’ No, the internet is its home. [Jamal] has 90,000 followers.”
Runge previously said that Wickerson’s mother, Cartisha Morgan, had called police on Aug. 12, 2023, to say she was worried about her daughter, whom she hadn't heard from. 
Days later, detectives began investigating and searched the Berkeley home and found no signs of foul play. Runge said they discovered the group’s Facebook profiles, which contained references to Jamal and were once extremely active and public before the activity abruptly stopped.
While Wickerson, who according to her LinkedIn profile once worked for JP Morgan Chase, and Thompson are both from St. Louis, Williams is from Washington D.C., while German is originally from Lake Horn, Miss., near Memphis.
Thompson, like the other two women, is also the mother of a young child whom she left behind with her mother, according to Runge.
Morgan previously told PEOPLE in January 2024 that she was worried about her daughter and granddaughter, saying that she believed Wickerson had been suffering from depression following the birth of her daughter, and that she was preyed upon as a result.
“I'm not doing so well, but I'm just holding on by my faith,” Morgan told PEOPLE at the time. “I just wish that people are made aware of this.”
Want to keep up with the latest crime coverage? Sign up for  PEOPLE's free True Crime newsletter for breaking crime news, ongoing trial coverage and details of intriguing unsolved cases.
Wickerson had been living with her mother while she was pregnant before moving out in November 2022. Morgan last heard from her daughter in March 2023.
Morgan recalled Wickerson telling her she was feeling overwhelmed as a mother, adding that she thinks her daughter was crying out for help and that there were signs she wasn't okay.
Calling her daughter's disappearance “astonishing,” because she was very family-oriented, Morgan previously told PEOPLE, “Ma’Kayla, we love you and we want the best for you. We would like for her to come back home. We are going to get her the help that we need. Your spiritual journey is your spiritual journey. If you want to be your best self, we understand that, but we love you and we just want you to come back home.”",6-people-tied-to-an-online-cult-vanished-in-august,"A man, three women and two young children haven't been heard from since they went missing from their rented home in Berkeley, Missouri, over two years ago
Police believe they may have found a ""very promising"" TikTok video that could potentially lead...",6 People Tied to an Online 'Cult' Vanished in August 2023. A New TikTok Video May Point to Their Whereabouts,"Police in Berkeley, Missouri, are still searching for six people they believe to be tied to an online cult who vanished in August 2023. They think they may have now found a 'very promising' TikTok video which could lead them to the individuals.",,https://people.com/six-people-tied-to-online-cult-vanished-august-2023-new-tiktok-video-may-lead-to-location-11901019,6 People Tied to an Online 'Cult' Vanished in August 2023. A New TikTok Video May Point to Their Whereabouts,"Police in Berkeley, Missouri, are still searching for six people they believe to be tied to an online cult who vanished in August 2023. They think they may have now found a 'very promising' TikTok video which could lead them to the individuals.",https://people.com/thmb/BzybMwtaiqkI6FVkIXMf7OqHdLE=/1500x0/filters:no_upscale():max_bytes(150000):strip_icc():focal(749x0:751x2)/missing-cult-members-missouri-011224-1ae3b05496b8482d9b37c5db77ddb482.jpg,,True,True,https://people.com/thmb/xl3rPbRkJbV7g6KaG6g83kkQVAs=/1500x0/filters:no_upscale():max_bytes(150000):strip_icc():focal(749x0:751x2):format(webp)/missing-cult-members-missouri-011224-1ae3b05496b8482d9b37c5db77ddb482.jpg
