id,run_id,row_id,title,description,source,category,link,image_url,status,scheduled_at,created_at,updated_at,likes,content,slug,excerpt,meta_title,meta_description,meta_keywords,canonical_url,og_title,og_description,og_image,focus_keyword,is_indexable,is_followable,images
3245b6ce56b3a24c8d37561efc3cc0e5,20260207182158,11,Cardi B Postpones Several Concerts to 'Fully Recover' from Plastic Surgery Procedures,"""Cardi was overzealous in getting back to work, she didn't take the time necessary to full recover from her surgery,"" her rep tells PEOPLE",Robyn Merrett,entertainment,https://people.com/health/cardi-b-postpones-concerts-recover-plastic-surgery/,https://people.com/thmb/gqtZ-uH-a_LyYuhaSl7rMLiL-jo=/1500x0/filters:no_upscale():max_bytes(150000):strip_icc():focal(999x0:1001x2)/60353125_10161770256725054_3667313424041246720_o-1-2000-5c7b47f9d92e4c60a5441677a29f41dc.jpg,published,,2026-02-07T18:21:58.853155,2026-02-07T18:21:58.853155,0,"""Cardi was overzealous in getting back to work, she didn't take the time necessary to full recover from her surgery,"" her rep tells PEOPLE
Sarah Michaud is the senior news editor of PEOPLE's music vertical. She has been working at PEOPLE for 18 years.
Cardi B has postponed several upcoming concerts after being given “strict doctor’s orders” to take it easy following her recent plastic surgery procedures.
A rep for the 26-year-old rapper tells PEOPLE, “Cardi was overzealous in getting back to work; she didn’t take the time necessary to fully recover from her surgery.”
“Her strenuous schedule has taken a toll on her body and she has been given strict doctor’s orders to pull out of the rest of her performances in May,” the rep adds.
On Monday, many fans expressed concern on Twitter after reports surfaced that Cardi had backed out of a Memorial Day Weekend concert in Maryland. The Grammy Award-winning rapper was set to headline the 92Q Spring Bling Festival Friday night.
The radio station later confirmed the news, explaining the show would be postponed to a later date as a result of health issues.
Cardi was also scheduled to perform Tuesday night at El Paso County Coliseum in Texas.
“She’s very disappointed as she hates to let her fans down,” Cardi’s rep says. “She reassures them that she will see them in September.”
After denying having had the procedure last fall, Cardi admitted at the Beale Street Musical Festival in Memphis on May 5 that she had recently undergone liposuction.
A few songs into her set, Cardi, dressed in a skin-tight, sparkly red jumpsuit, said that she shouldn’t be on stage.
“I have some news for y’all. I should have canceled today,” she said at the festival, sponsored by Facebook. “I shouldn’t really be performing because moving too much is gonna f— up my lipo. But bitch, I’m still gonna get my motherf—ing money back, let’s go!”
Cardi later said she changed her mind because she wanted to tell the truth.
“It was important for me because I don’t like lying about things,” she told E! News on May 8 during a performance for her new Fashion Nova collection.
Cardi said she also wants people to understand that liposuction results don’t happen immediately.
“Like when you see somebody that had lipo, you think that they just go into the doctor’s and like boop, you come out and you look amazing, and it’s actually like a very long process, recovery,” she said. “It actually takes like a little bit more than three or four months.”
“The stages are very frustrating,” she said. “Sometimes it gets a little bit discouraging. You have to get your massages all the time. And sometimes, it might not come out like you wanted it to be. But right now, I’m actually enjoying it.”
One issue she does have, though, is when people doubt that her ab muscles are real.
“What I don’t like is people who are like, ‘She did ab sketching.’ And it’s like, no no no,” she said. “I always had abs, and I’m a very skinny person so when they’re taking extra fat out and your skin is tightening more, like my bones actually show more.”
Back in August, one month after giving birth to her first child, daughter Kulture Kiari with husband Offset, Cardi floated the idea of getting liposuction.
“I still feel like I got a lot of love handles right here,” she said, while pulling on her tummy. “It’s not much, but it’s like — I’m used to having, like, a real tight stomach … I might just get a little lipo, you know what I’m sayin’?”
Two months later, in October, the “I Like It” rapper showed off her toned stomach on her Instagram Stories, but said it was all natural.
“I never did lipo, bro. Never,” she told the camera.
On May 1, she revealed that she had recently had a second breast augmentation.
“I just got my boobs redone,” she said. “I feel good, but then sometimes I feel like not, you know? [When] your skin is stretched out. Yes, my daughter f—ed me up. She did. She so did.”
A day later, Cardi wowed fans with her rock-hard abs at the Billboard Music Awards. Decked out in an ab-baring, two-piece yellow outfit, she went on to win six awards.",cardi-b-postpones-several-concerts-to-fully-recove,"""Cardi was overzealous in getting back to work, she didn't take the time necessary to full recover from her surgery,"" her rep tells PEOPLE
Sarah Michaud is the senior news editor of PEOPLE's music vertical. She has been working at PEOPLE for 18 years...",Cardi B Postpones Several Concerts to 'Fully Recover' from Plastic Surgery Procedures,"""Cardi was overzealous in getting back to work, she didn't take the time necessary to full recover from her surgery,"" her rep tells PEOPLE",,https://people.com/health/cardi-b-postpones-concerts-recover-plastic-surgery/,Cardi B Postpones Several Concerts to 'Fully Recover' from Plastic Surgery Procedures,"""Cardi was overzealous in getting back to work, she didn't take the time necessary to full recover from her surgery,"" her rep tells PEOPLE",https://people.com/thmb/gqtZ-uH-a_LyYuhaSl7rMLiL-jo=/1500x0/filters:no_upscale():max_bytes(150000):strip_icc():focal(999x0:1001x2)/60353125_10161770256725054_3667313424041246720_o-1-2000-5c7b47f9d92e4c60a5441677a29f41dc.jpg,,True,True,
355a686f63a5bbd25697b57001780b27,20260207182204,12,New Mom Cardi B Wants Liposuction to Get Rid of Her Post-Baby 'Love Handles',"Cardi B shared on Instagram that she's not happy with the ""love handles"" on her post-baby body and wants liposuction",Maura Hohman,entertainment,https://people.com/parents/cardi-b-liposuction-baby-weight-safety-expert-opinion/,https://people.com/thmb/WoVWqR0Ei5RlqcdEvfuktV2sPaA=/1500x0/filters:no_upscale():max_bytes(150000):strip_icc():focal(798x0:800x2)/cardi-b6-c30e934fcc2b46339cb24b555fae9f31.jpg,published,,2026-02-07T18:22:04.665816,2026-02-07T18:22:04.665816,0,"Cardi B shared on Instagram that she's not happy with the ""love handles"" on her post-baby body and wants liposuction
Adjusting to your new body after having a baby can be challenging, and new mom Cardi B is speaking out about this struggle — and considering taking matters into her own hands.
The 25-year-old rapper welcomed her first child, a baby girl named Kulture Kiari, with husband Offset on July 10. And just seven weeks later, she said in an Instagram Live video that she’s considering liposuction to remove some of the extra pounds and loose skin around her stomach.
“I still feel like I got a lot of love handles right here,” she said to the camera on Thursday as she pulled on her tummy. “It’s not much but it’s like — I’m used to having, like, a real tight stomach.”
The Bodak Yellow hitmaker also shared that she doesn’t have time to work out — “If I’m not working, I gotta make sure my baby’s okay,” she said — so she’s exploring a surgical option. “I might just get a little lipo, you know what I’m sayin’?” she told fans.
Want all the latest pregnancy and birth announcements, plus celebrity mom blogs? Click here to get those and more in the PEOPLE Parents newsletter.
But is liposuction a good idea only seven weeks after giving birth?
According to Mary Jane Minkin, MD, a practicing gynecologist and professor at Yale School of Medicine, the answer is no — largely because it just wouldn’t be effective. “Of course I would never encourage this!” she tells PEOPLE.
During pregnancy, a woman’s body gains weight “diffusely” so it’s all over the body, Dr. Minkin says, whereas liposuction targets weight in one specific part and it’s impractical to do it everywhere. What’s more, the stretched skin lots of moms have after pregnancy will not “disappear” with liposuction.
RELATED VIDEO: Cardi B Says She Hasn’t Gotten a Nanny for Daughter Kulture: I “Want to Learn How to Be a Mom”
“You can suck out some fat cells, but the skin will still be looser,” she explains. “And liposuction won’t tighten your muscles. Exercise will.”
She adds, “A fabulous way to lose weight after a baby is breastfeeding. You will feed the baby 500 calories or so a day initially. Then, as the baby grows, you will be feeding her up to 1,000 calories a day.”
Cardi B and Offset, 26, seem in awe of their baby girl. Just last week, the Grammy-nominated artist shared a sweet photo of herself and the Migos member looking down sweetly at their little one.
Although most of the baby’s face was cropped out, the proud mom did show the top of Kulture’s head and a tiny white bonnet. “KultureK,” she captioned the Instagram post.
Since giving birth in July, Cardi B has managed to keep Kulture out of the spotlight. However, she has shared a few glimpses with her fans.
On Friday, she posted a video of the back of Kulture’s head with a hand gently touching her, writing on her Instagram Story, “I love my grandpa.”
Earlier this month, the new mom posted an Instagram Story of her baby girl’s cute feet. “I got home at 8:30 a.m. from my flight she been up this whole time! I fed her twice and bath[e] her she ain’t with it,” Cardi B wrote over the black-and’white photo.",new-mom-cardi-b-wants-liposuction-to-get-rid-of-he,"Cardi B shared on Instagram that she's not happy with the ""love handles"" on her post-baby body and wants liposuction
Adjusting to your new body after having a baby can be challenging, and new mom Cardi B is speaking out about this struggle — and cons...",New Mom Cardi B Wants Liposuction to Get Rid of Her Post-Baby 'Love Handles',"Cardi B shared on Instagram that she's not happy with the ""love handles"" on her post-baby body and wants liposuction",,https://people.com/parents/cardi-b-liposuction-baby-weight-safety-expert-opinion/,New Mom Cardi B Wants Liposuction to Get Rid of Her Post-Baby 'Love Handles',"Cardi B shared on Instagram that she's not happy with the ""love handles"" on her post-baby body and wants liposuction",https://people.com/thmb/WoVWqR0Ei5RlqcdEvfuktV2sPaA=/1500x0/filters:no_upscale():max_bytes(150000):strip_icc():focal(798x0:800x2)/cardi-b6-c30e934fcc2b46339cb24b555fae9f31.jpg,,True,True,"https://tpc.googlesyndication.com/simgad/5747940643582955249?,https://people.com/thmb/QEUWjYKZ3TmHENvBqgXK2SAYnZo=/1500x0/filters:no_upscale():max_bytes(150000):strip_icc():focal(798x0:800x2):format(webp)/cardi-b6-c30e934fcc2b46339cb24b555fae9f31.jpg"
4ab93153184ce468a7278449cf6bc619,20260207182210,13,Cardi B Shares Scenes from Kulture's 7th Birthday Celebration on Private Plane as Offset Calls Daughter His 'Inspiration',"Cardi B and Offset are celebrating their little girl. On Thursday, July 10, Offset shared a touching tribute for his and the ""I Like It"" rapper's daughter Kulture's 7th birthday on his Instagram. The proud mom posted some special moments with her daughter on a private jet.",Kayla Grant,entertainment,https://people.com/offset-cardi-b-celebrate-daughter-kulture-7th-birthday-11770617,https://people.com/thmb/GuUlDRTIox63c75iBPMX5Wzs-6c=/1500x0/filters:no_upscale():max_bytes(150000):strip_icc():focal(758x236:760x238)/offset-cardi-b-kulture-71125-b6e218cc43c34cba9e7112fbf75dc904.jpg,published,,2026-02-07T18:22:10.507225,2026-02-07T18:22:10.507225,0,"The rappers welcomed their daughter in July 2018
Offset/Instagram; Santiago Felipe/Getty 
Cardi B and Offset are celebrating their little girl.
On Thursday, July 10, the Migos rapper, 33, shared a touching tribute for his and the ""I Like It"" rapper's daughter Kulture's 7th birthday on his Instagram. In the post, the proud dad included several pictures and videos throughout the years of his little girl, including one with him feeding her as a baby and another of her making snow angels during the winter.
""Kulture Kiari…. Happy birthday my angel from heaven…. my super star… my inspiration… daddy loves you and i am thankful for your beautiful pure soul… you are truly a blessing!!!"" he wrote in the caption. ""Time has gone so fast…. BIG 7 I can’t believe it already!!!!!!!!""
Never miss a story — sign up for PEOPLE's free daily newsletter to stay up-to-date on the best of what PEOPLE has to offer​​, from celebrity news to compelling human interest stories.  
Cardi B also shared a sneak peek of her daughter's birthday festivities via Instagram Stories.
In one of the clips, the 7-year-old can be seen enjoying some time with her friends while doing the whip and nae nae dance. The next video showed the birthday girl opening up some of her presents on a private jet.
The famed rapper is a father to six children. He shares three children with fellow rapper Cardi B: their daughter Blossom, 10 months, son Wave Set, 3, and Kulture. He also is a father to sons Kody, 10, and Jordan, 15, and daughter Kalea Marie, 9, from previous relationships.
When he spoke with PEOPLE in honor of his new collaboration with Doritos in September 2022, the ""Ric Flair Drip"" rapper opened up about balancing his career with being a father.
""Being a father's important to me personally,"" Offset said. ""For instance, there's a big party on Saturday, right? In Los Angeles. And my son Kody's first football game is on Sunday. There's no way I'm missing either event, so I'm going to have to make it work. It's priority to me.""
The PEOPLE App is now available in the Apple App Store! Download it now for the most binge-worthy celeb content, exclusive video clips, astrology updates and more!

In a 2019 cover story for Haute Living, the ""Swing My Way"" rapper opened up about how much he’s learned about being a parent since he welcomed his first child when he was 17.
“The journey of fatherhood was kind of tough for me at first,” Offset told the outlet. “I was trying to find myself. I didn’t have much direction on what it meant to be a father.”
“I definitely made some mistakes, but I have no regrets,” he continued, adding that things were especially difficult when his children were younger and he had to spend time away from them while performing across the country.
“It’s challenging when you have a career like this and you’re constantly on the road. It makes it tough to see your kids, especially when they’re young,” Offset explained. “Now that I’m older, though, I’m learning my way.”",cardi-b-shares-scenes-from-kultures-7th-birthday-c,"The rappers welcomed their daughter in July 2018
Offset/Instagram; Santiago Felipe/Getty 
Cardi B and Offset are celebrating their little girl.
On Thursday, July 10, the Migos rapper, 33, shared a touching tribute for his and the ""I Like It"" rapper's...",Cardi B Shares Scenes from Kulture's 7th Birthday Celebration on Private Plane as Offset Calls Daughter His 'Inspiration',"Cardi B and Offset are celebrating their little girl. On Thursday, July 10, Offset shared a touching tribute for his and the ""I Like It"" rapper's daughter Kulture's 7th birthday on his Instagram. The proud mom posted some special moments with her daughter on a private jet.",,https://people.com/offset-cardi-b-celebrate-daughter-kulture-7th-birthday-11770617,Cardi B Shares Scenes from Kulture's 7th Birthday Celebration on Private Plane as Offset Calls Daughter His 'Inspiration',"Cardi B and Offset are celebrating their little girl. On Thursday, July 10, Offset shared a touching tribute for his and the ""I Like It"" rapper's daughter Kulture's 7th birthday on his Instagram. The proud mom posted some special moments with her daughter on a private jet.",https://people.com/thmb/GuUlDRTIox63c75iBPMX5Wzs-6c=/1500x0/filters:no_upscale():max_bytes(150000):strip_icc():focal(758x236:760x238)/offset-cardi-b-kulture-71125-b6e218cc43c34cba9e7112fbf75dc904.jpg,,True,True,https://people.com/thmb/zcfGPppzoQ0YD022rYUvKrjMhYw=/1500x0/filters:no_upscale():max_bytes(150000):strip_icc():focal(758x236:760x238):format(webp)/offset-cardi-b-kulture-71125-b6e218cc43c34cba9e7112fbf75dc904.jpg
a039ee504b4328bd676b5be3d4de878e,20260207182214,14,Offset,"Offset (né Kiari Kendrell Cephus) is an American rapper. He is best known as a member of the hip-hop trio Migos, which first rose to fame with their 2013 single ""Versace."" He released his first solo album, 'Father of 4,' in 2019. He shares two kids with rapper Cardi B, whom he married in 2017.",People Staff,entertainment,https://people.com/tag/offset/,https://people.com/thmb/p59pCo344i0_rNdqBqhEEvBxyQM=/1500x0/filters:no_upscale():max_bytes(150000):strip_icc():focal(319x0:321x2)/people_social_image-60e0c8af9eb14624a5b55f2c29dbe25b.png,published,,2026-02-07T18:22:14.521198,2026-02-07T18:22:14.521198,0,,offset,...,Offset,"Offset (né Kiari Kendrell Cephus) is an American rapper. He is best known as a member of the hip-hop trio Migos, which first rose to fame with their 2013 single ""Versace."" He released his first solo album, 'Father of 4,' in 2019. He shares two kids with rapper Cardi B, whom he married in 2017.",,https://people.com/tag/offset/,Offset,"Offset (né Kiari Kendrell Cephus) is an American rapper. He is best known as a member of the hip-hop trio Migos, which first rose to fame with their 2013 single ""Versace."" He released his first solo album, 'Father of 4,' in 2019. He shares two kids with rapper Cardi B, whom he married in 2017.",https://people.com/thmb/p59pCo344i0_rNdqBqhEEvBxyQM=/1500x0/filters:no_upscale():max_bytes(150000):strip_icc():focal(319x0:321x2)/people_social_image-60e0c8af9eb14624a5b55f2c29dbe25b.png,,True,True,"https://people.com/thmb/NgK0CS4kO0Va7Kg-l8B7xt9iBZU=/364x242/filters:no_upscale():max_bytes(150000):strip_icc():format(webp)/cardi-b-stefon-diggs-offset-060325-db82a6c980e8415ca910c6be40ef7dea.jpg,https://people.com/thmb/MStsXlWqCC2TuKYMkhy8BnjG1Vw=/364x242/filters:no_upscale():max_bytes(150000):strip_icc():format(webp)/cardi-b-offset-kids-a19f8c8893b84c1b8f482b9ecf622c6d.jpg,https://people.com/thmb/RddgLyBMj9KQTPYP7P4xHD7kXAU=/364x242/filters:no_upscale():max_bytes(150000):strip_icc():format(webp)/Offset-and-his-daughters-Kulture-Kiari-Cephus-and-Kalea-Marie-Cephus-100825-d9d64dcbb3eb4a00b289df772e9c2255.jpg"
