id,run_id,row_id,title,description,source,category,link,image_url,status,scheduled_at,created_at,updated_at,likes,content,slug,excerpt,meta_title,meta_description,meta_keywords,canonical_url,og_title,og_description,og_image,focus_keyword,is_indexable,is_followable,images
1935ca67c6d74e701f3485b94952b147,20260207162940,56,Timothy Busfield Indicted by Grand Jury on 4 Counts of Criminal Sexual Contact with a Child,Timothy Busfield was released from the Albuquerque Metropolitan Detention Center in New Mexico on Jan. 20 after surrendering on an arrest warrant that alleged he sexually abused two minors on the set of a TV show.,Liza Esquibias,entertainment,https://people.com/timothy-busfield-indicted-grand-jury-four-counts-of-criminal-sexual-contact-with-a-child-11884890,https://people.com/thmb/kCTsBNaVOzO2JR5CYgooIlFLBsw=/1500x0/filters:no_upscale():max_bytes(150000):strip_icc():focal(797x447:799x449)/Timothy-Busfield-011326-3-85cdd5efbdc04cfc80ced351f4b9cfeb.jpg,published,,2026-02-07T16:29:40.073219,2026-02-07T16:29:40.073219,0,"Busfield was released from the Albuquerque Metropolitan Detention Center in New Mexico on Jan. 20 as he awaits trial for child sex abuse charges
Timothy Busfield has been indicted by a grand jury.
On Friday, Feb. 6, Bernalillo County District Attorney Sam Bregman announced that a Bernalillo County grand jury indicted Busfield, 68, on four charges.
The actor was indicted on four counts of criminal sexual contact of a child, according to Bregman. All four charges are third-degree felonies, according to court documents obtained by PEOPLE.
""As with all criminal proceedings, Mr. Busfield is presumed innocent unless and until proven guilty in a court of law,"" Bregman stated in the announcement which was shared on his social media account. ""This case will proceed through the judicial process and is expected to move forward to trial.""
The Special Victims Unit of the Bernalillo County District Attorney’s Office will be prosecutors on the case, per the statement, and Bregman ""emphasized that protecting children remains a top priority for his office.""
""The Bernalillo County District Attorney’s Office remains committed to doing everything possible to protect children and ensure justice for victims across New Mexico,"" the announcement concluded.
In a statement from Busfield's civil attorney Stanton ""Larry"" Stein, he said the ""indictment was not unexpected.""
""As the saying goes, a grand jury will indict a ham sandwich,"" the statement continued. ""What is deeply concerning is that the District Attorney is choosing to proceed on a case that is fundamentally unsound and cannot be proven at trial. The detention hearing exposed fatal weaknesses in the State’s evidence — gaps that no amount of charging decisions can cure. This prosecution appears driven by something other than the facts or the law. Mr. Busfield will fight these charges at every stage and looks forward to testing the State’s case in open court — where evidence matters — not behind closed doors.""
Busfield turned himself in and was booked by authorities on Jan. 13, just four days after the Albuquerque Police Department (APD) issued a warrant for his arrest, alleging that he engaged in unlawful sexual conduct with 11-year-old twin boys. 
The district attorney then filed a motion for pretrial detention against Busfield, which sought to keep him detained until trial. Because of New Mexico’s no-bond detention rule, defendants are otherwise released on recognizance (ROR), with or without conditions.
On Jan. 20, the Field of Dreams actor was released with conditions while he awaits trial, following a two-hour pretrial detention hearing in a San Bernalillo, New Mexico district court. His wife, Melissa Gilbert, was in attendance and was seen crying and whispering, ""Thank you, God,"" when the release was announced.
After being released on his own recognizance, Busfield has been ordered to appear for all his future court dates and is not allowed to possess any firearms or dangerous weapons, consume any alcohol or illegal drugs, have contact with the alleged victims or their families, discuss the case with any witnesses or have unsupervised contact with any minor children. The judge also allowed him to travel, but he will be under the supervision of Pretrial Services in New Mexico.
Busfield spoke out for the first time before surrendering on Jan. 13 in a video obtained by TMZ. ""I did not do anything,"" he said on camera. ""They're all lies and I did not do anything to those little boys and I'm gonna fight it. I'm gonna fight it with a great team, and I'm gonna be exonerated, I know I am, because this is all so wrong and all lies.""
Moments later, a rep for Gilbert issued a statement on the actress' behalf. ""During this period, her focus is on supporting and caring for their very large family, as they navigate this moment,"" the statement read, in part. ""Melissa stands with and supports her husband and will address the public at an appropriate time. We ask that their privacy be respected.”
Stephane Cardinale - Corbis/Corbis via Getty
Officer Marvin Brown, who issued the warrant for Busfield's arrest on Jan. 9, alleged that 11-year-old siblings were the subject of sexual misconduct by Busfield, and one alleged that the incidents began when he was 7 years old.
The warrant, which was obtained by PEOPLE, stated that the victims' parents told Brown that the minors met Busfield on the set of the FOX series The Cleaning Lady, where he served as a director and they were child actors. The television show ran from January 2022 until June 2025.
An investigation into Busfield began in November 2024 when a doctor at the University of New Mexico Hospital (UNMH) alerted police about alleged sexual abuse after the parents took their children to UNMH under advisement from an attorney, per the warrant. Professionals allegedly suggested the boys ""were groomed,"" the warrant said.
Brown said the siblings had not disclosed any sexual contact at this time, but both claimed Busfield “would tickle them on the stomach and legs.” It was later determined that the case did not meet authorities' acceptance criteria.
In October 2025 per the warrant, the victims' mother filed a police report and told Child Protective Services (CPS) that “her children both disclosed that there was sexual abuse by Timothy from around November 2022 to Spring 2024."" 
The mother told authorities on Sept. 2, 2025 and Sept. 22, 2025 that her son told his counselor that Busfield inappropriately touched him.
Busfield allegedly told police that the parents were upset their sons had been replaced with a younger actor who auditioned, according to the warrant. Soon after, he got a call from Warner Bros., informing him they were investigating a complaint against him.
A representative at Warner Bros. Television told PEOPLE in a statement, ""The health and safety of our cast and crew is always our top priority, especially the safety of minors on our productions. We take all allegations of misconduct very seriously and have systems in place to promptly and thoroughly investigate, and when needed, take appropriate action. [We] have been and will continue to cooperate with law enforcement.""
Never miss a story — sign up for PEOPLE's free daily newsletter to stay up-to-date on the best of what PEOPLE has to offer​​, from celebrity news to compelling human interest stories.
Busfield has also faced prior sexual assault allegations dating back to 1994, according to his warrant. 
In a pretrial detention motion filed on Jan. 14, Busfield faced another accusation of sexual abuse. ""Another victim's father,"" Colin Swift, reported to law enforcement on Jan. 13 that Busfield allegedly had sexually abused Swift's daughter ""several years ago"" in Sacramento, Calif., per the motion.
Busfield’s civil attorney Larry Stein told PEOPLE in a statement that the allegations ""were never challenged, they were never proved, and they’re 25 years old.""
If you suspect child abuse, call the Childhelp National Child Abuse Hotline at 1-800-4-A-Child or 1-800-422-4453, or go to www.childhelp.org. All calls are toll-free and confidential. The hotline is available 24/7 in more than 170 languages.",timothy-busfield-indicted-by-grand-jury-on-4-count,"Busfield was released from the Albuquerque Metropolitan Detention Center in New Mexico on Jan. 20 as he awaits trial for child sex abuse charges
Timothy Busfield has been indicted by a grand jury.
On Friday, Feb. 6, Bernalillo County District Attorne...",Timothy Busfield Indicted by Grand Jury on 4 Counts of Criminal Sexual Contact with a Child,Timothy Busfield was released from the Albuquerque Metropolitan Detention Center in New Mexico on Jan. 20 after surrendering on an arrest warrant that alleged he sexually abused two minors on the set of a TV show.,,https://people.com/timothy-busfield-indicted-grand-jury-four-counts-of-criminal-sexual-contact-with-a-child-11884890,Timothy Busfield Indicted by Grand Jury on 4 Counts of Criminal Sexual Contact with a Child,Timothy Busfield was released from the Albuquerque Metropolitan Detention Center in New Mexico on Jan. 20 after surrendering on an arrest warrant that alleged he sexually abused two minors on the set of a TV show.,https://people.com/thmb/kCTsBNaVOzO2JR5CYgooIlFLBsw=/1500x0/filters:no_upscale():max_bytes(150000):strip_icc():focal(797x447:799x449)/Timothy-Busfield-011326-3-85cdd5efbdc04cfc80ced351f4b9cfeb.jpg,,True,True,https://people.com/thmb/SzkV5xpgUIc1NAoYuRPN_cL3eEk=/1500x0/filters:no_upscale():max_bytes(150000):strip_icc():focal(797x447:799x449):format(webp)/Timothy-Busfield-011326-3-85cdd5efbdc04cfc80ced351f4b9cfeb.jpg
b627491c674e0d06fe92235e1637d578,20260207162943,57,"5 Lane Bryant Employees Inexplicably Killed in Illinois Store Subject of Documentary 18 Years Later, as $100,000 Reward Remains","Six women were tied up and shot in the back of the Lane Bryant store in Tinley Park, Ill., on Feb. 2, 2008. 18 years later, family and friends hope for answers as the search for the suspect continues, with a $100,000 reward on the table.",Angela Andaloro,entertainment,https://people.com/5-lane-bryant-employees-killed-in-illinois-store-subject-of-documentary-18-years-later-11899672,https://people.com/thmb/M_Lxr1EhSnaurIjPygjwHpz21Pk=/1500x0/filters:no_upscale():max_bytes(150000):strip_icc():focal(999x0:1001x2)/Lane-Bryant-case-victims-020426-a5a80f09a4eb4eae92d64db28fde1934.jpg,published,,2026-02-07T16:29:43.672877,2026-02-07T16:29:43.672877,0,"The crime continues to leave a mark on the Tinley Park community, though the store itself was repurposed in 2013 after sitting vacant for 6 years
Zbigniew Bzdak/Chicago Tribune/Tribune News Service via Getty
Family members of the victims of the Lane Bryant murders are continuing to look for answers.
On Feb. 2, 2008, an unknown suspect entered a Lane Bryant location in Tinley Park, Ill., where four employees were on shift, tending to two customers. The assailant, posing as a delivery driver, entered the store and tied up the six women inside.
Rhoda McFarland, 42; Connie Woolfolk, 37; Jennifer Bishop, 34; Carrie Chiuso, 33; Sarah Szafranski, 22, were all shot execution style and died of their injuries. The sixth woman shot, a part-time employee at the store who survived her injuries, has never been publicly identified by police. One of the women was also sexually assaulted by the suspect, though police have never revealed which of the victims was involved.
The surviving victim was able to relay details to police about the suspect's appearance, while his voice can be heard on a 911 call reporting the incident.

Never miss a story — sign up for PEOPLE's free daily newsletter to stay up-to-date on the best of what PEOPLE has to offer​​, from celebrity news to compelling human interest stories.  
The horrific crime, which changed countless lives that day, is the subject of an upcoming documentary by former America's Most Wanted producer Charlie Minn.
“The Tinley Park 5” is slated to debut Feb. 13 in a number of local theaters in the area. Minn told WBEZ Chicago that he's hoping ""to start some chatter here.""
""The whole point is to stir up enough attention, raise enough awareness, to solve the case... This case has faded, people are busy, they move on. I hope people see this and become as angry as I am about what happened.""
Also hopeful is Mike Hudek, brother of Carrie Chiuso, who continues to want answers for his family.
""I kind of had to forgive and let that go right after it happened, because I was going down that rabbit hole of why and what if and what could have been done, you can't undo what happened,"" Hudek told CBS News Chicago.
""This individual is not going to be caught until somebody speaks up or identifies who he is. I mean, he's somebody's son, grandson, nephew... whatever the case may be, somebody's aware of who this individual is.""
Hudek likes to remember his sister for the life she lived rather than the tragic manner in which it came to an end.
""We remember her in other ways. I mean, this is, of course, a tragic event, and we will certainly have a toast tonight in her honor around the dinner table,"" he said.
While the case remains unsolved, Tinley Park police ensure the investigation is still ongoing.
""This investigation has never stopped,” Police Chief Tom Tilton told ABC7 Chicago. “Our detectives and partners continue to evaluate leads, review evidence and apply available investigative and forensic tools as they evolve. This work occurs every day.”",5-lane-bryant-employees-inexplicably-killed-in-ill,"The crime continues to leave a mark on the Tinley Park community, though the store itself was repurposed in 2013 after sitting vacant for 6 years
Zbigniew Bzdak/Chicago Tribune/Tribune News Service via Getty
Family members of the victims of the Lane...","5 Lane Bryant Employees Inexplicably Killed in Illinois Store Subject of Documentary 18 Years Later, as $100,000 Reward Remains","Six women were tied up and shot in the back of the Lane Bryant store in Tinley Park, Ill., on Feb. 2, 2008. 18 years later, family and friends hope for answers as the search for the suspect continues, with a $100,000 reward on the table.",,https://people.com/5-lane-bryant-employees-killed-in-illinois-store-subject-of-documentary-18-years-later-11899672,"5 Lane Bryant Employees Inexplicably Killed in Illinois Store Subject of Documentary 18 Years Later, as $100,000 Reward Remains","Six women were tied up and shot in the back of the Lane Bryant store in Tinley Park, Ill., on Feb. 2, 2008. 18 years later, family and friends hope for answers as the search for the suspect continues, with a $100,000 reward on the table.",https://people.com/thmb/M_Lxr1EhSnaurIjPygjwHpz21Pk=/1500x0/filters:no_upscale():max_bytes(150000):strip_icc():focal(999x0:1001x2)/Lane-Bryant-case-victims-020426-a5a80f09a4eb4eae92d64db28fde1934.jpg,,True,True,https://people.com/thmb/i9SKk16EFqW13uHVJE-n0FCZFJQ=/1500x0/filters:no_upscale():max_bytes(150000):strip_icc():focal(999x0:1001x2):format(webp)/Lane-Bryant-case-victims-020426-a5a80f09a4eb4eae92d64db28fde1934.jpg
873b4f56488c442daefa8fe6509916b2,20260207162947,58,Hailee Steinfeld Reveals Simple Marriage Rules She Has with Husband Josh Allen,"Hailee Steinfeld shared the simple rules she and husband Josh Allen, quarterback for the NFL's Buffalo Bills, stick to in order to maintain their relationship with busy work schedules.",Tommy McArdle,entertainment,https://people.com/hailee-steinfeld-marriage-rule-husband-josh-allen-11901706,https://people.com/thmb/AAPe1LwCdcl4Vp8YhAZD3APBCTI=/1500x0/filters:no_upscale():max_bytes(150000):strip_icc():focal(999x0:1001x2)/Josh-Allen-Hailee-Steinfeld-121825-7d5611b2ca0e4c53a1222bc690a893a4.jpg,published,,2026-02-07T16:29:47.660874,2026-02-07T16:29:47.660874,0,"The actress and her NFL quarterback husband married in May 2025, and they announced they were expecting in December
Hailee Steinfeld and husband Josh Allen follow a few simple rules to stay present with each other in their marriage.
The Sinners actress, 29, responded to a question from a follower of her newsletter Beau Society about how she maintains ""an intentional relationship while both of you are so busy"" in the Friday, Feb. 6 edition of the newsletter.
""I love this question. There’s an easy answer in my brain. I don’t want it to seem cliché, but we focus on being truly present with each other,"" she wrote.
""More specifically, we’re big on weekly date nights and going no-phones for an hour at the end of the day.""
The actress-singer, who married Allen in May 2025, announced she was pregnant with their first child in December.

Never miss a story — sign up for PEOPLE's free daily newsletter to stay up-to-date on the best of what PEOPLE has to offer​​, from celebrity news to compelling human interest stories.
Allen, Buffalo's quarterback, led the Bills to a 27-24 win in the NFL playoffs' first round on Jan. 11 on the road against the Jacksonville Jaguars the same day Steinfeld appeared separately in Los Angeles to attend the Golden Globe Awards. 
Her film Sinners went on to break a record for the most Oscar nominations for a single movie — 16 total — on Jan. 22.
Allen took an opportunity to publicly share his affection for Steinfeld after he won that Jan. 11 playoff game. He shared a photo of Steinfeld on the red carpet at the Globes in chic maternity style to his Instagram Stories that night and left the emojis ""🤤😍,"" in a caption.

Earl Gibson III/2026GG/Penske Media via Getty; Timothy T Ludwig/Getty 
Allen announced Jan. 29 that he underwent surgery on a broken bone in his right foot to repair an injury he suffered in Week 16 of the NFL season. 

The couple's busy winter will wrap up in March, with Steinfeld expected to appear with Sinners' cast and crew at the Actor Awards (formerly SAG Awards) on March 1 and at the 98th Academy Awards on March 15. Steinfeld also introduced a paid subscription tier to her newsletter titled MORE BS on Feb. 3, which fans of hers can sign up for now.",hailee-steinfeld-reveals-simple-marriage-rules-she,"The actress and her NFL quarterback husband married in May 2025, and they announced they were expecting in December
Hailee Steinfeld and husband Josh Allen follow a few simple rules to stay present with each other in their marriage.
The Sinners actre...",Hailee Steinfeld Reveals Simple Marriage Rules She Has with Husband Josh Allen,"Hailee Steinfeld shared the simple rules she and husband Josh Allen, quarterback for the NFL's Buffalo Bills, stick to in order to maintain their relationship with busy work schedules.",,https://people.com/hailee-steinfeld-marriage-rule-husband-josh-allen-11901706,Hailee Steinfeld Reveals Simple Marriage Rules She Has with Husband Josh Allen,"Hailee Steinfeld shared the simple rules she and husband Josh Allen, quarterback for the NFL's Buffalo Bills, stick to in order to maintain their relationship with busy work schedules.",https://people.com/thmb/AAPe1LwCdcl4Vp8YhAZD3APBCTI=/1500x0/filters:no_upscale():max_bytes(150000):strip_icc():focal(999x0:1001x2)/Josh-Allen-Hailee-Steinfeld-121825-7d5611b2ca0e4c53a1222bc690a893a4.jpg,,True,True,https://people.com/thmb/jBqWuL58lyzs14NxCNoLwr_RkQ8=/1500x0/filters:no_upscale():max_bytes(150000):strip_icc():focal(999x0:1001x2):format(webp)/Josh-Allen-Hailee-Steinfeld-121825-7d5611b2ca0e4c53a1222bc690a893a4.jpg
03ff649dbb19d00d309d46cec8d0229b,20260207162950,59,"Stephen Colbert Surprises Wife Evie McGee Colbert with a $250,000 Tiffany Necklace for Valentine's Day","Stephen Colbert had a special Valentine's Day surprise lined up for his wife, Evie McGee Colbert. The Late Show host featured his wife on the show on Feb. 5, and presented her with a stunning Tiffany necklace — with a catch.",Rachel Raposas,entertainment,https://people.com/stephen-colbert-gifts-wife-evie-mcgee-colbert-tiffany-necklace-valentines-day-11901120,https://people.com/thmb/_xre_DGXQw1nv3snfRL5nBfDBz0=/1500x0/filters:no_upscale():max_bytes(150000):strip_icc():focal(749x0:751x2)/Stephen-Colbert-Invites-Wife-Evie-McGee-Colbert-on-Air-for-Valentines-Day-and-Gives-Her-Tiffany-Necklace-020626-1-8999dab94fec4c75af9dd75340d1d167.jpg,published,,2026-02-07T16:29:50.786647,2026-02-07T16:29:50.786647,0,"'Who'd you have to rob to pay for this?' Evie joked
Mike Coppola/Getty; The Late Show with Stephen Colbert
Diamonds are the Colberts' best friends!
Stephen Colbert, 61, demonstrated his impeccable taste in jewels on the Thursday, Feb. 5 episode of The Late Show when he invited his wife, Evie McGee Colbert, to join him on air as part of his comedic ""First Drafts"" segment. Stephen — who has been married to the actress for more than three decades — had a surprise in store for Evie: a tell-tale Tiffany Blue box.
""Of course it wouldn't be Valentine's Day,"" Stephen began, already shouting over building applause, ""without my wife, Evie!""
Cheers erupted as Evie, clad in a ruched pink floral dress, walked on stage, and the actress greeted her husband with a kiss before waving to the crowd.
Even though there were still nine days until Valentine's Day, Stephen apparently couldn't wait another second to present Evie with a large, square Tiffany box — and Evie's eyes widened at the sight of it. The pair playfully squabbled about who got to open the gift, and ultimately Stephen untied the bow and undid the package to reveal a stunning Tiffany & Co. necklace.
The Late Show with Stephen Colbert
""This is real. This is from Tiffany,"" Stephen said, as he unveiled the sparkling necklace, a bold statement piece featuring unique chain links featuring tons of pave diamonds.
""Holy s***!"" Evie gasped as she grew giddy with joy. ""Can I touch it?"" she asked, though Stephen did her one better as he stood to drape the necklace around her. ""Happy Valentine's Day,"" he added as Evie beamed.
""Who'd you have to rob to pay for this?"" Evie joked. She then mused aloud if he (or she) did something wrong, speculating that the necklace may have been some sort of apology gift.
Once Stephen clarified that no, he didn't do anything wrong and no, it wasn't an extra sparkly apology, he revealed the catch: the necklace is a loan from Tiffany, which sent a set of ""armed guards"" to protect the necklace for the seven minutes it hung around Evie's neck (or ""however long the joke lasts,"" Stephen added).
Evie let out a huge laugh as Stephen said, ""That's, like, a quarter of a million-dollar necklace,"" His wife immediately joked, ""Take it off!""
Stephen then made light of his show's soon-approaching end, which parent company CBS decided to conclude in May 2026 as a ""purely financial decision,"" per its announcement in July 2025.
""I was going to charge [the necklace] to CBS, but they seem a little tight on cash right now,"" Stephen joked, drawing raucous laughter from the audience.
Never miss a story — sign up for PEOPLE's free daily newsletter to stay up-to-date on the best of what PEOPLE has to offer, from celebrity news to compelling human interest stories.
Later in the segment, Stephen and Evie — who tied the knot in October 1993 and have since welcomed three children together — read off the list of qualities that the actress's 12-year-old self once considered to make the ""perfect guy.""
Her ideal man would have a ""good personality"" and be a person with humor, generosity, kindness. He should also be ""daring"" and ""fun-loving"" — and last but not least, Evie once wrote, he should be an ""all-out man.""
To that, Stephen dramatically whipped off his glasses, stared into the camera and said, ""I'm an all-in man.""",stephen-colbert-surprises-wife-evie-mcgee-colbert-,"'Who'd you have to rob to pay for this?' Evie joked
Mike Coppola/Getty; The Late Show with Stephen Colbert
Diamonds are the Colberts' best friends!
Stephen Colbert, 61, demonstrated his impeccable taste in jewels on the Thursday, Feb. 5 episode of Th...","Stephen Colbert Surprises Wife Evie McGee Colbert with a $250,000 Tiffany Necklace for Valentine's Day","Stephen Colbert had a special Valentine's Day surprise lined up for his wife, Evie McGee Colbert. The Late Show host featured his wife on the show on Feb. 5, and presented her with a stunning Tiffany necklace — with a catch.",,https://people.com/stephen-colbert-gifts-wife-evie-mcgee-colbert-tiffany-necklace-valentines-day-11901120,"Stephen Colbert Surprises Wife Evie McGee Colbert with a $250,000 Tiffany Necklace for Valentine's Day","Stephen Colbert had a special Valentine's Day surprise lined up for his wife, Evie McGee Colbert. The Late Show host featured his wife on the show on Feb. 5, and presented her with a stunning Tiffany necklace — with a catch.",https://people.com/thmb/_xre_DGXQw1nv3snfRL5nBfDBz0=/1500x0/filters:no_upscale():max_bytes(150000):strip_icc():focal(749x0:751x2)/Stephen-Colbert-Invites-Wife-Evie-McGee-Colbert-on-Air-for-Valentines-Day-and-Gives-Her-Tiffany-Necklace-020626-1-8999dab94fec4c75af9dd75340d1d167.jpg,,True,True,https://people.com/thmb/-H1o1_0PWQco2M-mWHgJiQpfYJ8=/1500x0/filters:no_upscale():max_bytes(150000):strip_icc():focal(749x0:751x2):format(webp)/Stephen-Colbert-Invites-Wife-Evie-McGee-Colbert-on-Air-for-Valentines-Day-and-Gives-Her-Tiffany-Necklace-020626-1-8999dab94fec4c75af9dd75340d1d167.jpg
